4Mó§ÌÄÿ1ñü,.òEˆgÊàâ:+žç‘À$ƒâtraffic_id,date_time,city,area,vehicle_count,road_condition,avg_speed_kmh,congestion_level,accident_count,visibility_m
,2024-01-01 00:00,London,Camden,390.0,Snowy,,Low,0.0,10000.0
9002.0,2024-01-01 02:00,London,Camden,49.0,Dry,,Low,,10000.0
9003.0,2024-01-01 04:00,London,,432.0,Snowy,48.83,Low,59.20130307381754,120016.56640490764
9004.0,2024-01-01 06:00,London,Islington,884.0,Dry,83.27,Low,0.0,120024.41519141721
9005.0,2024-01-01 08:00,London,Greenwich,3382.0,Dry,,,0.0,10000.0
,2024-01-01T10:00Z,London,Greenwich,30019.581004386277,Snowy,3.0,High,0.0,
9007.0,2024-01-01T12:00Z,London,Kensington,1831.0,Dry,,Low,0.0,10000.0
9008.0,2024-01-01 14:00,London,Kensington,1978.0,Snowy,16.39,Medium,0.0,10000.0
9009.0,,London,Westminster,2069.0,Snowy,29.67,Medium,67.48807125524232,
9010.0,2024-01-01 18:00,London,,4672.0,Dry,15.45,High,0.0,10000.0
9011.0,2024-01-01 20:00,London,Southwark,1716.0,Snowy,24.47,Medium,0.0,10000.0
9012.0,01/01/2024 10PM,London,Westminster,2267.0,Dry,50.48,Medium,0.0,10000.0
9013.0,02/01/2024 12AM,,,294.0,Wet,53.06,Low,0.0,120010.65686931451
9014.0,2024-01-02 02:00,London,Islington,,Dry,505.4757963669078,Low,,120016.70693025966
9015.0,2024-01-02 04:00,London,Islington,95.0,Dry,68.98,Low,0.0,10000.0
,02/01/2024 06AM,London,,1984.0,,22.5,Medium,0.0,
9017.0,2024-01-02T08:00Z,London,Camden,19993.390770006346,Dry,10.64,High,0.0,120001.4724597372
9018.0,2024-01-02T10:00Z,London,,1722.0,Dry,31.67,Medium,0.0,10000.0
9019.0,2024-01-02T12:00Z,London,Camden,1686.0,Dry,38.03,Medium,0.0,10000.0
9020.0,2024-01-02 14:00,London,Greenwich,2399.0,,23.7,Medium,0.0,
9021.0,2024-01-02T16:00Z,London,Islington,4967.0,Dry,23.55,High,0.0,10000.0
9022.0,02/01/2024 06PM,London,Kensington,19992.901599910077,Dry,16.45,High,,10000.0
9023.0,2024-01-02T20:00Z,London,Southwark,1736.0,Dry,51.3,Medium,0.0,10000.0
9024.0,2024-01-02 22:00,London,Southwark,826.0,Dry,68.87,Low,,10000.0
9025.0,2024-01-03T00:00Z,London,,,,-5.119614116021854,Low,0.0,
,2024-01-03T02:00Z,London,Islington,19992.959852684737,Dry,23.96,High,1.0,10000.0
9027.0,03/01/2024 04AM,London,Kensington,19985.744596916393,Dry,,High,1.0,10000.0
9028.0,2024-01-03T06:00Z,London,,814.0,Dry,60.56,Low,0.0,10000.0
9029.0,2024-01-03T08:00Z,London,Islington,3471.0,Wet,14.17,High,72.93632330558502,120009.92279471006
,2024-01-03 10:00,London,Southwark,986.0,Dry,65.36,Low,-1.8784678725087138,120014.63144518921
9031.0,2024-01-03T12:00Z,London,Westminster,2429.0,Dry,48.52,Medium,,10000.0
9032.0,03/01/2024 02PM,London,Westminster,19986.275993709143,Dry,15.61,High,1.0,10000.0
9033.0,2024-01-03T16:00Z,London,Camden,2476.0,Dry,44.2,Medium,0.0,10000.0
9034.0,2024-01-03T18:00Z,London,Westminster,4591.0,,7.78,High,0.0,10000.0
9035.0,03/01/2024 08PM,London,Southwark,,Dry,97.42,Low,5.966400291547892,10000.0
9036.0,2024-01-03T22:00Z,London,Camden,,Dry,-1.5476683576635288,Low,0.0,10000.0
9037.0,2024-01-04T00:00Z,London,Chelsea,201.0,Dry,-22.438705417663943,High,0.0,10000.0
9038.0,2024-01-04 02:00,London,Greenwich,30010.66415730293,Snowy,,High,1.0,10000.0
9039.0,2024-01-04 04:00,London,Camden,409.0,Damaged,35.06,Low,0.0,10000.0
9040.0,2024-01-04 06:00,London,Kensington,30006.902309221747,Snowy,3.14,High,2.0,10000.0
,2024-01-04 08:00,London,Camden,3841.0,Dry,18.93,High,1.0,10000.0
9042.0,04/01/2024 10AM,London,Southwark,2479.0,,12.75,High,2.0,
9043.0,04/01/2024 12PM,London,Westminster,,Snowy,52.42,Low,2.0,120014.24032156683
9044.0,2024-01-04 14:00,London,,1291.0,Dry,92.21,,11.597993848648205,10000.0
,2024-01-04 16:00,,Islington,19992.536190549778,Dry,20.77,High,0.0,10000.0
9046.0,2024-01-04T18:00Z,,Islington,2460.0,,26.59,Medium,0.0,10000.0
9047.0,04/01/2024 08PM,London,Westminster,2080.0,Wet,29.81,,1.0,10000.0
9048.0,2024-01-04T22:00Z,London,,1342.0,Dry,79.16,Low,0.0,10000.0
9049.0,2024-01-05T00:00Z,London,Westminster,30000.5051316886,Dry,3.0,High,0.0,10000.0
9050.0,2024-01-05 02:00,London,Kensington,163.0,Dry,73.18,Low,0.0,10000.0
9051.0,2024-01-05 04:00,London,Camden,52.0,Dry,56.31,Low,0.0,10000.0
9052.0,2024-01-05 06:00,London,Southwark,2329.0,Wet,20.57,Medium,0.0,49999.17556789583
9053.0,2024-01-05T08:00Z,,Chelsea,2573.0,Wet,,Low,0.0,10000.0
9054.0,2024-01-05 10:00,London,Kensington,2449.0,Dry,32.03,Medium,1.0,10000.0
9055.0,,London,Southwark,1270.0,Dry,74.9,Low,0.0,10000.0
9056.0,2024-01-05 14:00,London,Westminster,19991.771236299654,,21.62,High,0.0,120012.38660667103
,05/01/2024 04PM,,Kensington,4676.0,Dry,,High,0.0,10000.0
9058.0,2024-01-05 18:00,London,Greenwich,2375.0,Snowy,26.68,Medium,0.0,10000.0
9059.0,2024-01-05T20:00Z,London,Westminster,1879.0,Dry,55.03,Medium,1.0,10000.0
9060.0,05/01/2024 10PM,London,Islington,2248.0,Dry,58.17,Medium,0.0,10000.0
9061.0,2024-01-06T00:00Z,London,Islington,152.0,Dry,502.3665229156536,Low,0.0,10000.0
9062.0,06/01/2024 02AM,London,Southwark,373.0,Dry,63.29,Low,0.0,10000.0
9063.0,06/01/2024 04AM,London,Westminster,75.0,Dry,56.29,Low,0.0,10000.0
9064.0,2024-01-06T06:00Z,London,Chelsea,1365.0,Dry,80.04,Low,0.0,10000.0
9065.0,06/01/2024 08AM,London,Chelsea,2106.0,Dry,39.08,Medium,0.0,10000.0
9066.0,2024-01-06T10:00Z,,,978.0,Dry,78.67,Low,0.0,49983.912527545326
,2024-01-06T12:00Z,London,Islington,1445.0,Dry,73.14,Low,0.0,10000.0
9068.0,06/01/2024 02PM,London,Islington,1894.0,Dry,47.51,Medium,0.0,10000.0
9069.0,06/01/2024 04PM,London,Islington,2524.0,Dry,,,0.0,10000.0
9070.0,2024-01-06T18:00Z,London,Camden,4064.0,Wet,516.6633764667075,High,0.0,10000.0
9071.0,2024-01-06T20:00Z,London,Islington,19983.252319021252,Dry,7.05,High,0.0,120016.68079737468
9072.0,2024-01-06T22:00Z,London,Greenwich,2157.0,Dry,41.1,Medium,0.0,10000.0
9073.0,2024-01-07 00:00,London,Kensington,205.0,Dry,80.19,,0.0,10000.0
9074.0,2024-01-07T02:00Z,London,Chelsea,221.0,Dry,60.6,Low,0.0,10000.0
9075.0,2024-01-07T04:00Z,London,Camden,151.0,Dry,,Low,0.0,49980.82795512434
9076.0,07/01/2024 06AM,London,,1481.0,Dry,,Low,0.0,10000.0
,07/01/2024 08AM,London,,2495.0,Dry,42.27,Medium,,10000.0
9078.0,2099-13-40 25:61,London,Westminster,,Dry,69.06,Low,0.0,10000.0
,07/01/2024 12PM,London,Camden,1352.0,,82.59,Low,0.0,10000.0
9080.0,07/01/2024 02PM,London,Southwark,1587.0,Dry,43.16,,0.0,
9081.0,,London,,2507.0,Wet,519.4370004975073,Medium,9.118434989448245,10000.0
9082.0,07/01/2024 06PM,London,Greenwich,3696.0,Snowy,3.0,High,0.0,10000.0
9083.0,2024-01-07T20:00Z,London,Chelsea,1442.0,,69.02,Low,54.83017656665628,10000.0
9084.0,07/01/2024 10PM,London,Chelsea,2485.0,Dry,,Low,0.0,
,08/01/2024 12AM,London,Chelsea,27.0,Dry,76.15,,0.0,10000.0
9086.0,2024-01-08 02:00,London,Greenwich,365.0,Dry,65.57,Low,2.0,10000.0
9087.0,2024-01-08T04:00Z,London,Southwark,62.0,Wet,49.65,Low,0.0,10000.0
9088.0,2024-01-08T06:00Z,London,Westminster,,Snowy,63.33,Low,0.0,10000.0
9089.0,2024-01-08T08:00Z,,Westminster,19987.989244013028,Wet,3.0,High,1.0,10000.0
9090.0,2024-01-08T10:00Z,London,Southwark,1070.0,Dry,83.66,Low,0.0,10000.0
9091.0,08/01/2024 12PM,London,Camden,1668.0,Dry,49.45,Medium,,10000.0
9092.0,2024-01-08 14:00,,Chelsea,30013.390577871927,Snowy,3.0,High,,10000.0
9093.0,2024-01-08 16:00,,Southwark,2363.0,Dry,37.99,Medium,0.0,10000.0
9094.0,,London,,1501.0,Dry,51.68,Medium,0.0,10000.0
9095.0,,London,Greenwich,30008.898259129463,Snowy,7.61,High,0.0,
9096.0,2024-01-08T22:00Z,London,,1187.0,Snowy,,Low,0.0,10000.0
9097.0,2024-01-09 00:00,London,Greenwich,466.0,Dry,65.12,Low,0.0,10000.0
9098.0,09/01/2024 02AM,London,Camden,208.0,,39.38,Low,0.0,10000.0
9099.0,2024-01-09T04:00Z,,Islington,439.0,Dry,73.95,Low,0.0,10000.0
9100.0,2024-01-09 06:00,London,Chelsea,2270.0,Dry,49.08,,0.0,10000.0
9101.0,2024-01-09 08:00,London,Greenwich,3326.0,Dry,20.11,Medium,0.0,10000.0
,2024-01-09 10:00,London,Kensington,2310.0,,39.34,Medium,0.0,10000.0
9103.0,2024-01-09 12:00,London,Greenwich,2307.0,Snowy,25.62,Medium,0.0,10000.0
9104.0,,London,Westminster,1450.0,Dry,70.86,Low,0.0,10000.0
9105.0,2024-01-09T16:00Z,London,Greenwich,3717.0,,18.98,High,,
9106.0,,London,Southwark,977.0,Dry,62.67,Low,0.0,10000.0
9107.0,09/01/2024 08PM,London,Chelsea,1379.0,Dry,-6.244675015934234,High,0.0,10000.0
9108.0,2024-01-09T22:00Z,London,Greenwich,1843.0,,54.97,Medium,0.0,10000.0
9109.0,2024-01-10 00:00,London,Chelsea,34.0,Dry,50.58,Low,0.0,
9110.0,10/01/2024 02AM,London,Camden,115.0,Dry,94.26,Low,0.0,10000.0
9111.0,2024-01-10 04:00,London,Camden,300.0,Wet,65.33,Low,0.0,10000.0
9112.0,2024-01-10T06:00Z,London,Camden,1225.0,,516.1712329971173,Low,0.0,120012.61039427761
,,,Greenwich,2241.0,Dry,42.03,Medium,0.0,10000.0
9114.0,2024-01-10T10:00Z,London,Kensington,1630.0,Damaged,4.94,High,1.0,10000.0
9115.0,2024-01-10T12:00Z,London,Chelsea,1729.0,Wet,29.85,Medium,0.0,120004.0823586167
9116.0,,London,Greenwich,1495.0,Snowy,,Low,0.0,10000.0
9117.0,2024-01-10T16:00Z,,Islington,2635.0,Snowy,501.84289183753606,Medium,0.0,
,10/01/2024 06PM,London,Westminster,4331.0,Dry,,High,0.0,10000.0
9119.0,,,Southwark,399.0,Dry,,Low,0.0,10000.0
9120.0,2024-01-10T22:00Z,London,Chelsea,1770.0,Snowy,13.54,High,0.0,10000.0
9121.0,2024-01-11T00:00Z,London,Chelsea,19994.677445576017,Dry,12.07,High,0.0,10000.0
9122.0,2024-01-11 02:00,,Kensington,30016.47027772291,Dry,,High,0.0,10000.0
9123.0,2024-01-11T04:00Z,London,Southwark,30015.431710313325,Dry,25.85,,0.0,10000.0
9124.0,,London,Westminster,2819.0,Dry,35.48,Medium,0.0,10000.0
9125.0,11/01/2024 08AM,London,Kensington,19984.97422267036,Dry,31.71,High,0.0,49977.45127874896
9126.0,2024-01-11T10:00Z,London,Westminster,951.0,Snowy,49.35,Low,2.0,10000.0
9127.0,2024-01-11T12:00Z,London,Islington,801.0,Snowy,34.56,Medium,0.0,10000.0
9128.0,2024-01-11T14:00Z,London,Southwark,2260.0,Dry,523.506311802266,Medium,0.0,10000.0
9129.0,2024-01-11T16:00Z,London,Kensington,,Dry,506.7149402802191,,0.0,
9130.0,2024-01-11 18:00,London,Islington,3301.0,Dry,34.37,Medium,0.0,
9131.0,2024-01-11T20:00Z,London,,2308.0,Dry,,Low,2.0,10000.0
9132.0,2024-01-11 22:00,London,Camden,,Dry,82.59,Low,0.0,10000.0
9133.0,2024-01-12T00:00Z,London,Chelsea,404.0,Wet,67.84,Low,,10000.0
9134.0,2024-01-12 02:00,London,Islington,345.0,Wet,38.54,Low,0.0,10000.0
9135.0,2024-01-12T04:00Z,London,Westminster,285.0,Dry,61.66,Low,0.0,120016.16907787455
9136.0,2024-01-12T06:00Z,London,Westminster,30005.558679683734,Dry,27.3,High,,10000.0
,TBD,London,Southwark,2289.0,,18.03,Medium,0.0,10000.0
9138.0,TBD,London,,962.0,Dry,,Low,0.0,10000.0
9139.0,2024-01-12 12:00,London,Camden,940.0,Damaged,47.18,Low,2.0,
9140.0,2024-01-12T14:00Z,London,Westminster,1112.0,,76.28,Low,0.0,10000.0
9141.0,2024-01-12T16:00Z,London,Camden,2690.0,Dry,37.69,Medium,3.0,10000.0
9142.0,2024-01-12 18:00,London,Camden,3729.0,,8.03,High,0.0,49986.74046566232
9143.0,2024-01-12 20:00,London,Chelsea,2335.0,Wet,33.62,Medium,0.0,10000.0
9144.0,2024-01-12T22:00Z,London,Camden,1148.0,Dry,65.29,,2.0,10000.0
,2024-01-13T00:00Z,London,Southwark,242.0,Dry,84.49,Low,,49980.30450917782
9146.0,2024-01-13 02:00,London,Chelsea,461.0,Dry,55.02,Low,0.0,
9147.0,2024-01-13T04:00Z,London,Islington,159.0,Dry,87.42,Low,,10000.0
9148.0,2024-01-13 06:00,London,Islington,1497.0,Wet,77.93,Low,0.0,10000.0
9149.0,2024-01-13T08:00Z,London,Greenwich,4697.0,Dry,23.83,,0.0,10000.0
9150.0,2024-01-13 10:00,London,Southwark,1500.0,Dry,46.54,Low,0.0,10000.0
,2024-01-13 12:00,,Chelsea,1023.0,Dry,,,,10000.0
9152.0,2024-01-13T14:00Z,,Greenwich,,Dry,68.39,Low,0.0,10000.0
9153.0,13/01/2024 04PM,,Greenwich,2103.0,Snowy,22.23,Medium,0.0,10000.0
9154.0,13/01/2024 06PM,London,Greenwich,,Dry,-8.147279853063036,Low,0.0,10000.0
9155.0,2024-01-13 20:00,,Greenwich,19984.493447277047,Dry,518.8677204308937,High,0.0,10000.0
9156.0,,London,Kensington,2948.0,Wet,23.36,,0.0,10000.0
9157.0,2024-01-14T00:00Z,London,Greenwich,,Dry,81.39,,0.0,10000.0
9158.0,2024-01-14 02:00,London,Camden,225.0,Dry,91.98,Low,1.0,10000.0
9159.0,14/01/2024 04AM,,Kensington,321.0,Dry,502.5464227529123,Low,0.0,
9160.0,14/01/2024 06AM,London,Chelsea,1357.0,Dry,85.23,Low,0.0,10000.0
,2024-01-14 08:00,London,Southwark,3135.0,Dry,19.84,Medium,0.0,10000.0
9162.0,2024-01-14T10:00Z,London,Kensington,2039.0,Snowy,31.45,Medium,,10000.0
9163.0,2024-01-14T12:00Z,London,Chelsea,2263.0,Dry,39.76,Medium,0.0,49983.59787065021
9164.0,2024-01-14 14:00,London,Camden,1175.0,Dry,79.09,Low,0.0,10000.0
9165.0,2024-01-14 16:00,London,Southwark,4994.0,Dry,518.6914364848883,High,0.0,10000.0
9166.0,14/01/2024 06PM,London,Greenwich,4963.0,Dry,22.79,High,,10000.0
9167.0,2024-01-14 20:00,London,Camden,1338.0,,62.62,,0.0,10000.0
9168.0,2024-01-14 22:00,,,1617.0,Wet,19.38,Medium,0.0,10000.0
,15/01/2024 12AM,,Southwark,484.0,Wet,64.68,Low,0.0,10000.0
9170.0,2024-01-15 02:00,London,Westminster,437.0,Dry,76.47,Low,,10000.0
9171.0,2024-01-15T04:00Z,London,Islington,370.0,Dry,81.18,Low,,10000.0
9172.0,15/01/2024 06AM,London,Islington,1003.0,Dry,64.72,Low,0.0,10000.0
,2024-01-15 08:00,London,Greenwich,4817.0,Snowy,3.0,High,0.0,10000.0
9174.0,2024-01-15T10:00Z,London,Kensington,2192.0,Dry,500.8987415923419,Medium,0.0,10000.0
9175.0,2024-01-15 12:00,London,Islington,1616.0,Dry,27.66,Medium,0.0,10000.0
9176.0,15/01/2024 02PM,London,Westminster,1044.0,Dry,48.38,Low,0.0,10000.0
9177.0,2024-01-15 16:00,London,Southwark,2372.0,Dry,39.45,,0.0,10000.0
9178.0,2024-01-15T18:00Z,,Westminster,3500.0,Wet,17.62,Medium,1.0,10000.0
9179.0,Unknown,London,Southwark,1065.0,Dry,,Low,0.0,10000.0
9180.0,2024-01-15T22:00Z,London,Southwark,867.0,Wet,68.09,Low,1.0,10000.0
9181.0,2024-01-16 00:00,London,,,Dry,-3.419691063070868,Low,0.0,10000.0
9182.0,2024-01-16 02:00,London,Camden,498.0,Dry,79.0,Low,,10000.0
9183.0,16/01/2024 04AM,London,Chelsea,283.0,Dry,78.57,,0.0,10000.0
9184.0,2024-01-16 06:00,London,,2480.0,Snowy,34.65,Medium,72.20007542580672,
9185.0,2024-01-16T08:00Z,London,Westminster,2122.0,Dry,37.82,Medium,0.0,49993.747061219074
9186.0,16/01/2024 10AM,London,,2113.0,Dry,33.4,Medium,0.0,10000.0
9187.0,,London,Kensington,1893.0,Dry,32.52,Medium,0.0,10000.0
9188.0,2024-01-16 14:00,London,Camden,1146.0,Wet,47.53,Low,0.0,
9189.0,16/01/2024 04PM,London,Greenwich,19975.978919529163,Snowy,8.95,High,0.0,10000.0
9190.0,,,Islington,2708.0,Snowy,27.74,Medium,0.0,10000.0
9191.0,2024-01-16T20:00Z,,Kensington,2413.0,Snowy,31.69,Medium,0.0,10000.0
9192.0,2024-01-16T22:00Z,London,Chelsea,1699.0,Dry,36.29,Medium,0.0,
,17/01/2024 12AM,London,Southwark,30007.414917674836,Dry,23.5,High,0.0,10000.0
9194.0,2024-01-17 02:00,London,Westminster,315.0,Dry,65.69,,0.0,10000.0
9195.0,17/01/2024 04AM,London,Westminster,113.0,Damaged,,Low,0.0,10000.0
9196.0,,London,,,Damaged,47.44,Low,0.0,10000.0
9197.0,2024-01-17T08:00Z,,Southwark,4337.0,Dry,23.22,High,1.0,10000.0
9198.0,17/01/2024 10AM,London,,908.0,,65.18,Low,,10000.0
9199.0,,London,Greenwich,1822.0,Dry,34.35,Medium,0.0,10000.0
9200.0,17/01/2024 02PM,London,Westminster,1077.0,Dry,,Low,0.0,10000.0
9201.0,2024-01-17T16:00Z,London,Southwark,4667.0,Dry,23.48,High,,10000.0
9202.0,2024-01-17 18:00,London,Kensington,4762.0,Dry,15.59,High,2.0,10000.0
9203.0,17/01/2024 08PM,London,Chelsea,1406.0,Dry,,Low,0.0,10000.0
9204.0,2024-01-17 22:00,London,Chelsea,1903.0,Dry,33.02,Medium,0.0,49987.61346701897
9205.0,2024-01-18T00:00Z,London,Chelsea,478.0,Dry,73.48,Low,0.0,10000.0
9206.0,2024-01-18 02:00,London,Camden,485.0,Dry,85.4,Low,0.0,10000.0
9207.0,,,,,Dry,73.88,Low,57.96365404571543,10000.0
9208.0,2024-01-18 06:00,London,Southwark,2135.0,Dry,37.37,Medium,0.0,10000.0
9209.0,18/01/2024 08AM,London,Camden,3698.0,Dry,11.61,High,0.0,
9210.0,2024-01-18 10:00,London,Southwark,2463.0,Damaged,32.57,Medium,0.0,10000.0
9211.0,2024-01-18T12:00Z,London,,2293.0,Dry,40.79,Medium,62.704065913708945,10000.0
,,London,Greenwich,30022.20076695212,,35.4,High,0.0,10000.0
,2024-01-18T16:00Z,London,Camden,4147.0,Dry,27.56,High,0.0,10000.0
,2024-01-18T18:00Z,London,Camden,2957.0,,-15.008112711335635,,,10000.0
9215.0,2024-01-18 20:00,London,Greenwich,1156.0,Dry,45.47,,0.0,10000.0
9216.0,2024-01-18T22:00Z,London,,2008.0,Wet,10.74,High,0.0,10000.0
9217.0,19/01/2024 12AM,London,Camden,458.0,Dry,,Low,0.0,10000.0
9218.0,2024-01-19 02:00,London,Westminster,482.0,Dry,68.47,Low,0.0,10000.0
9219.0,2024-01-19T04:00Z,London,Kensington,454.0,Wet,,Low,,
9220.0,2024-01-19T06:00Z,London,Camden,1878.0,Dry,37.31,Medium,0.0,10000.0
9221.0,19/01/2024 08AM,,Islington,,Damaged,35.29,Low,0.0,10000.0
9222.0,2024-01-19 10:00,London,Chelsea,1492.0,Dry,72.49,Low,0.0,10000.0
9223.0,19/01/2024 12PM,London,Islington,2347.0,Snowy,22.8,Medium,0.0,10000.0
9224.0,19/01/2024 02PM,London,Westminster,1536.0,Dry,514.5422138497845,Medium,0.0,49991.408287751394
9225.0,,London,Islington,30005.823404858096,Wet,10.99,,0.0,10000.0
9226.0,2024-01-19T18:00Z,London,Westminster,4043.0,,21.43,High,1.0,
9227.0,,London,Camden,,Dry,74.23,Low,70.38849547354413,
9228.0,2024-01-19T22:00Z,London,Southwark,1605.0,Dry,43.83,Medium,,10000.0
9229.0,20/01/2024 12AM,London,Islington,73.0,Snowy,42.92,Low,0.0,10000.0
,2024-01-20T02:00Z,London,,318.0,Dry,41.38,Low,0.0,
9231.0,20/01/2024 04AM,London,Chelsea,458.0,Dry,94.2,Low,0.0,10000.0
9232.0,2024-01-20 06:00,London,Greenwich,1600.0,Dry,35.34,Medium,0.0,10000.0
9233.0,2024-01-20T08:00Z,London,Southwark,30011.981459850802,Wet,14.05,High,0.0,120002.10770470872
9234.0,,London,Southwark,30015.171370650038,Dry,37.81,High,1.0,10000.0
9235.0,20/01/2024 12PM,London,Greenwich,2315.0,Snowy,12.67,High,0.0,10000.0
9236.0,20/01/2024 02PM,London,Chelsea,1249.0,Dry,55.47,Low,,10000.0
9237.0,20/01/2024 04PM,London,Kensington,3692.0,Dry,12.77,High,0.0,10000.0
9238.0,20/01/2024 06PM,London,Southwark,3566.0,Dry,8.43,High,0.0,
9239.0,20/01/2024 08PM,London,Greenwich,804.0,Dry,93.84,Low,0.0,10000.0
9240.0,,London,Chelsea,1467.0,Wet,,Low,1.0,10000.0
9241.0,21/01/2024 12AM,London,,163.0,Dry,85.5,Low,0.0,10000.0
9242.0,21/01/2024 02AM,London,Kensington,464.0,Dry,55.31,,0.0,10000.0
9243.0,2024-01-21 04:00,London,Kensington,63.0,Dry,74.39,Low,0.0,10000.0
9244.0,2024-01-21T06:00Z,London,,2024.0,Dry,41.97,Medium,0.0,10000.0
9245.0,21/01/2024 08AM,London,Southwark,4178.0,Dry,3.0,High,0.0,10000.0
9246.0,2024-01-21T10:00Z,,Chelsea,2122.0,Snowy,21.88,Medium,0.0,10000.0
,2024-01-21 12:00,London,Kensington,30000.646389332054,Wet,3.0,High,3.0,10000.0
9248.0,2024-01-21T14:00Z,London,Greenwich,1154.0,Dry,72.4,Low,0.0,10000.0
9249.0,21/01/2024 04PM,London,Greenwich,4849.0,Dry,,High,0.0,10000.0
9250.0,2024-01-21T18:00Z,London,Kensington,3977.0,Dry,14.35,High,0.0,10000.0
9251.0,2024-01-21T20:00Z,,Camden,2185.0,Dry,44.04,Medium,0.0,120019.86904579797
9252.0,2024-01-21T22:00Z,London,Westminster,,Dry,,Low,0.0,10000.0
9253.0,22/01/2024 12AM,London,Southwark,375.0,Dry,70.76,Low,0.0,10000.0
9254.0,2024-01-22 02:00,London,Chelsea,300.0,Snowy,53.54,Low,0.0,10000.0
9255.0,,London,Chelsea,1794.0,,-14.038239203156298,High,3.569712082528028,10000.0
9256.0,2024-01-22T06:00Z,London,,1705.0,Dry,33.83,Medium,0.0,
,2024-01-22 08:00,London,Kensington,2786.0,Dry,29.98,Medium,0.0,10000.0
9258.0,2024-01-22T10:00Z,London,Chelsea,2151.0,Wet,26.41,Medium,1.0,10000.0
9259.0,,London,Kensington,465.0,Dry,80.84,Low,0.0,10000.0
9260.0,,London,Camden,1410.0,,51.55,Low,0.0,
,2024-01-22T16:00Z,London,Southwark,3886.0,,16.74,High,,10000.0
9262.0,,London,Kensington,2398.0,Dry,38.41,Medium,0.0,10000.0
,2024-01-22T20:00Z,London,Kensington,1780.0,Wet,36.77,Medium,0.0,10000.0
9264.0,,London,Chelsea,578.0,Dry,66.33,Low,0.0,120019.16136030717
9265.0,2024-01-23 00:00,London,Chelsea,,Dry,84.76,Low,0.0,120019.83176404353
9266.0,2024-01-23T02:00Z,London,Southwark,408.0,,70.39,Low,1.0,10000.0
,2024-01-23 04:00,London,Kensington,195.0,Dry,50.04,,0.0,10000.0
9268.0,2024-01-23 06:00,London,Greenwich,1528.0,Dry,37.13,Medium,0.0,10000.0
9269.0,2024-01-23T08:00Z,London,Greenwich,3944.0,Dry,15.77,High,1.0,10000.0
9270.0,23/01/2024 10AM,London,Chelsea,1765.0,Dry,53.44,Medium,0.0,10000.0
9271.0,23/01/2024 12PM,London,Kensington,2062.0,Wet,33.76,Medium,1.0,10000.0
9272.0,23/01/2024 02PM,London,Islington,1689.0,Dry,39.18,Medium,0.0,49997.995109637435
9273.0,,London,Kensington,1572.0,,44.23,Medium,0.0,10000.0
9274.0,23/01/2024 06PM,London,Southwark,30017.058854000064,Dry,10.98,High,0.0,10000.0
9275.0,23/01/2024 08PM,London,Southwark,,Dry,56.21,Low,68.87092037773238,10000.0
9276.0,2024-01-23 22:00,London,Islington,2492.0,Damaged,21.3,Medium,0.0,10000.0
9277.0,2024-01-24 00:00,London,Camden,114.0,Dry,47.42,Low,0.0,120019.55091062355
9278.0,2024-01-24T02:00Z,London,Camden,392.0,Dry,82.19,Low,0.0,10000.0
9279.0,2024-01-24T04:00Z,London,Camden,,Snowy,60.92,Low,1.0,10000.0
9280.0,24/01/2024 06AM,London,Southwark,1197.0,Dry,65.34,Low,1.0,10000.0
9281.0,2024-01-24 08:00,London,,4179.0,Dry,24.85,High,0.0,
9282.0,2024-01-24T10:00Z,London,Camden,2499.0,Dry,48.48,Medium,0.0,10000.0
9283.0,,,Westminster,2242.0,Damaged,26.32,Medium,0.0,
9284.0,2024-01-24 14:00,London,Southwark,2482.0,Snowy,518.1906970331875,Medium,0.0,
,2024-01-24T16:00Z,London,Kensington,2206.0,Wet,25.81,Medium,0.0,
9286.0,2024-01-24T18:00Z,,Greenwich,19983.23162972207,Dry,6.47,,0.0,10000.0
9287.0,2024-01-24T20:00Z,London,Kensington,30006.83816808439,Dry,19.61,High,,10000.0
9288.0,2024-01-24 22:00,London,Camden,1657.0,Snowy,21.17,Medium,0.0,120006.66742856424
9289.0,25/01/2024 12AM,London,Westminster,122.0,Damaged,502.52437351980586,Low,1.0,10000.0
9290.0,,London,Westminster,156.0,Dry,40.3,Low,2.0,
9291.0,2024-01-25 04:00,London,Islington,220.0,Dry,65.17,Low,,10000.0
9292.0,2024-01-25T06:00Z,London,Greenwich,1970.0,Dry,42.09,Medium,,10000.0
9293.0,2024-01-25T08:00Z,London,Chelsea,2070.0,Dry,23.68,,0.0,10000.0
9294.0,25/01/2024 10AM,London,Westminster,1051.0,Dry,85.61,Low,0.0,10000.0
9295.0,,London,Greenwich,,Dry,-8.913365705407987,Low,0.0,10000.0
9296.0,2024-01-25T14:00Z,London,Greenwich,1232.0,Dry,64.98,Low,0.0,49990.905493369915
9297.0,25/01/2024 04PM,London,Chelsea,,Dry,81.85,Low,0.0,10000.0
9298.0,2024-01-25T18:00Z,,Kensington,2407.0,Wet,,Low,0.0,
9299.0,2024-01-25T20:00Z,London,Camden,1076.0,,63.51,Low,0.0,10000.0
9300.0,25/01/2024 10PM,London,Westminster,1673.0,Wet,,Low,0.0,10000.0
9301.0,2024-01-26 00:00,London,Kensington,80.0,Dry,56.2,Low,0.0,10000.0
9302.0,2024-01-26 02:00,London,Westminster,500.0,Dry,69.76,Low,0.0,10000.0
9303.0,TBD,London,Chelsea,,Dry,78.55,Low,0.0,10000.0
9304.0,2024-01-26 06:00,,Southwark,,Dry,71.63,Low,0.0,10000.0
9305.0,2024-01-26T08:00Z,London,Chelsea,,Dry,57.32,Low,0.0,10000.0
9306.0,2024-01-26T10:00Z,London,Camden,19997.613426812844,Dry,3.78,High,0.0,120015.45677839195
9307.0,2024-01-26 12:00,London,Kensington,,Snowy,52.66,Low,1.0,10000.0
,2024-01-26T14:00Z,London,Chelsea,1525.0,,15.33,Medium,3.0,
,2024-01-26 16:00,London,Westminster,,Dry,79.9,Low,0.0,120024.1463966342
9310.0,26/01/2024 06PM,,Chelsea,4520.0,Dry,17.33,High,0.0,120021.48334435151
9311.0,2024-01-26 20:00,London,Greenwich,1175.0,Wet,67.86,Low,0.0,10000.0
9312.0,2024-01-26 22:00,London,Chelsea,2414.0,Damaged,-5.063270239866078,High,15.044971284233938,10000.0
9313.0,TBD,London,Camden,2735.0,Dry,42.09,Medium,0.0,10000.0
9314.0,2024-01-27T02:00Z,London,Westminster,298.0,Wet,62.48,Low,0.0,10000.0
,2024-01-27 04:00,London,Islington,143.0,Dry,55.14,Low,0.0,10000.0
9316.0,2024-01-27 06:00,London,Southwark,30017.44856987693,,519.0009815083286,High,,49991.47060580542
9317.0,2024-01-27T08:00Z,London,Kensington,2522.0,Dry,25.17,,0.0,10000.0
9318.0,2024-01-27 10:00,London,Southwark,,Dry,63.97,Low,0.0,10000.0
9319.0,2024-01-27 12:00,London,Camden,19988.80857258988,Dry,16.58,High,0.0,
9320.0,2024-01-27T14:00Z,London,Southwark,2093.0,Dry,42.62,Medium,0.0,
9321.0,,London,Westminster,309.0,Dry,66.19,Low,0.0,10000.0
9322.0,2024-01-27 18:00,London,Chelsea,2143.0,Dry,28.6,Medium,0.0,10000.0
9323.0,2024-01-27T20:00Z,London,Westminster,,Snowy,63.45,Low,0.0,10000.0
9324.0,27/01/2024 10PM,London,,1851.0,Dry,515.5264571456543,Medium,0.0,10000.0
9325.0,2024-01-28T00:00Z,London,Greenwich,389.0,,71.94,Low,3.0,
,28/01/2024 02AM,London,Westminster,295.0,Dry,78.87,Low,0.0,10000.0
9327.0,,London,Westminster,190.0,Dry,45.07,Low,,10000.0
9328.0,28/01/2024 06AM,London,Islington,1448.0,Snowy,42.66,Low,0.0,10000.0
,2024-01-28T08:00Z,London,Chelsea,4550.0,Dry,17.33,High,0.0,10000.0
,2024-01-28T10:00Z,,Southwark,,Snowy,55.02,Low,-3.4076816657441373,10000.0
9331.0,28/01/2024 12PM,,Islington,2127.0,Dry,-12.626300587393743,High,,10000.0
9332.0,2024-01-28 14:00,London,Westminster,808.0,Dry,69.99,Low,0.0,10000.0
9333.0,2024-01-28T16:00Z,,Westminster,4221.0,Dry,31.11,High,2.0,10000.0
9334.0,2024-01-28T18:00Z,London,Kensington,30020.893815156258,Dry,14.74,,,10000.0
9335.0,,London,Westminster,30002.00490771657,Dry,10.28,High,0.0,10000.0
9336.0,28/01/2024 10PM,,Southwark,2060.0,Dry,39.32,Medium,-0.2483716563744478,10000.0
9337.0,2024-01-29 00:00,,Southwark,178.0,Dry,84.1,,,
9338.0,29/01/2024 02AM,London,Westminster,265.0,Dry,79.82,Low,0.0,10000.0
9339.0,2024-01-29T04:00Z,London,Camden,19975.034423010424,Dry,14.11,High,1.0,49978.2453431549
9340.0,29/01/2024 06AM,London,Kensington,858.0,Dry,64.16,Low,0.0,10000.0
9341.0,2024-01-29 08:00,London,Westminster,2364.0,Snowy,38.07,Medium,1.208261135919157,10000.0
9342.0,2024-01-29 10:00,London,Kensington,,Snowy,49.85,Low,0.0,10000.0
9343.0,2024-01-29T12:00Z,London,Chelsea,2417.0,Dry,44.5,Medium,0.0,
9344.0,,London,Westminster,505.0,Snowy,33.45,Medium,0.0,
9345.0,2024-01-29 16:00,London,Westminster,4852.0,Wet,,High,0.0,120020.94662095165
9346.0,2024-01-29 18:00,London,Islington,2416.0,Dry,503.7537339397477,Medium,0.0,10000.0
9347.0,29/01/2024 08PM,London,Islington,,,67.66,Low,0.0,
9348.0,2024-01-29 22:00,London,Southwark,1533.0,Dry,57.27,Medium,0.0,10000.0
,2024-01-30 00:00,London,Chelsea,259.0,Dry,70.07,Low,-2.7573272167604976,10000.0
9350.0,,London,Kensington,1215.0,Dry,65.98,Low,0.0,10000.0
9351.0,2024-01-30 04:00,London,Southwark,144.0,,56.43,Low,0.0,10000.0
9352.0,30/01/2024 06AM,London,Southwark,1410.0,Snowy,68.77,,0.0,10000.0
9353.0,,London,Islington,19979.92858395751,Dry,23.34,High,0.0,10000.0
9354.0,2024-01-30T10:00Z,London,,1279.0,Dry,46.17,Low,0.0,10000.0
9355.0,2024-01-30 12:00,,Westminster,1184.0,Dry,71.69,Low,0.0,10000.0
9356.0,,London,Westminster,1215.0,Dry,,Low,0.0,10000.0
9357.0,2024-01-30T16:00Z,London,Westminster,2889.0,,48.75,Medium,0.0,120012.40159726357
,2024-01-30 18:00,,Greenwich,30017.32990825364,Dry,17.24,High,0.0,10000.0
9359.0,30/01/2024 08PM,London,Camden,30013.674148922462,Dry,,,0.0,10000.0
9360.0,2024-01-30T22:00Z,London,Southwark,1402.0,Dry,89.77,Low,0.0,10000.0
9361.0,2024-01-31T00:00Z,London,,97.0,Snowy,69.36,Low,,10000.0
9362.0,2024-01-31 02:00,London,Westminster,211.0,Snowy,34.86,Medium,,10000.0
9363.0,2024-01-31 04:00,London,Camden,460.0,,31.06,,0.0,10000.0
9364.0,31/01/2024 06AM,London,Westminster,2429.0,,48.92,Medium,0.0,10000.0
9365.0,,London,,1982.0,Dry,46.65,Medium,0.0,
9366.0,31/01/2024 10AM,London,Camden,1945.0,Dry,46.52,Medium,1.0,
9367.0,2024-01-31 12:00,London,,1930.0,Dry,20.91,Medium,0.0,10000.0
9368.0,2024-01-31T14:00Z,London,Greenwich,1145.0,Snowy,45.64,Low,0.0,10000.0
9369.0,,London,Islington,640.0,Damaged,33.73,Medium,0.0,10000.0
9370.0,2024-01-31 18:00,London,Westminster,4247.0,,504.81358485652356,High,3.913479410602964,10000.0
9371.0,2024-01-31T20:00Z,London,Southwark,2324.0,Dry,38.29,Medium,,10000.0
9372.0,2024-01-31 22:00,London,Camden,2437.0,Snowy,31.88,Medium,0.0,10000.0
9373.0,01/02/2024 12AM,London,Greenwich,,Wet,38.89,Low,2.0,10000.0
9374.0,2024-02-01 02:00,London,Greenwich,338.0,Dry,45.38,Low,0.0,10000.0
9375.0,2024-02-01 04:00,London,Kensington,143.0,Dry,70.53,Low,6.0840966907241985,10000.0
9376.0,2024-02-01 06:00,London,Camden,1743.0,Dry,31.07,Medium,0.0,10000.0
9377.0,2024-02-01T08:00Z,London,Chelsea,2168.0,Dry,31.39,Medium,0.0,10000.0
9378.0,2024-02-01T10:00Z,London,Chelsea,2389.0,Snowy,,Low,56.40179656399101,10000.0
9379.0,,London,Chelsea,19992.147374769433,Dry,19.56,High,14.62291107156408,10000.0
9380.0,01/02/2024 02PM,London,Greenwich,1679.0,Snowy,-3.2805220026303417,,1.0,
9381.0,2024-02-01 16:00,London,Greenwich,4154.0,Snowy,3.0,High,2.0,10000.0
9382.0,01/02/2024 06PM,London,Chelsea,4787.0,Snowy,3.0,High,0.0,10000.0
9383.0,01/02/2024 08PM,London,Kensington,1900.0,Dry,37.12,Medium,0.0,10000.0
9384.0,2024-02-01T22:00Z,London,Westminster,,Dry,98.51,Low,0.0,10000.0
9385.0,02/02/2024 12AM,London,Islington,92.0,,76.69,Low,0.0,10000.0
9386.0,,London,Chelsea,30016.701229023613,Wet,3.0,High,0.0,10000.0
9387.0,2024-02-02T04:00Z,London,Southwark,174.0,,50.49,,1.0,10000.0
9388.0,2024-02-02T06:00Z,London,Greenwich,1072.0,Dry,64.62,Low,0.0,10000.0
9389.0,2024-02-02T08:00Z,London,Camden,3922.0,Dry,-1.6393721377789419,High,0.0,10000.0
,2024-02-02 10:00,,Chelsea,1741.0,Dry,51.13,Medium,0.0,10000.0
9391.0,2024-02-02 12:00,London,Southwark,2234.0,,39.28,Medium,0.0,10000.0
9392.0,2024-02-02 14:00,London,Camden,2035.0,Damaged,29.97,Medium,0.0,10000.0
9393.0,02/02/2024 04PM,London,Kensington,2227.0,Dry,42.09,Medium,0.0,10000.0
9394.0,02/02/2024 06PM,,Westminster,2754.0,Snowy,42.13,Medium,0.0,10000.0
9395.0,2024-02-02 20:00,London,Chelsea,1828.0,Dry,41.98,Medium,15.315757075776286,10000.0
9396.0,2024-02-02T22:00Z,,Southwark,19994.70065616055,Dry,34.05,High,58.571516203791454,10000.0
9397.0,03/02/2024 12AM,London,Kensington,311.0,Dry,71.51,Low,,10000.0
9398.0,2024-02-03 02:00,London,Islington,454.0,,78.6,,,10000.0
9399.0,03/02/2024 04AM,London,Islington,258.0,Dry,,Low,0.0,10000.0
,03/02/2024 06AM,London,Islington,1453.0,Dry,59.2,Low,5.361301596299668,10000.0
9401.0,2024-02-03T08:00Z,London,Southwark,2176.0,Damaged,25.57,Medium,2.0,10000.0
9402.0,2024-02-03T10:00Z,London,Southwark,1896.0,Snowy,33.21,Medium,,
9403.0,2024-02-03T12:00Z,London,Camden,1462.0,Dry,58.01,Low,0.0,10000.0
9404.0,2024-02-03T14:00Z,London,Islington,1600.0,Snowy,8.18,High,2.0,10000.0
9405.0,2024-02-03T16:00Z,London,Kensington,2930.0,Dry,39.85,Medium,,10000.0
9406.0,2024-02-03T18:00Z,London,Camden,2940.0,Dry,521.4309513820615,Medium,0.0,10000.0
9407.0,2024-02-03 20:00,London,Camden,1192.0,Snowy,57.82,Low,0.0,10000.0
9408.0,2024-02-03T22:00Z,London,Kensington,928.0,Wet,53.22,Low,0.0,10000.0
9409.0,2024-02-04 00:00,London,Westminster,268.0,Wet,,Low,0.0,120011.09457035045
9410.0,2024-02-04T02:00Z,London,Chelsea,365.0,Snowy,39.74,Low,0.0,10000.0
9411.0,2024-02-04T04:00Z,London,Greenwich,420.0,Dry,68.34,Low,,10000.0
9412.0,2024-02-04T06:00Z,London,Kensington,,Dry,62.41,,0.0,10000.0
9413.0,2024-02-04T08:00Z,London,Islington,4699.0,Dry,7.88,High,9.006194392219957,10000.0
9414.0,04/02/2024 10AM,London,Greenwich,1476.0,Dry,61.07,Low,13.939408084798998,
9415.0,04/02/2024 12PM,London,Southwark,1233.0,Wet,73.72,Low,0.0,10000.0
,,London,Kensington,2961.0,Wet,15.45,Medium,0.0,10000.0
9417.0,04/02/2024 04PM,London,Westminster,3742.0,Dry,4.76,High,0.0,
9418.0,2024-02-04T18:00Z,London,Camden,2924.0,Dry,37.72,Medium,0.0,10000.0
9419.0,2024-02-04T20:00Z,London,Greenwich,,Dry,87.32,,0.0,10000.0
9420.0,2024-02-04T22:00Z,London,Southwark,1926.0,Dry,41.47,Medium,0.0,10000.0
9421.0,05/02/2024 12AM,London,,103.0,Dry,63.54,Low,55.47086708513779,10000.0
9422.0,05/02/2024 02AM,London,,20.0,Dry,501.85139877086465,Low,0.0,10000.0
9423.0,05/02/2024 04AM,London,Islington,496.0,,-3.2118633339460985,High,0.0,10000.0
,,,Camden,662.0,Dry,67.59,Low,0.0,10000.0
9425.0,2024-02-05 08:00,London,Kensington,3471.0,Dry,25.81,Medium,0.0,10000.0
9426.0,2024-02-05 10:00,London,Chelsea,1804.0,Wet,-12.541633714830263,High,2.0,10000.0
,,London,Chelsea,782.0,,92.03,Low,0.0,
9428.0,2024-02-05 14:00,London,Kensington,,Dry,76.58,Low,0.0,10000.0
9429.0,05/02/2024 04PM,London,Camden,,Dry,76.57,Low,0.0,10000.0
,,,Chelsea,1871.0,Dry,29.36,,0.0,10000.0
9431.0,05/02/2024 08PM,London,Southwark,1291.0,Dry,88.71,Low,0.0,10000.0
9432.0,05/02/2024 10PM,London,Islington,939.0,Dry,76.88,Low,0.0,10000.0
9433.0,06/02/2024 12AM,London,Camden,194.0,Dry,54.56,Low,0.0,10000.0
9434.0,06/02/2024 02AM,London,Westminster,19990.512990378254,Dry,26.65,High,2.0,10000.0
9435.0,06/02/2024 04AM,London,Chelsea,125.0,Dry,80.69,Low,0.0,49983.75455005701
9436.0,06/02/2024 06AM,,Greenwich,2082.0,Dry,25.07,Medium,0.0,10000.0
9437.0,2024-02-06 08:00,London,Camden,,Dry,63.15,Low,0.0,10000.0
9438.0,2024-02-06T10:00Z,London,Westminster,1817.0,Dry,39.74,Medium,0.0,10000.0
9439.0,2024-02-06T12:00Z,London,Greenwich,1812.0,Wet,,Low,0.0,10000.0
,2024-02-06T14:00Z,London,Chelsea,1117.0,Dry,70.72,Low,0.21785933072640695,10000.0
,06/02/2024 04PM,London,Kensington,2533.0,Dry,46.07,Medium,0.0,49991.08236442312
9442.0,2024-02-06 18:00,London,Southwark,4645.0,,30.13,High,0.0,10000.0
9443.0,2024-02-06T20:00Z,,Camden,2400.0,Dry,42.46,Medium,,10000.0
9444.0,06/02/2024 10PM,London,Chelsea,811.0,Dry,60.01,,0.0,10000.0
9445.0,07/02/2024 12AM,London,Greenwich,201.0,Dry,,Low,,10000.0
9446.0,07/02/2024 02AM,London,,291.0,Dry,59.47,Low,0.0,10000.0
,07/02/2024 04AM,London,Camden,,Dry,64.69,Low,0.0,10000.0
9448.0,2024-02-07 06:00,London,Westminster,2454.0,Snowy,22.92,Medium,,10000.0
9449.0,2024-02-07 08:00,London,Chelsea,4657.0,Snowy,21.75,High,0.0,10000.0
9450.0,,London,Islington,2121.0,Dry,-3.6641207467097736,High,0.0,10000.0
9451.0,2024-02-07 12:00,London,Islington,1542.0,Wet,23.25,Medium,1.0,10000.0
9452.0,07/02/2024 02PM,London,Chelsea,1100.0,Dry,47.54,Low,0.0,10000.0
9453.0,2024-02-07 16:00,London,Chelsea,3674.0,Damaged,,High,0.0,
9454.0,2024-02-07T18:00Z,London,Southwark,,Dry,89.44,Low,0.0,10000.0
9455.0,2024-02-07 20:00,London,Greenwich,,Dry,76.37,Low,0.0,10000.0
9456.0,2024-02-07T22:00Z,London,Islington,2022.0,Wet,15.44,Medium,0.0,10000.0
9457.0,,,Westminster,19981.57206988367,Dry,-13.017717997355929,,0.0,10000.0
9458.0,2024-02-08 02:00,London,Camden,392.0,Snowy,,Low,2.0,10000.0
9459.0,2024-02-08 04:00,London,Camden,218.0,Dry,57.65,Low,0.0,
9460.0,2024-02-08T06:00Z,London,Chelsea,2468.0,Dry,41.5,Medium,0.0,
9461.0,2024-02-08T08:00Z,London,Greenwich,4150.0,Dry,35.11,High,0.0,
9462.0,08/02/2024 10AM,,,1841.0,Snowy,18.67,Medium,11.759413772286198,10000.0
9463.0,2024-02-08 12:00,London,Camden,1949.0,Dry,29.64,Medium,0.0,10000.0
9464.0,08/02/2024 02PM,London,Chelsea,1111.0,Dry,88.15,Low,0.0,10000.0
9465.0,2024-02-08 16:00,London,Islington,4370.0,Dry,17.93,High,1.0,10000.0
9466.0,2024-02-08T18:00Z,London,Greenwich,3217.0,,13.05,,0.0,10000.0
9467.0,2024-02-08 20:00,London,Islington,1453.0,Dry,88.23,Low,0.0,10000.0
9468.0,2024-02-08 22:00,London,Westminster,1888.0,Dry,30.54,Medium,0.0,
9469.0,2024-02-09 00:00,London,Greenwich,17.0,,66.44,,0.0,10000.0
9470.0,2024-02-09 02:00,,Westminster,366.0,Dry,,Low,0.0,10000.0
9471.0,09/02/2024 04AM,London,Islington,172.0,Dry,92.44,Low,,10000.0
9472.0,2024-02-09 06:00,London,,1141.0,Wet,53.74,Low,2.0,10000.0
9473.0,2024-02-09 08:00,London,Islington,2230.0,Dry,-23.880428373879436,High,0.0,10000.0
9474.0,2024-02-09 10:00,London,Islington,2288.0,Snowy,11.21,High,57.676004639916584,10000.0
9475.0,2024-02-09T12:00Z,London,Greenwich,30019.01524158695,,25.1,,0.0,10000.0
9476.0,2024-02-09 14:00,London,Kensington,988.0,Damaged,68.8,Low,0.0,10000.0
,09/02/2024 04PM,London,Greenwich,30016.77227620385,Dry,3.0,High,0.0,10000.0
9478.0,2024-02-09 18:00,London,Chelsea,2354.0,Dry,48.32,Medium,0.0,10000.0
9479.0,2024-02-09T20:00Z,London,Southwark,,Wet,52.56,Low,1.0,10000.0
9480.0,2024-02-09T22:00Z,London,Camden,1646.0,Snowy,,Low,0.0,10000.0
9481.0,,,Chelsea,2792.0,Dry,50.16,Medium,0.0,10000.0
,2024-02-10T02:00Z,London,Camden,392.0,Dry,54.24,Low,0.0,120004.84680654091
9483.0,2024-02-10 04:00,London,Southwark,64.0,Dry,67.98,Low,0.0,10000.0
9484.0,2024-02-10T06:00Z,London,Camden,952.0,Dry,66.9,Low,0.0,49978.23587332292
9485.0,10/02/2024 08AM,London,Greenwich,2184.0,Dry,,Low,,10000.0
9486.0,2024-02-10T10:00Z,London,Southwark,1306.0,,79.11,,0.0,10000.0
9487.0,2024-02-10T12:00Z,London,Islington,2171.0,Dry,51.32,Medium,0.0,10000.0
9488.0,2024-02-10T14:00Z,London,Islington,2454.0,Wet,24.88,Medium,0.0,10000.0
9489.0,2024-02-10 16:00,London,Westminster,4218.0,,3.0,High,0.0,10000.0
9490.0,10/02/2024 06PM,London,Greenwich,4425.0,,19.4,High,2.0,10000.0
9491.0,,London,Westminster,672.0,Damaged,,Low,2.0,10000.0
9492.0,2024-02-10 22:00,London,Westminster,,Dry,66.42,Low,0.0,
9493.0,2024-02-11T00:00Z,,Southwark,473.0,Snowy,-18.90959341001411,High,2.0,10000.0
9494.0,11/02/2024 02AM,London,Camden,108.0,Dry,55.57,Low,0.0,10000.0
,2024-02-11 04:00,London,,,Dry,83.8,Low,0.0,10000.0
9496.0,11/02/2024 06AM,London,,19997.09184329643,Dry,17.93,High,0.0,10000.0
9497.0,11/02/2024 08AM,London,Camden,2439.0,Dry,40.23,Medium,0.0,10000.0
9498.0,11/02/2024 10AM,London,Westminster,1571.0,Snowy,33.06,Medium,0.0,10000.0
9499.0,2024-02-11T12:00Z,London,Greenwich,1258.0,Dry,59.23,Low,0.0,10000.0
9500.0,2024-02-11 14:00,London,Camden,,Dry,53.42,,0.0,10000.0
9501.0,11/02/2024 04PM,,Kensington,3608.0,Dry,36.22,High,2.0,10000.0
,11/02/2024 06PM,London,Southwark,4016.0,Dry,20.11,High,0.0,10000.0
9503.0,2024-02-11T20:00Z,London,Westminster,2244.0,Snowy,17.14,Medium,2.0,49983.18608366414
9504.0,11/02/2024 10PM,London,Kensington,1287.0,Dry,80.3,,0.0,10000.0
9505.0,12/02/2024 12AM,London,Southwark,324.0,Dry,81.86,Low,4.771958065538765,10000.0
9506.0,2024-02-12 02:00,,Chelsea,,Damaged,59.28,Low,0.0,10000.0
9507.0,12/02/2024 04AM,London,Kensington,326.0,Damaged,513.031977091154,Low,0.0,
9508.0,2024-02-12T06:00Z,London,Greenwich,1722.0,Wet,12.36,High,2.0,10000.0
9509.0,2024-02-12T08:00Z,,Islington,2410.0,Snowy,,Low,0.0,10000.0
9510.0,2024-02-12 10:00,London,Camden,1367.0,Dry,32.3,Medium,0.0,10000.0
9511.0,12/02/2024 12PM,London,Islington,1934.0,,26.39,Medium,3.0,10000.0
9512.0,12/02/2024 02PM,London,Islington,1385.0,Dry,59.78,Low,0.0,10000.0
9513.0,2024-02-12T16:00Z,,Islington,4660.0,Dry,20.63,High,0.0,10000.0
9514.0,2024-02-12T18:00Z,London,Camden,3824.0,Wet,5.7,High,51.53484206824477,10000.0
9515.0,12/02/2024 08PM,London,Chelsea,1708.0,Dry,,Low,0.0,10000.0
9516.0,2024-02-12T22:00Z,London,,2079.0,Dry,40.27,Medium,1.0,10000.0
9517.0,2024-02-13 00:00,,Islington,102.0,Snowy,33.55,Medium,3.1230771293394657,10000.0
9518.0,13/02/2024 02AM,London,Southwark,459.0,Dry,95.66,Low,0.0,10000.0
9519.0,,London,Chelsea,294.0,Dry,,Low,0.0,
9520.0,13/02/2024 06AM,London,Camden,1355.0,Dry,81.97,Low,0.0,
9521.0,2024-02-13 08:00,London,Islington,4513.0,Dry,16.78,High,0.0,10000.0
9522.0,2024-02-13T10:00Z,London,Camden,1647.0,Snowy,22.42,Medium,0.0,10000.0
9523.0,2024-02-13 12:00,London,Islington,1289.0,Dry,90.89,Low,0.0,10000.0
9524.0,13/02/2024 02PM,London,Camden,1978.0,Dry,42.27,Medium,0.0,10000.0
9525.0,2024-02-13T16:00Z,,Kensington,3285.0,Dry,-6.282292899191074,High,3.0,10000.0
9526.0,2024-02-13 18:00,London,Chelsea,2862.0,Dry,55.29,Medium,0.0,10000.0
9527.0,2024-02-13 20:00,London,,1311.0,Dry,53.13,Low,0.0,10000.0
9528.0,2024-02-13T22:00Z,London,Westminster,1616.0,,32.21,,0.0,10000.0
9529.0,2024-02-14 00:00,London,Greenwich,19998.760059267057,,23.98,,0.0,120018.2858033642
9530.0,2024-02-14T02:00Z,London,Kensington,,Dry,60.69,Low,0.0,10000.0
9531.0,2024-02-14T04:00Z,London,Kensington,458.0,Dry,71.28,Low,0.0,10000.0
9532.0,14/02/2024 06AM,London,Greenwich,1869.0,Dry,40.86,Medium,0.0,10000.0
9533.0,2024-02-14 08:00,,Islington,3494.0,Dry,20.16,Medium,0.0,10000.0
,14/02/2024 10AM,London,Southwark,2356.0,Dry,,Low,0.0,
9535.0,14/02/2024 12PM,London,Chelsea,2355.0,Dry,32.96,Medium,0.0,10000.0
9536.0,2024-02-14 14:00,London,Islington,1666.0,Snowy,,Low,0.0,
9537.0,2024-02-14T16:00Z,London,Islington,,Dry,77.94,,0.0,120019.00477792019
9538.0,14/02/2024 06PM,London,,,Dry,82.39,Low,0.0,10000.0
9539.0,2024-02-14 20:00,London,Chelsea,1504.0,Wet,25.15,Medium,0.0,10000.0
9540.0,2024-02-14T22:00Z,London,Westminster,30000.649320809167,Dry,28.7,,,10000.0
9541.0,2024-02-15T00:00Z,London,Southwark,138.0,Dry,-6.289154820959084,High,1.0,10000.0
9542.0,15/02/2024 02AM,London,Greenwich,19977.08707482544,Wet,8.06,High,0.0,10000.0
,15/02/2024 04AM,London,Westminster,431.0,Damaged,47.51,Low,,10000.0
9544.0,,London,Kensington,2069.0,Dry,37.48,Medium,0.0,
9545.0,,London,Greenwich,1063.0,Dry,31.85,Medium,62.63006921720147,10000.0
9546.0,,London,Camden,,Dry,,Low,,10000.0
9547.0,15/02/2024 12PM,London,Greenwich,2080.0,Dry,49.99,Medium,0.0,10000.0
9548.0,2024-02-15 14:00,London,Chelsea,,Snowy,58.02,Low,0.0,10000.0
9549.0,2024-02-15T16:00Z,London,Camden,2710.0,Dry,517.3857740136083,Medium,0.0,10000.0
,2024-02-15 18:00,London,Southwark,2709.0,Snowy,516.5384452404605,Medium,0.0,10000.0
,2024-02-15T20:00Z,London,Islington,1999.0,,38.47,Medium,0.0,10000.0
9552.0,2024-02-15T22:00Z,London,Islington,2452.0,Dry,43.65,Medium,0.0,10000.0
9553.0,16/02/2024 12AM,London,Greenwich,463.0,Snowy,45.91,Low,0.0,10000.0
9554.0,2024-02-16 02:00,London,Westminster,250.0,Snowy,60.59,Low,0.0,10000.0
,2024-02-16T04:00Z,London,Greenwich,233.0,Dry,75.72,Low,0.0,10000.0
9556.0,16/02/2024 06AM,London,Camden,1573.0,Snowy,36.55,Medium,0.0,49982.16478425866
,16/02/2024 08AM,London,Kensington,4441.0,Dry,8.79,High,0.0,10000.0
9558.0,2024-02-16 10:00,London,Islington,30023.723152998515,,,,0.0,120022.67125015636
9559.0,2024-02-16T12:00Z,London,Islington,19980.17186540759,Dry,13.45,High,0.0,10000.0
9560.0,2024-02-16 14:00,London,Islington,1262.0,Dry,81.35,,0.0,10000.0
9561.0,2024-02-16 16:00,London,Greenwich,2119.0,Damaged,11.23,High,11.981451123797424,
,2024-02-16T18:00Z,London,Southwark,30014.46720718218,Dry,20.16,High,1.0,10000.0
9563.0,2024-02-16T20:00Z,London,Greenwich,2358.0,Dry,48.31,Medium,0.0,10000.0
9564.0,16/02/2024 10PM,London,,1592.0,Dry,33.67,Medium,0.0,10000.0
9565.0,2024-02-17 00:00,London,Southwark,302.0,Dry,76.11,Low,1.0,10000.0
9566.0,2024-02-17T02:00Z,London,Kensington,337.0,Dry,61.21,Low,0.0,10000.0
9567.0,2024-02-17T04:00Z,London,Camden,19981.265903498697,Dry,35.81,,,10000.0
9568.0,2024-02-17T06:00Z,London,Westminster,1399.0,,81.76,Low,0.0,
9569.0,2024-02-17 08:00,London,Southwark,3474.0,Wet,4.93,High,0.0,
9570.0,17/02/2024 10AM,London,Greenwich,1807.0,Snowy,,Low,1.0,10000.0
9571.0,2099-13-40 25:61,London,Greenwich,218.0,Dry,94.9,Low,7.663829690819602,10000.0
9572.0,17/02/2024 02PM,London,Kensington,1165.0,,64.53,Low,0.0,10000.0
9573.0,17/02/2024 04PM,London,Greenwich,4738.0,Dry,-7.850000865575662,High,0.0,10000.0
9574.0,2024-02-17 18:00,London,Greenwich,4506.0,Dry,16.53,High,0.0,10000.0
9575.0,17/02/2024 08PM,London,Kensington,1041.0,Snowy,,Low,0.0,10000.0
9576.0,17/02/2024 10PM,London,Chelsea,1651.0,Dry,,Low,,
9577.0,2024-02-18T00:00Z,London,,340.0,Wet,59.49,Low,0.0,10000.0
9578.0,2024-02-18 02:00,London,Kensington,287.0,Snowy,68.91,Low,18.122961617990736,10000.0
9579.0,2024-02-18T04:00Z,London,Camden,234.0,,,Low,0.0,10000.0
9580.0,2024-02-18 06:00,London,Kensington,2042.0,,35.77,Medium,2.0,49984.83112174102
9581.0,2024-02-18T08:00Z,London,Chelsea,3959.0,,23.13,High,0.0,10000.0
9582.0,2024-02-18T10:00Z,London,,19980.217534986503,Dry,29.88,High,0.0,10000.0
9583.0,,London,Southwark,2474.0,Wet,42.54,Medium,0.0,10000.0
9584.0,2024-02-18T14:00Z,London,Islington,30019.415891815133,,14.78,High,0.0,10000.0
9585.0,18/02/2024 04PM,,Greenwich,3896.0,Damaged,4.41,High,0.0,10000.0
9586.0,,London,Kensington,2323.0,Dry,25.68,Medium,0.0,
9587.0,2024-02-18 20:00,,Islington,1231.0,Damaged,35.47,Low,0.0,49975.75405997095
,2024-02-18T22:00Z,London,Kensington,2249.0,Wet,23.6,,3.0,10000.0
9589.0,19/02/2024 12AM,London,Kensington,,Dry,,Low,,10000.0
9590.0,19/02/2024 02AM,London,Camden,176.0,Wet,53.53,Low,0.0,10000.0
9591.0,19/02/2024 04AM,London,Camden,492.0,Dry,72.09,Low,0.0,10000.0
9592.0,,London,Chelsea,1465.0,,69.57,Low,0.0,10000.0
9593.0,,,Greenwich,860.0,Dry,65.63,Low,2.0,
9594.0,2024-02-19 10:00,London,Westminster,,Dry,54.93,,0.0,10000.0
9595.0,2024-02-19T12:00Z,London,Greenwich,833.0,Snowy,58.7,Low,0.0,10000.0
9596.0,2024-02-19 14:00,London,Southwark,1849.0,Dry,-17.148270059763142,High,0.0,10000.0
9597.0,19/02/2024 04PM,London,,3476.0,Wet,12.36,High,,10000.0
9598.0,2024-02-19T18:00Z,London,Kensington,2762.0,Dry,39.75,Medium,59.39003155916829,10000.0
9599.0,2024-02-19T20:00Z,,Southwark,2371.0,Wet,28.19,Medium,6.567436846490093,10000.0
,2024-02-19 22:00,London,Kensington,1053.0,Dry,91.92,Low,0.0,120011.2408319597
9601.0,20/02/2024 12AM,London,Southwark,476.0,Dry,56.23,Low,0.0,
9602.0,2024-02-20 02:00,London,Chelsea,0.0,Damaged,-25.501038425931704,High,1.0,10000.0
9603.0,20/02/2024 04AM,London,Greenwich,406.0,,60.1,Low,0.0,10000.0
9604.0,2024-02-20 06:00,London,Southwark,1363.0,Snowy,37.89,,1.0,10000.0
9605.0,2024-02-20 08:00,London,,3615.0,Dry,34.91,,0.0,10000.0
9606.0,20/02/2024 10AM,London,,,Snowy,77.15,Low,0.0,10000.0
9607.0,,London,,1789.0,Wet,25.77,Medium,0.0,10000.0
9608.0,,London,Southwark,,,505.9155648415995,Low,,10000.0
9609.0,2024-02-20T16:00Z,,Westminster,2903.0,Dry,31.94,Medium,0.0,
9610.0,2024-02-20T18:00Z,London,Westminster,30005.255480713924,Dry,22.6,High,,10000.0
9611.0,20/02/2024 08PM,London,,1345.0,Dry,68.6,,0.0,10000.0
9612.0,2024-02-20 22:00,London,Camden,2002.0,Dry,55.49,,0.0,10000.0
9613.0,Unknown,London,Kensington,270.0,,-9.754781538126721,High,2.0,10000.0
9614.0,,London,Greenwich,460.0,Dry,-2.6087666058269647,High,1.5008343689200805,
9615.0,2024-02-21 04:00,London,,375.0,Snowy,54.94,Low,0.0,10000.0
9616.0,2024-02-21 06:00,London,Camden,,Wet,44.95,Low,0.0,10000.0
,2024-02-21T08:00Z,,Islington,19984.57662902464,Dry,15.15,High,0.0,
,2024-02-21T10:00Z,London,Islington,2274.0,Wet,-1.636367986965201,High,2.0,10000.0
,21/02/2024 12PM,London,Greenwich,1530.0,Dry,30.72,Medium,0.0,10000.0
9620.0,21/02/2024 02PM,London,Westminster,2118.0,Wet,30.71,Medium,0.0,10000.0
9621.0,2024-02-21T16:00Z,London,Chelsea,2143.0,Dry,21.29,,0.0,
9622.0,,London,Kensington,652.0,Dry,67.22,Low,,10000.0
9623.0,21/02/2024 08PM,London,Westminster,1690.0,Dry,26.42,Medium,0.0,10000.0
9624.0,2024-02-21T22:00Z,London,Camden,1186.0,Dry,59.03,Low,0.0,10000.0
9625.0,2024-02-22 00:00,London,,136.0,Dry,73.16,Low,,10000.0
9626.0,2024-02-22T02:00Z,London,Camden,156.0,,71.14,Low,0.0,10000.0
9627.0,2024-02-22 04:00,London,Chelsea,307.0,Dry,67.22,Low,,10000.0
9628.0,22/02/2024 06AM,London,,,Snowy,64.93,Low,11.387426054916837,10000.0
,,London,Greenwich,1953.0,Damaged,19.91,Medium,,
9630.0,2024-02-22 10:00,London,Southwark,2202.0,Snowy,25.41,Medium,0.0,10000.0
9631.0,2024-02-22 12:00,London,Southwark,19994.82171609513,Snowy,3.0,,0.0,
9632.0,2024-02-22 14:00,London,Kensington,19997.265709415344,,3.87,High,2.0,10000.0
,22/02/2024 04PM,London,Southwark,2567.0,Dry,48.93,Medium,0.0,
9634.0,22/02/2024 06PM,London,Camden,4493.0,Snowy,13.68,High,0.0,10000.0
9635.0,2024-02-22T20:00Z,London,Greenwich,30011.79267355246,Wet,9.5,High,,120014.5924599871
9636.0,2024-02-22T22:00Z,London,Westminster,1806.0,Dry,507.4079706161635,Medium,0.0,120003.45028580107
9637.0,,London,Westminster,,Wet,47.94,Low,0.0,10000.0
9638.0,2024-02-23T02:00Z,London,Greenwich,478.0,,28.93,Medium,0.0,10000.0
9639.0,23/02/2024 04AM,London,Southwark,209.0,Dry,67.41,Low,0.0,10000.0
9640.0,2024-02-23 06:00,London,Camden,,Dry,91.72,,0.0,10000.0
9641.0,23/02/2024 08AM,London,Westminster,3575.0,Dry,15.8,,54.439694653170406,10000.0
9642.0,23/02/2024 10AM,London,Kensington,1909.0,Dry,31.1,Medium,0.0,10000.0
,2024-02-23 12:00,London,Islington,1699.0,,47.13,Medium,0.0,10000.0
9644.0,2024-02-23 14:00,London,Kensington,1646.0,Dry,,Low,0.0,10000.0
9645.0,2024-02-23T16:00Z,London,,,Dry,76.74,Low,0.0,49990.17504708951
,23/02/2024 06PM,London,Chelsea,2386.0,Dry,40.12,Medium,0.0,10000.0
9647.0,,London,Camden,2737.0,Damaged,24.72,Medium,0.0,10000.0
9648.0,2024-02-23 22:00,London,Southwark,,Wet,41.85,Low,,10000.0
,2024-02-24 00:00,London,Kensington,69.0,Dry,73.08,Low,0.0,10000.0
9650.0,24/02/2024 02AM,London,Kensington,384.0,Snowy,73.74,Low,0.0,10000.0
9651.0,2024-02-24T04:00Z,London,,436.0,Dry,,Low,0.0,10000.0
9652.0,2024-02-24T06:00Z,London,,2043.0,Dry,-8.02938604061173,High,0.0,10000.0
9653.0,24/02/2024 08AM,London,Greenwich,3887.0,Wet,19.1,High,0.0,10000.0
,24/02/2024 10AM,London,Kensington,2240.0,Dry,29.46,Medium,0.0,
9655.0,2024-02-24T12:00Z,London,Islington,1128.0,,27.15,Medium,0.0,10000.0
9656.0,2024-02-24T14:00Z,London,Camden,2196.0,Wet,19.49,Medium,,10000.0
9657.0,2024-02-24T16:00Z,London,Southwark,4181.0,Dry,31.09,High,0.0,10000.0
9658.0,2024-02-24T18:00Z,London,Greenwich,4121.0,Wet,3.0,High,3.0,10000.0
9659.0,2024-02-24T20:00Z,London,Southwark,1167.0,Dry,61.45,Low,0.6596813011388054,10000.0
9660.0,2024-02-24 22:00,London,Greenwich,2036.0,Dry,509.54354502395597,,0.0,10000.0
9661.0,25/02/2024 12AM,,Kensington,36.0,Dry,73.36,Low,,10000.0
9662.0,25/02/2024 02AM,London,Westminster,433.0,Dry,55.9,Low,0.0,
,25/02/2024 04AM,London,Southwark,131.0,,504.5699041646938,Low,17.281305003612236,10000.0
9664.0,2024-02-25 06:00,London,Camden,,Wet,44.67,Low,1.0,10000.0
9665.0,2024-02-25T08:00Z,London,Southwark,,Dry,93.61,Low,0.0,10000.0
9666.0,2024-02-25T10:00Z,London,Southwark,1153.0,,53.6,Low,,10000.0
9667.0,2024-02-25T12:00Z,London,Chelsea,1059.0,Damaged,60.05,Low,0.0,10000.0
9668.0,2024-02-25 14:00,,Westminster,1888.0,,42.1,Medium,0.0,10000.0
9669.0,25/02/2024 04PM,London,Islington,2867.0,Snowy,35.86,Medium,1.0,10000.0
9670.0,2024-02-25 18:00,London,Westminster,,Dry,79.06,Low,0.0,10000.0
9671.0,25/02/2024 08PM,,Islington,1101.0,Dry,79.54,Low,0.0,10000.0
9672.0,2024-02-25 22:00,London,,,Damaged,50.1,Low,0.0,
9673.0,2024-02-26 00:00,London,Greenwich,,Wet,55.75,Low,2.0,10000.0
9674.0,26/02/2024 02AM,,Greenwich,33.0,Dry,77.75,Low,0.0,10000.0
9675.0,,London,Islington,,,85.95,Low,0.0,10000.0
9676.0,2024-02-26 06:00,London,Kensington,828.0,Wet,37.19,Low,0.0,10000.0
9677.0,2024-02-26T08:00Z,,Greenwich,2218.0,Dry,37.38,Medium,-3.7790542101140505,
9678.0,2024-02-26 10:00,London,Westminster,2169.0,Dry,39.03,Medium,,
9679.0,2024-02-26T12:00Z,London,Greenwich,,,77.06,Low,0.0,10000.0
9680.0,2024-02-26T14:00Z,London,Islington,,Dry,77.78,Low,0.0,10000.0
9681.0,2024-02-26T16:00Z,London,Islington,2206.0,,36.09,Medium,0.0,10000.0
,2024-02-26 18:00,London,Chelsea,,Damaged,40.06,Low,0.0,49980.903642888545
,,London,Camden,1687.0,Dry,42.46,Medium,0.0,10000.0
9684.0,2024-02-26T22:00Z,London,Islington,,,,Low,0.0,10000.0
9685.0,27/02/2024 12AM,London,Camden,43.0,Dry,73.64,Low,0.0,10000.0
9686.0,2024-02-27 02:00,London,Kensington,143.0,,65.44,Low,0.0,10000.0
9687.0,2024-02-27 04:00,,,174.0,,516.9312913803982,Low,0.0,10000.0
9688.0,27/02/2024 06AM,London,,19976.249154181303,Wet,16.33,High,57.576512157923304,10000.0
9689.0,,London,Greenwich,30006.151179802724,Dry,10.25,High,,49994.180227278855
9690.0,27/02/2024 10AM,London,Westminster,2330.0,Dry,28.24,Medium,0.0,10000.0
9691.0,2024-02-27T12:00Z,London,,,Snowy,60.89,,0.0,10000.0
9692.0,2024-02-27T14:00Z,London,Chelsea,2053.0,Dry,37.08,Medium,,
9693.0,2024-02-27T16:00Z,London,Kensington,2787.0,,-13.982613549410923,High,0.0,10000.0
9694.0,2024-02-27T18:00Z,London,Southwark,4791.0,Dry,21.3,High,0.0,
9695.0,2024-02-27 20:00,London,Camden,1192.0,Wet,,Low,0.0,10000.0
9696.0,2024-02-27T22:00Z,,Camden,1422.0,Snowy,54.47,Low,0.0,10000.0
9697.0,28/02/2024 12AM,London,Chelsea,32.0,Dry,45.62,Low,0.0,10000.0
9698.0,28/02/2024 02AM,London,Southwark,30006.097872396742,Dry,16.85,High,0.0,10000.0
9699.0,2024-02-28T04:00Z,London,Kensington,,Dry,50.52,Low,0.0,10000.0
9700.0,2024-02-28T06:00Z,London,Camden,1613.0,Dry,-23.565854743386115,High,,10000.0
9701.0,2024-02-28 08:00,London,Westminster,,Dry,83.6,Low,0.0,
9702.0,2024-02-28T10:00Z,,Greenwich,2262.0,Wet,16.58,Medium,0.0,10000.0
9703.0,2024-02-28 12:00,London,Greenwich,1323.0,Dry,69.31,Low,1.0,10000.0
9704.0,2024-02-28T14:00Z,London,Southwark,1634.0,Dry,34.91,Medium,0.0,10000.0
9705.0,2024-02-28 16:00,London,Islington,4638.0,Dry,12.83,High,0.0,10000.0
9706.0,2024-02-28 18:00,,Islington,4372.0,,18.07,,,10000.0
9707.0,28/02/2024 08PM,London,,19983.349230923803,Dry,15.43,High,1.0,10000.0
9708.0,2024-02-28T22:00Z,London,Westminster,2187.0,Dry,26.82,Medium,0.0,10000.0
9709.0,2024-02-29 00:00,London,Kensington,287.0,Snowy,41.46,Low,1.0,10000.0
9710.0,29/02/2024 02AM,London,Chelsea,189.0,Wet,63.15,Low,0.0,10000.0
9711.0,2024-02-29 04:00,London,Southwark,,,,Low,0.0,10000.0
,29/02/2024 06AM,London,Chelsea,,Dry,59.99,Low,,10000.0
,29/02/2024 08AM,London,,2863.0,Dry,17.66,Medium,,120013.7837246213
9714.0,2024-02-29 10:00,London,Camden,1340.0,Wet,66.4,Low,,
9715.0,2024-02-29 12:00,London,Islington,898.0,Dry,66.81,Low,0.0,10000.0
9716.0,2024-02-29T14:00Z,,Kensington,1326.0,Dry,83.36,Low,0.0,
9717.0,29/02/2024 04PM,London,Westminster,2668.0,Dry,21.04,Medium,0.0,10000.0
9718.0,2024-02-29T18:00Z,London,Chelsea,2022.0,Snowy,,Low,,
9719.0,29/02/2024 08PM,London,Westminster,19986.074683018694,Dry,-25.132372031035686,High,0.0,10000.0
9720.0,29/02/2024 10PM,London,Southwark,1919.0,Wet,28.99,Medium,-1.4048009482949135,10000.0
9721.0,2024-03-01 00:00,,Greenwich,43.0,Dry,60.97,Low,0.0,10000.0
9722.0,2024-03-01 02:00,London,Southwark,223.0,Dry,75.04,Low,0.0,
9723.0,2024-03-01 04:00,London,Westminster,447.0,Wet,78.04,Low,,10000.0
9724.0,01/03/2024 06AM,London,Islington,2141.0,Wet,23.68,Medium,0.0,49990.40216496568
9725.0,2024-03-01 08:00,London,Camden,3588.0,,13.19,High,0.0,10000.0
9726.0,2024-03-01T10:00Z,London,Westminster,2465.0,Dry,53.5,Medium,0.0,10000.0
9727.0,2024-03-01 12:00,London,Greenwich,1819.0,Dry,36.06,,0.0,
,2024-03-01T14:00Z,London,Southwark,1864.0,Dry,39.06,Medium,0.0,10000.0
9729.0,01/03/2024 04PM,London,Chelsea,4822.0,Dry,34.13,High,0.0,10000.0
,01/03/2024 06PM,London,Greenwich,2432.0,Snowy,22.25,Medium,0.0,10000.0
9731.0,,London,,2025.0,Dry,24.09,Medium,0.0,10000.0
9732.0,01/03/2024 10PM,London,Southwark,2126.0,Dry,38.96,Medium,0.0,10000.0
9733.0,02/03/2024 12AM,London,Kensington,409.0,Dry,57.88,Low,0.0,10000.0
,2024-03-02T02:00Z,London,Westminster,,,55.38,Low,0.0,10000.0
9735.0,2024-03-02 04:00,London,Chelsea,,Dry,69.1,Low,-3.3793169829642378,10000.0
9736.0,2024-03-02 06:00,,Southwark,,Dry,89.52,Low,0.0,10000.0
9737.0,02/03/2024 08AM,London,Kensington,4323.0,Dry,11.46,High,1.0,10000.0
9738.0,,London,Westminster,931.0,Dry,72.22,,,10000.0
9739.0,2024-03-02 12:00,London,Greenwich,1603.0,Dry,41.54,Medium,0.0,10000.0
,2024-03-02 14:00,London,Kensington,19975.050071265967,Damaged,3.0,High,64.6062288018057,10000.0
9741.0,2024-03-02 16:00,London,Islington,,Wet,45.24,,1.0,120017.89842087441
9742.0,02/03/2024 06PM,London,Westminster,2994.0,Dry,-6.461014605378608,High,0.0,10000.0
9743.0,2024-03-02 20:00,London,Islington,1638.0,Dry,42.7,Medium,0.0,10000.0
,,London,Islington,1883.0,Damaged,30.41,,1.0,10000.0
9745.0,2024-03-03 00:00,London,,119.0,Dry,88.62,Low,0.0,
9746.0,2024-03-03 02:00,London,Camden,30018.855904233744,Dry,20.06,High,0.0,10000.0
,,,,30014.752752136203,,-5.283615653668953,High,0.0,10000.0
9748.0,03/03/2024 06AM,,Kensington,2085.0,Dry,33.88,Medium,0.0,10000.0
9749.0,2024-03-03 08:00,London,Southwark,30023.844414203555,Wet,3.0,High,0.0,120023.6007332313
,03/03/2024 10AM,London,Westminster,1476.0,Dry,59.88,Low,0.0,10000.0
9751.0,2024-03-03T12:00Z,,Southwark,959.0,Dry,81.42,Low,0.0,10000.0
9752.0,2024-03-03T14:00Z,,Camden,30007.10789207088,Dry,,High,1.0,10000.0
9753.0,2024-03-03 16:00,London,Southwark,3937.0,Dry,,High,0.0,
9754.0,2024-03-03 18:00,,Islington,30012.26285141775,Dry,,High,0.0,10000.0
9755.0,2024-03-03 20:00,,Westminster,852.0,,73.8,Low,0.0,10000.0
9756.0,,London,Kensington,678.0,Dry,52.72,Low,0.0,10000.0
9757.0,04/03/2024 12AM,London,Greenwich,290.0,Dry,89.84,Low,1.0,10000.0
9758.0,2024-03-04T02:00Z,London,Camden,8.0,Dry,,Low,0.0,10000.0
9759.0,2024-03-04T04:00Z,London,Kensington,113.0,Dry,31.6,Medium,0.0,10000.0
9760.0,2024-03-04 06:00,London,Chelsea,2447.0,Wet,33.9,Medium,0.0,
9761.0,04/03/2024 08AM,London,Southwark,,Dry,70.41,Low,0.0,10000.0
9762.0,04/03/2024 10AM,London,Camden,1611.0,,510.8427616953115,Medium,0.0,120000.63241023288
,04/03/2024 12PM,London,Camden,1014.0,Damaged,54.23,Low,0.0,10000.0
,04/03/2024 02PM,London,Camden,1167.0,Dry,74.29,,0.0,10000.0
9765.0,2024-03-04 16:00,London,Westminster,4814.0,Dry,23.05,,0.0,10000.0
9766.0,04/03/2024 06PM,London,Camden,2841.0,Dry,43.53,Medium,0.0,10000.0
9767.0,04/03/2024 08PM,London,Camden,2223.0,Dry,34.26,Medium,0.0,10000.0
,04/03/2024 10PM,London,Camden,19983.27509431837,Dry,16.25,High,0.0,10000.0
9769.0,2024-03-05 00:00,London,Camden,30005.997107219406,Dry,22.01,High,50.004843912789255,10000.0
9770.0,05/03/2024 02AM,London,Kensington,181.0,Dry,75.12,,0.0,10000.0
9771.0,2024-03-05 04:00,London,Kensington,405.0,,514.7998399436311,Low,0.0,49990.32571735837
9772.0,,London,Kensington,1425.0,Dry,-3.986571600583204,High,0.0,10000.0
9773.0,TBD,London,Westminster,452.0,Wet,54.67,Low,64.97336223805297,10000.0
9774.0,05/03/2024 10AM,London,Islington,1020.0,Dry,98.02,Low,0.0,10000.0
9775.0,2024-03-05T12:00Z,London,Camden,1026.0,Dry,64.88,Low,0.0,10000.0
,2024-03-05T14:00Z,London,Camden,1552.0,Dry,28.06,Medium,0.0,10000.0
9777.0,2024-03-05 16:00,London,Greenwich,2054.0,Damaged,,Low,0.0,10000.0
9778.0,05/03/2024 06PM,London,,4297.0,Dry,27.08,High,0.0,10000.0
9779.0,Unknown,London,Westminster,30000.743755829724,Dry,22.86,High,0.0,10000.0
,2024-03-05 22:00,London,Chelsea,1912.0,Dry,42.37,Medium,58.25826962405132,10000.0
9781.0,2024-03-06 00:00,London,Westminster,467.0,Dry,98.24,,0.0,10000.0
9782.0,2024-03-06T02:00Z,London,Westminster,28.0,Dry,68.58,Low,3.0,10000.0
,2024-03-06T04:00Z,London,Westminster,,Wet,51.73,,0.0,10000.0
9784.0,2024-03-06T06:00Z,London,Chelsea,1926.0,Dry,,Low,7.097994546562644,10000.0
9785.0,2024-03-06T08:00Z,London,Chelsea,4249.0,Dry,-2.407872601038818,High,0.0,10000.0
,06/03/2024 10AM,,Islington,944.0,Dry,520.5151596761509,,0.0,10000.0
9787.0,2024-03-06T12:00Z,London,Greenwich,1797.0,Wet,27.8,,0.727197045782292,10000.0
9788.0,2024-03-06T14:00Z,London,Islington,1787.0,Wet,40.96,,0.0,10000.0
9789.0,2024-03-06 16:00,London,Southwark,2951.0,Dry,,Low,,10000.0
9790.0,06/03/2024 06PM,London,Greenwich,2326.0,Dry,45.66,,0.0,10000.0
9791.0,2024-03-06 20:00,London,Camden,1510.0,Dry,45.9,Medium,0.0,10000.0
9792.0,2024-03-06 22:00,,Southwark,1046.0,,60.32,Low,0.0,
9793.0,07/03/2024 12AM,London,Southwark,58.0,Snowy,82.55,Low,0.0,10000.0
9794.0,07/03/2024 02AM,London,Chelsea,146.0,Dry,69.12,Low,0.0,10000.0
,,London,Westminster,594.0,Dry,63.02,Low,0.0,10000.0
9796.0,2024-03-07T06:00Z,London,Westminster,2463.0,Dry,48.7,Medium,0.0,10000.0
9797.0,2024-03-07 08:00,London,Chelsea,30018.7061803404,Dry,19.33,High,1.0,10000.0
9798.0,2024-03-07T10:00Z,London,Kensington,2055.0,,39.65,Medium,0.0,10000.0
9799.0,2024-03-07T12:00Z,London,Chelsea,1245.0,Dry,74.51,,0.0,10000.0
9800.0,2024-03-07T14:00Z,London,Westminster,1577.0,Dry,25.16,Medium,0.0,10000.0
9801.0,07/03/2024 04PM,London,Camden,2543.0,,34.68,Medium,0.0,10000.0
9802.0,2024-03-07 18:00,London,Greenwich,4111.0,Wet,10.2,High,2.0,10000.0
9803.0,,London,Camden,19997.57880023164,Dry,22.97,High,0.0,10000.0
9804.0,2024-03-07 22:00,London,Camden,919.0,,73.78,Low,0.0,10000.0
9805.0,2024-03-08 00:00,London,Camden,303.0,Dry,85.43,,0.0,120005.03278080845
9806.0,2024-03-08T02:00Z,London,,340.0,Dry,79.57,Low,0.0,
9807.0,08/03/2024 04AM,London,Westminster,355.0,Dry,64.35,Low,0.0,
9808.0,2024-03-08T06:00Z,London,Southwark,,Dry,55.42,Low,0.0,10000.0
9809.0,2024-03-08T08:00Z,London,Southwark,3946.0,Dry,12.22,High,0.0,10000.0
9810.0,2024-03-08T10:00Z,London,Greenwich,,Dry,56.16,Low,0.0,10000.0
9811.0,2024-03-08T12:00Z,London,Chelsea,1157.0,Dry,507.347337995443,Low,,10000.0
9812.0,08/03/2024 02PM,London,Kensington,1999.0,Dry,41.3,,0.0,10000.0
9813.0,2024-03-08T16:00Z,London,Southwark,2194.0,Dry,58.42,Medium,0.0,10000.0
9814.0,2024-03-08 18:00,London,Camden,2229.0,Wet,20.03,Medium,0.0,10000.0
9815.0,2024-03-08T20:00Z,London,Islington,1831.0,Wet,36.39,Medium,0.0,10000.0
9816.0,2024-03-08T22:00Z,,Chelsea,30006.26295692989,Wet,,High,18.592315680662264,10000.0
9817.0,2024-03-09 00:00,London,Westminster,482.0,Dry,68.38,Low,0.0,10000.0
9818.0,09/03/2024 02AM,London,Kensington,161.0,Dry,91.89,Low,,10000.0
,09/03/2024 04AM,London,Camden,130.0,Dry,70.83,Low,0.0,10000.0
9820.0,2024-03-09 06:00,London,Westminster,1946.0,Dry,-10.75608447601854,High,1.0,10000.0
9821.0,2024-03-09 08:00,London,Kensington,2523.0,Wet,30.85,Medium,0.0,
9822.0,2024-03-09 10:00,London,Chelsea,2450.0,Dry,30.09,Medium,,120014.81043338025
9823.0,2024-03-09 12:00,London,Westminster,1449.0,Dry,,Low,0.0,10000.0
,2024-03-09T14:00Z,London,Islington,1075.0,Dry,,Low,,10000.0
9825.0,,London,,1883.0,Dry,,Low,0.0,10000.0
9826.0,2024-03-09T18:00Z,London,Kensington,2536.0,Dry,23.25,,0.0,10000.0
9827.0,2024-03-09T20:00Z,London,,955.0,Dry,73.17,Low,0.0,10000.0
9828.0,09/03/2024 10PM,London,Chelsea,989.0,,85.57,Low,0.0,
9829.0,2024-03-10T00:00Z,London,Kensington,30011.70745740152,Wet,3.0,High,3.0,10000.0
9830.0,10/03/2024 02AM,London,Camden,429.0,Wet,71.97,Low,1.0,10000.0
9831.0,,London,Camden,19996.81195195507,Dry,18.69,High,0.0,49998.50929020288
,,London,Kensington,2328.0,Dry,46.75,Medium,,120021.6755093606
9833.0,2024-03-10T08:00Z,London,Camden,,Dry,81.3,Low,0.0,10000.0
9834.0,2024-03-10 10:00,London,Islington,2392.0,,50.3,Medium,0.0,10000.0
9835.0,2024-03-10T12:00Z,,Camden,1811.0,,,Low,0.0,10000.0
,2024-03-10T14:00Z,London,Camden,1121.0,Dry,54.2,Low,0.0,10000.0
9837.0,,London,Greenwich,2534.0,Dry,48.38,Medium,12.927842681629006,10000.0
9838.0,2024-03-10T18:00Z,London,Greenwich,3254.0,,17.65,,0.0,49988.7676372131
,,London,,30012.644352090723,Dry,23.42,High,0.0,10000.0
9840.0,2099-13-40 25:61,London,Greenwich,2807.0,Wet,38.6,Medium,0.0,10000.0
9841.0,11/03/2024 12AM,London,Camden,105.0,Dry,78.51,Low,0.0,10000.0
9842.0,11/03/2024 02AM,London,Greenwich,389.0,Dry,71.05,Low,0.0,10000.0
9843.0,2024-03-11 04:00,London,Camden,278.0,Wet,-7.462155584801373,High,0.0,10000.0
9844.0,,London,Kensington,712.0,Dry,74.67,Low,0.0,10000.0
,11/03/2024 08AM,London,,,Dry,,Low,0.0,10000.0
9846.0,2024-03-11T10:00Z,London,Kensington,30009.63358326802,Dry,18.94,High,1.0,10000.0
9847.0,2024-03-11 12:00,London,Chelsea,2101.0,Damaged,6.16,High,0.0,10000.0
9848.0,11/03/2024 02PM,London,Camden,2336.0,Dry,518.7518794287672,Medium,0.0,10000.0
9849.0,11/03/2024 04PM,London,Islington,,Dry,78.62,Low,0.0,10000.0
9850.0,2024-03-11 18:00,London,Greenwich,3329.0,,-20.058394815923847,High,0.0,10000.0
,2024-03-11T20:00Z,London,Southwark,1401.0,Dry,72.22,Low,6.226075799494767,10000.0
9852.0,2024-03-11 22:00,London,Greenwich,1597.0,Dry,,Low,8.716078503130888,10000.0
9853.0,2024-03-12 00:00,,Camden,,Dry,78.5,Low,0.0,10000.0
9854.0,12/03/2024 02AM,London,Westminster,266.0,Dry,70.15,Low,0.0,10000.0
9855.0,2024-03-12T04:00Z,London,Greenwich,19979.934044516634,Dry,18.99,High,0.0,10000.0
9856.0,12/03/2024 06AM,London,,1588.0,Damaged,18.86,Medium,2.0,10000.0
9857.0,2024-03-12 08:00,,Westminster,2240.0,Dry,39.05,Medium,0.0,
9858.0,,London,Greenwich,1745.0,Damaged,10.75,High,0.0,10000.0
9859.0,12/03/2024 12PM,London,,1329.0,Dry,,,0.0,
9860.0,12/03/2024 02PM,London,Southwark,,Dry,64.19,Low,0.0,
9861.0,,London,Kensington,2849.0,Wet,10.21,High,0.0,10000.0
9862.0,,London,Greenwich,1947.0,Dry,-10.641561092163345,High,0.0,10000.0
9863.0,12/03/2024 08PM,London,Islington,2482.0,,46.83,Medium,0.0,10000.0
9864.0,,London,Islington,1401.0,Dry,80.58,Low,0.0,10000.0
9865.0,2024-03-13 00:00,London,Chelsea,425.0,Dry,52.53,Low,0.0,10000.0
9866.0,2024-03-13 02:00,,Westminster,,Dry,56.0,Low,,10000.0
9867.0,2024-03-13 04:00,London,Chelsea,253.0,Dry,46.29,Low,0.0,10000.0
9868.0,2024-03-13 06:00,,,1622.0,,46.27,Medium,0.0,10000.0
9869.0,2024-03-13 08:00,London,Greenwich,4042.0,Dry,27.35,High,50.72244227954313,120012.5874829383
9870.0,13/03/2024 10AM,London,Kensington,2414.0,Dry,30.48,Medium,0.0,10000.0
9871.0,13/03/2024 12PM,London,Islington,1883.0,Dry,38.63,Medium,0.0,10000.0
9872.0,2024-03-13 14:00,London,,2030.0,Dry,520.8883970248263,Medium,0.0,10000.0
9873.0,13/03/2024 04PM,,Kensington,,Dry,-16.9773892555038,Low,0.0,10000.0
9874.0,2024-03-13T18:00Z,London,Westminster,3878.0,Dry,23.79,High,69.49108719201674,10000.0
9875.0,2024-03-13T20:00Z,London,Camden,2189.0,Wet,22.65,Medium,3.223300104759195,10000.0
9876.0,,London,Westminster,829.0,Snowy,62.18,,0.0,10000.0
9877.0,2024-03-14 00:00,London,Islington,94.0,Dry,519.0012922945377,Low,0.0,10000.0
9878.0,,London,,1297.0,Dry,70.08,Low,0.0,10000.0
9879.0,14/03/2024 04AM,London,,30006.670719228314,Wet,3.0,High,0.0,10000.0
9880.0,2024-03-14T06:00Z,London,Chelsea,19975.485552361344,Dry,8.24,High,0.0,10000.0
9881.0,14/03/2024 08AM,London,Islington,4048.0,,3.0,High,3.0,10000.0
9882.0,2024-03-14T10:00Z,London,Chelsea,30012.738652909957,Wet,,High,9.700462692105742,
9883.0,14/03/2024 12PM,London,Greenwich,1897.0,Dry,49.16,Medium,,10000.0
9884.0,2024-03-14T14:00Z,,Southwark,1644.0,Dry,44.39,Medium,0.0,10000.0
9885.0,2024-03-14 16:00,London,Chelsea,3618.0,Dry,3.0,High,0.0,10000.0
9886.0,14/03/2024 06PM,London,Islington,30021.55256695246,Dry,11.52,High,2.0,10000.0
9887.0,2024-03-14T20:00Z,London,,,Dry,70.87,Low,0.0,
9888.0,14/03/2024 10PM,London,Greenwich,987.0,Dry,66.17,Low,-4.891917464941213,10000.0
9889.0,15/03/2024 12AM,London,Greenwich,17.0,Dry,77.88,Low,0.0,120002.93058584354
9890.0,2024-03-15 02:00,London,Camden,322.0,Dry,75.86,Low,2.0,10000.0
9891.0,2024-03-15 04:00,London,Greenwich,281.0,Dry,59.63,Low,0.0,10000.0
9892.0,15/03/2024 06AM,London,Greenwich,1818.0,Dry,,,0.0,
,2024-03-15 08:00,London,Camden,2293.0,Dry,33.3,Medium,0.0,10000.0
,15/03/2024 10AM,London,Chelsea,1782.0,Wet,32.81,Medium,62.438152258929854,
9895.0,2024-03-15 12:00,London,Islington,1392.0,Wet,42.44,Low,0.0,10000.0
9896.0,2024-03-15T14:00Z,London,Camden,1009.0,Dry,79.31,,0.0,10000.0
9897.0,2024-03-15 16:00,London,Southwark,2206.0,,46.84,Medium,0.0,10000.0
9898.0,15/03/2024 06PM,London,Westminster,4161.0,Dry,22.6,High,0.0,10000.0
9899.0,2024-03-15 20:00,London,Islington,,Dry,74.23,Low,12.440190951090713,10000.0
9900.0,2024-03-15T22:00Z,London,Chelsea,1252.0,Dry,46.28,Low,0.0,10000.0
9901.0,16/03/2024 12AM,London,Kensington,40.0,Dry,65.37,Low,58.51585499072536,10000.0
9902.0,2024-03-16 02:00,London,Greenwich,,Dry,,Low,0.0,
9903.0,2024-03-16T04:00Z,London,Islington,159.0,Damaged,42.46,Low,,10000.0
9904.0,2024-03-16T06:00Z,London,Chelsea,2460.0,Dry,35.08,Medium,0.0,10000.0
9905.0,2024-03-16 08:00,,Kensington,4985.0,,,High,0.0,120010.98644256266
9906.0,16/03/2024 10AM,London,Chelsea,2217.0,Dry,34.76,Medium,66.99992968855443,10000.0
9907.0,2024-03-16 12:00,,Islington,1275.0,Dry,,Low,0.0,10000.0
9908.0,2024-03-16 14:00,London,,1581.0,Dry,30.58,Medium,,10000.0
9909.0,16/03/2024 04PM,London,Chelsea,2540.0,Dry,27.01,Medium,0.0,10000.0
9910.0,2024-03-16 18:00,London,Chelsea,3953.0,,24.03,,0.0,49982.45011750974
9911.0,16/03/2024 08PM,London,Kensington,2181.0,Damaged,24.58,Medium,0.0,10000.0
9912.0,2024-03-16 22:00,London,Islington,1473.0,Dry,55.38,Low,0.0,10000.0
9913.0,2024-03-17T00:00Z,London,Westminster,426.0,Wet,53.48,Low,0.0,10000.0
9914.0,,London,Camden,1624.0,,43.05,Medium,0.0,10000.0
9915.0,,London,Greenwich,,Dry,79.44,Low,72.00758105207163,10000.0
9916.0,2024-03-17 06:00,London,Chelsea,872.0,Snowy,62.37,Low,1.0,10000.0
9917.0,17/03/2024 08AM,London,Islington,3846.0,Dry,4.99,High,2.0,49996.598583773724
9918.0,2024-03-17T10:00Z,London,Southwark,1279.0,Dry,53.79,Low,0.0,10000.0
9919.0,2024-03-17T12:00Z,London,Camden,1403.0,Dry,,Low,,10000.0
9920.0,2024-03-17 14:00,London,Southwark,1991.0,Dry,33.56,Medium,,10000.0
9921.0,17/03/2024 04PM,,Westminster,2103.0,Wet,24.67,Medium,0.0,10000.0
9922.0,17/03/2024 06PM,London,Westminster,4020.0,Dry,21.94,High,0.0,10000.0
9923.0,17/03/2024 08PM,London,Islington,2157.0,Dry,33.31,Medium,0.0,49995.3632270034
9924.0,17/03/2024 10PM,,Chelsea,2233.0,Dry,507.1932667145484,Medium,0.0,10000.0
9925.0,18/03/2024 12AM,London,Camden,101.0,Dry,60.32,Low,2.0,10000.0
9926.0,18/03/2024 02AM,London,Greenwich,153.0,Dry,50.46,Low,0.0,10000.0
9927.0,2024-03-18 04:00,London,Chelsea,487.0,Dry,85.98,Low,0.0,10000.0
9928.0,2024-03-18T06:00Z,London,Greenwich,2367.0,Wet,-4.468595775945534,High,2.0,10000.0
9929.0,2024-03-18 08:00,,,2778.0,Dry,31.05,Medium,14.326601173030532,10000.0
9930.0,18/03/2024 10AM,London,Greenwich,30005.07949783595,Dry,3.0,High,0.0,10000.0
9931.0,2024-03-18 12:00,London,Westminster,30006.208367851956,Dry,5.83,High,,10000.0
,18/03/2024 02PM,London,,1561.0,Dry,35.99,Medium,0.0,10000.0
9933.0,18/03/2024 04PM,London,Southwark,4712.0,Dry,16.94,High,0.0,10000.0
9934.0,2024-03-18T18:00Z,London,Southwark,,Dry,76.08,Low,3.0,10000.0
,18/03/2024 08PM,London,Westminster,1225.0,,-24.504745646815824,High,0.0,10000.0
9936.0,2024-03-18T22:00Z,London,Southwark,,Dry,83.61,Low,0.0,10000.0
9937.0,2024-03-19 00:00,London,Kensington,210.0,Dry,44.9,Low,,10000.0
9938.0,2024-03-19T02:00Z,London,Camden,23.0,Dry,,Low,0.0,10000.0
9939.0,2024-03-19T04:00Z,,Chelsea,224.0,,76.73,Low,0.0,10000.0
9940.0,19/03/2024 06AM,London,Greenwich,1066.0,Dry,70.31,Low,0.0,10000.0
9941.0,2024-03-19 08:00,London,Camden,4164.0,,9.14,High,0.0,10000.0
9942.0,2024-03-19T10:00Z,London,,30004.354765781754,Dry,14.08,High,0.0,10000.0
9943.0,2024-03-19T12:00Z,London,Kensington,2157.0,Dry,35.71,Medium,0.0,10000.0
9944.0,19/03/2024 02PM,London,Camden,,Dry,89.72,Low,0.0,10000.0
9945.0,2024-03-19 16:00,,Camden,3524.0,Dry,29.25,High,2.0,120010.71609244672
,2024-03-19T18:00Z,London,Southwark,2549.0,Dry,32.76,Medium,0.0,10000.0
,2024-03-19T20:00Z,London,Kensington,1361.0,Dry,507.1746848215651,,0.0,
9948.0,2024-03-19T22:00Z,London,Southwark,1037.0,Dry,81.94,Low,0.0,10000.0
9949.0,2024-03-20 00:00,London,Islington,350.0,Dry,,Low,0.0,10000.0
9950.0,2024-03-20T02:00Z,London,Camden,7.0,Snowy,57.95,Low,0.0,10000.0
9951.0,2024-03-20T04:00Z,London,Greenwich,427.0,Dry,67.35,Low,0.0,10000.0
9952.0,20/03/2024 06AM,London,Camden,1538.0,Dry,33.6,Medium,0.0,10000.0
9953.0,2024-03-20 08:00,,Camden,3250.0,Dry,35.23,,67.55911448572431,10000.0
9954.0,20/03/2024 10AM,,Islington,894.0,,66.89,Low,,
9955.0,20/03/2024 12PM,London,Islington,2263.0,Dry,41.81,Medium,0.0,10000.0
9956.0,2024-03-20T14:00Z,London,Southwark,,Wet,38.93,Low,1.0,10000.0
9957.0,20/03/2024 04PM,London,,3890.0,Dry,29.47,High,0.0,10000.0
9958.0,2024-03-20 18:00,London,Islington,2006.0,Dry,33.92,Medium,0.0,120009.10652149539
9959.0,2024-03-20 20:00,London,,1773.0,Wet,13.68,High,0.0,120022.28447760074
9960.0,2024-03-20 22:00,London,Chelsea,953.0,Dry,67.0,Low,0.0,10000.0
9961.0,2024-03-21T00:00Z,London,Westminster,470.0,Dry,68.91,Low,0.0,10000.0
9962.0,,London,Chelsea,2173.0,Dry,54.61,Medium,0.0,10000.0
,,London,Camden,1302.0,Wet,69.15,Low,0.0,10000.0
9964.0,,London,Islington,,Dry,63.61,Low,66.11218800885462,10000.0
9965.0,2024-03-21T08:00Z,London,,4617.0,Dry,22.07,High,0.0,10000.0
9966.0,2024-03-21 10:00,London,,1374.0,,79.66,Low,0.0,10000.0
9967.0,2024-03-21T12:00Z,London,Southwark,1198.0,Dry,-18.320325873400883,High,2.0,10000.0
9968.0,2024-03-21 14:00,London,,2438.0,Dry,52.28,Medium,0.0,10000.0
9969.0,2024-03-21T16:00Z,London,Kensington,30012.90731021381,Wet,14.89,High,0.0,10000.0
9970.0,21/03/2024 06PM,London,Westminster,4076.0,Wet,16.63,,71.18907120248018,10000.0
9971.0,21/03/2024 08PM,London,Chelsea,1215.0,Dry,60.12,Low,4.280089149893996,10000.0
9972.0,2024-03-21T22:00Z,,Camden,2172.0,Dry,56.15,Medium,14.877335001965754,10000.0
9973.0,2024-03-22 00:00,London,Greenwich,123.0,Dry,,Low,0.0,10000.0
9974.0,22/03/2024 02AM,London,Westminster,,Dry,61.35,Low,0.0,10000.0
9975.0,22/03/2024 04AM,London,Southwark,102.0,Dry,,Low,0.0,10000.0
9976.0,22/03/2024 06AM,London,Islington,1156.0,Dry,90.83,Low,0.0,10000.0
9977.0,2024-03-22 08:00,London,Kensington,2597.0,Dry,44.54,,,10000.0
9978.0,2024-03-22T10:00Z,,,1811.0,Dry,58.98,Medium,0.0,10000.0
9979.0,22/03/2024 12PM,London,Westminster,1955.0,Dry,,Low,0.0,10000.0
9980.0,2024-03-22T14:00Z,London,Kensington,2034.0,Dry,28.9,Medium,1.0,10000.0
9981.0,22/03/2024 04PM,London,Westminster,3364.0,Damaged,3.0,High,0.0,120001.43864315255
,22/03/2024 06PM,London,Westminster,2723.0,Dry,26.81,Medium,0.0,10000.0
9983.0,2024-03-22T20:00Z,London,Greenwich,19991.653649154843,Dry,15.76,High,0.0,10000.0
9984.0,2024-03-22 22:00,London,,904.0,Dry,63.66,Low,0.0,10000.0
9985.0,2024-03-23T00:00Z,London,,,Wet,46.16,Low,59.85694196822654,10000.0
9986.0,2024-03-23T02:00Z,London,Westminster,118.0,,-23.522355535866993,High,0.0,10000.0
9987.0,2024-03-23T04:00Z,,Kensington,225.0,Dry,78.41,Low,0.0,10000.0
9988.0,2024-03-23T06:00Z,London,Southwark,2207.0,Wet,36.85,Medium,7.786461693617923,10000.0
9989.0,23/03/2024 08AM,London,Islington,2247.0,,24.88,Medium,,49985.63794116534
9990.0,23/03/2024 10AM,London,Kensington,968.0,Dry,60.26,Low,2.0,10000.0
9991.0,23/03/2024 12PM,London,Islington,1004.0,Dry,45.98,,0.0,10000.0
9992.0,2024-03-23 14:00,London,Westminster,1382.0,Dry,84.58,Low,0.0,10000.0
9993.0,2024-03-23 16:00,London,Westminster,4653.0,Damaged,-8.55347214742655,High,0.0,10000.0
9994.0,2024-03-23 18:00,London,Chelsea,3137.0,Snowy,504.66934788024105,Medium,,49991.926856187354
9995.0,2024-03-23 20:00,London,Greenwich,1667.0,,55.4,Medium,,10000.0
,2024-03-23T22:00Z,London,Chelsea,1049.0,Wet,52.26,Low,0.0,10000.0
9997.0,2024-03-24T00:00Z,London,Greenwich,479.0,Dry,53.25,Low,0.0,10000.0
9998.0,2024-03-24T02:00Z,London,Greenwich,124.0,Damaged,42.59,Low,15.415256918261651,49987.85866978347
9999.0,2024-03-24T04:00Z,London,Chelsea,30003.1703702507,,3.0,High,0.0,120006.87363107847
10000.0,24/03/2024 06AM,London,,,Damaged,65.13,Low,0.0,10000.0
10001.0,2024-03-24 08:00,London,Kensington,2333.0,Dry,40.65,Medium,0.0,120018.88049935461
10002.0,24/03/2024 10AM,,Westminster,,Dry,74.8,Low,0.0,
10003.0,24/03/2024 12PM,London,Westminster,1133.0,Dry,500.446333257549,Low,0.0,10000.0
10004.0,24/03/2024 02PM,London,Kensington,2412.0,Dry,33.7,Medium,0.0,10000.0
10005.0,24/03/2024 04PM,London,Southwark,3292.0,Dry,17.05,Medium,0.0,10000.0
10006.0,24/03/2024 06PM,,Southwark,2989.0,Dry,-20.682714004134045,High,61.78202659034162,10000.0
10007.0,2024-03-24T20:00Z,London,Islington,2152.0,Dry,,Low,0.0,
10008.0,24/03/2024 10PM,London,Camden,2074.0,,22.18,,0.0,10000.0
10009.0,2024-03-25 00:00,London,Kensington,43.0,Wet,54.36,Low,0.0,10000.0
10010.0,2024-03-25 02:00,London,Greenwich,241.0,Wet,72.93,Low,0.0,10000.0
10011.0,25/03/2024 04AM,London,Camden,30021.359578777498,Dry,33.35,High,0.0,10000.0
10012.0,2024-03-25T06:00Z,London,Islington,2285.0,Dry,56.28,Medium,0.0,
10013.0,2024-03-25 08:00,,Kensington,3244.0,Dry,22.38,Medium,,10000.0
10014.0,2024-03-25 10:00,London,Westminster,971.0,Damaged,505.02738822136206,Low,10.65155756176147,49987.79305957786
10015.0,2024-03-25 12:00,London,Greenwich,1254.0,Wet,513.8368669419472,Low,0.0,10000.0
10016.0,,London,Kensington,1310.0,Wet,57.04,Low,0.0,49983.645555054725
,2024-03-25T16:00Z,London,Kensington,30003.41060160145,Dry,3.46,High,0.0,10000.0
10018.0,,London,Kensington,1358.0,Damaged,68.01,Low,0.0,10000.0
10019.0,25/03/2024 08PM,London,Chelsea,2341.0,Dry,510.90571209737976,Medium,73.94026014095928,10000.0
10020.0,2024-03-25 22:00,London,Kensington,1963.0,Dry,40.42,Medium,0.0,10000.0
10021.0,2024-03-26 00:00,London,Camden,332.0,Dry,65.9,Low,0.0,10000.0
10022.0,2024-03-26T02:00Z,London,Westminster,183.0,Dry,64.6,Low,,10000.0
10023.0,26/03/2024 04AM,London,Westminster,334.0,Dry,500.05500272868665,Low,1.1384532315319538,10000.0
10024.0,,London,Kensington,1524.0,Wet,18.52,Medium,,10000.0
10025.0,2024-03-26T08:00Z,London,Southwark,,Dry,77.28,Low,0.0,10000.0
10026.0,2024-03-26T10:00Z,London,Chelsea,2408.0,Wet,,,1.0,49981.43927683468
10027.0,2024-03-26T12:00Z,London,Chelsea,1439.0,Dry,501.6902978360252,Low,,10000.0
10028.0,2024-03-26 14:00,London,Chelsea,1106.0,Dry,81.23,Low,0.0,120002.9956126667
10029.0,2024-03-26 16:00,London,Islington,3271.0,,19.88,Medium,0.0,10000.0
10030.0,2024-03-26 18:00,London,Chelsea,3665.0,Dry,20.75,High,0.0,10000.0
10031.0,2024-03-26T20:00Z,London,,2380.0,Wet,25.74,Medium,,10000.0
10032.0,,London,Westminster,2041.0,Dry,-17.95176049886581,High,1.0,49978.90902989686
10033.0,27/03/2024 12AM,London,Southwark,277.0,Dry,69.62,Low,0.0,10000.0
,27/03/2024 02AM,London,,402.0,Dry,57.99,Low,0.0,49978.974139937694
10035.0,2024-03-27T04:00Z,London,Greenwich,484.0,Dry,54.61,Low,0.0,10000.0
10036.0,27/03/2024 06AM,London,Islington,1706.0,Dry,40.66,Medium,0.0,10000.0
10037.0,27/03/2024 08AM,London,Kensington,4040.0,Wet,3.0,High,,120017.2620120901
10038.0,27/03/2024 10AM,,,1287.0,Dry,45.3,,0.0,10000.0
10039.0,2024-03-27 12:00,London,Camden,2455.0,Dry,54.8,,0.0,10000.0
10040.0,2024-03-27 14:00,London,Southwark,1062.0,Wet,65.29,Low,0.0,
10041.0,2024-03-27T16:00Z,London,Kensington,,Wet,53.19,Low,6.195706161118219,10000.0
,2024-03-27 18:00,,Camden,4347.0,Dry,29.55,High,0.0,10000.0
10043.0,,London,Islington,,Dry,83.85,Low,0.0,10000.0
10044.0,,London,Camden,2707.0,Dry,35.94,Medium,,
10045.0,2024-03-28 00:00,London,Greenwich,339.0,Dry,524.6963710074242,Low,0.0,10000.0
10046.0,28/03/2024 02AM,London,Greenwich,236.0,Dry,68.15,Low,0.0,10000.0
10047.0,2024-03-28T04:00Z,London,Southwark,307.0,Dry,46.85,Low,,10000.0
10048.0,2024-03-28 06:00,London,Chelsea,,,84.02,Low,0.0,10000.0
,28/03/2024 08AM,London,Chelsea,3157.0,Dry,22.43,Medium,0.0,10000.0
10050.0,2024-03-28T10:00Z,London,Westminster,30005.44319593965,Snowy,-23.739256658485544,High,0.0,10000.0
10051.0,,London,Camden,,Dry,78.03,Low,,
10052.0,28/03/2024 02PM,London,,1163.0,Dry,83.83,Low,0.0,10000.0
,2024-03-28 16:00,London,Westminster,3376.0,Dry,3.0,High,0.0,10000.0
10054.0,2024-03-28T18:00Z,London,Islington,4998.0,,,High,0.0,10000.0
10055.0,2024-03-28T20:00Z,London,Kensington,30005.300646270673,,34.79,High,1.0,10000.0
10056.0,28/03/2024 10PM,London,,2279.0,Dry,23.32,Medium,0.0,
10057.0,2024-03-29T00:00Z,London,Kensington,229.0,Dry,85.39,Low,,10000.0
10058.0,,London,Chelsea,1209.0,Dry,70.69,Low,2.0,10000.0
10059.0,29/03/2024 04AM,London,Southwark,30020.312550909548,Dry,33.17,High,0.0,10000.0
10060.0,2024-03-29T06:00Z,,Islington,30018.540344500652,Dry,32.27,High,0.0,10000.0
10061.0,2024-03-29 08:00,London,Westminster,,Dry,81.73,Low,0.0,10000.0
10062.0,2024-03-29T10:00Z,London,Islington,2368.0,Wet,15.54,Medium,0.0,49989.62681675227
10063.0,29/03/2024 12PM,London,Westminster,2034.0,Dry,,Low,,120014.74375598616
10064.0,29/03/2024 02PM,London,Southwark,19991.57467295764,Dry,6.95,High,0.0,10000.0
10065.0,29/03/2024 04PM,London,,2659.0,Dry,52.26,Medium,0.0,10000.0
10066.0,2024-03-29T18:00Z,London,Chelsea,2924.0,Wet,23.87,Medium,0.0,10000.0
10067.0,2024-03-29T20:00Z,,Camden,2140.0,Wet,27.05,Medium,0.0,10000.0
10068.0,29/03/2024 10PM,,Greenwich,1195.0,,83.99,Low,0.0,
10069.0,2024-03-30 00:00,London,Chelsea,492.0,Dry,91.29,Low,0.0,10000.0
10070.0,30/03/2024 02AM,London,Chelsea,496.0,Dry,92.39,Low,0.0,10000.0
10071.0,2024-03-30T04:00Z,London,Southwark,483.0,Wet,49.4,Low,0.0,10000.0
10072.0,,,Southwark,798.0,Dry,,Low,0.0,10000.0
10073.0,2024-03-30 08:00,London,Camden,4724.0,Dry,15.38,High,0.0,10000.0
10074.0,2024-03-30T10:00Z,London,Westminster,30001.365913428363,Damaged,3.0,High,0.0,10000.0
10075.0,30/03/2024 12PM,London,Camden,857.0,Wet,63.25,Low,2.0,10000.0
10076.0,2024-03-30T14:00Z,London,Greenwich,,Dry,79.21,Low,0.0,10000.0
10077.0,30/03/2024 04PM,London,Camden,4662.0,Wet,-9.559706556026807,High,1.0,49991.42175128497
10078.0,30/03/2024 06PM,London,Islington,,Damaged,,,-1.9356433476889796,10000.0
10079.0,30/03/2024 08PM,London,,2280.0,Dry,50.73,Medium,0.0,10000.0
10080.0,,London,Kensington,1143.0,Dry,56.12,,0.0,10000.0
10081.0,31/03/2024 12AM,,Camden,340.0,Dry,,Low,0.0,10000.0
10082.0,2024-03-31 02:00,London,Camden,129.0,Dry,84.51,Low,0.0,10000.0
10083.0,31/03/2024 04AM,London,Southwark,408.0,Wet,68.74,Low,0.0,10000.0
10084.0,2024-03-31 06:00,,Islington,2054.0,,-6.973708190447095,High,0.0,
10085.0,2024-03-31 08:00,London,Camden,4866.0,Dry,16.91,High,0.0,10000.0
10086.0,31/03/2024 10AM,London,Kensington,1697.0,Wet,25.6,Medium,0.0,10000.0
10087.0,2024-03-31T12:00Z,London,Kensington,1807.0,Wet,17.48,Medium,0.0,10000.0
10088.0,31/03/2024 02PM,London,Chelsea,1011.0,Wet,57.28,Low,0.0,10000.0
10089.0,2024-03-31T16:00Z,London,Kensington,3782.0,Dry,33.73,High,0.0,10000.0
10090.0,31/03/2024 06PM,London,Camden,2803.0,,47.25,Medium,0.0,10000.0
10091.0,31/03/2024 08PM,London,Kensington,1706.0,Dry,-16.850567609062608,High,0.0,10000.0
10092.0,2024-03-31T22:00Z,,Kensington,2017.0,Wet,25.04,Medium,0.0,10000.0
10093.0,2024-04-01T00:00Z,London,Greenwich,480.0,Dry,59.12,Low,0.0,10000.0
10094.0,2024-04-01 02:00,London,Camden,479.0,,42.28,Low,0.0,10000.0
10095.0,01/04/2024 04AM,London,Greenwich,284.0,Snowy,59.2,,2.0,10000.0
,01/04/2024 06AM,London,Southwark,1123.0,Dry,59.84,Low,0.0,10000.0
10097.0,2024-04-01 08:00,London,Kensington,3299.0,Dry,16.96,Medium,0.0,10000.0
10098.0,01/04/2024 10AM,London,Westminster,1484.0,Snowy,509.5665200482497,Low,59.56571664548535,10000.0
10099.0,01/04/2024 12PM,London,Camden,1897.0,Dry,38.14,Medium,0.0,10000.0
10100.0,,London,Westminster,1770.0,Dry,49.82,Medium,0.0,10000.0
10101.0,,London,Southwark,1649.0,,44.68,Medium,52.09123328748833,10000.0
10102.0,2024-04-01T18:00Z,London,,4209.0,,6.66,High,0.0,10000.0
10103.0,,London,Chelsea,2275.0,Wet,34.41,Medium,0.0,10000.0
10104.0,01/04/2024 10PM,London,Southwark,2396.0,Wet,13.85,High,0.0,10000.0
10105.0,02/04/2024 12AM,London,Islington,198.0,,67.45,Low,,10000.0
10106.0,2024-04-02 02:00,London,Greenwich,384.0,Wet,44.49,Low,0.0,10000.0
10107.0,02/04/2024 04AM,London,Chelsea,,Dry,73.9,Low,0.0,10000.0
10108.0,02/04/2024 06AM,,Westminster,1507.0,Dry,35.74,Medium,1.0,
10109.0,2024-04-02T08:00Z,London,Kensington,2237.0,Dry,40.47,Medium,16.717691984138714,10000.0
10110.0,2024-04-02 10:00,London,Chelsea,1416.0,,38.36,Low,,10000.0
10111.0,02/04/2024 12PM,London,Chelsea,800.0,Dry,64.47,Low,0.0,10000.0
10112.0,2024-04-02T14:00Z,,Chelsea,1386.0,,76.06,,0.0,10000.0
10113.0,02/04/2024 04PM,London,Kensington,2287.0,Dry,28.07,Medium,0.0,10000.0
10114.0,2024-04-02 18:00,London,Kensington,3303.0,Dry,9.09,High,2.0,10000.0
10115.0,02/04/2024 08PM,London,,1433.0,Dry,,Low,0.0,10000.0
10116.0,02/04/2024 10PM,London,Greenwich,2305.0,Wet,22.01,Medium,0.0,10000.0
,2024-04-03T00:00Z,,Chelsea,195.0,Dry,79.56,,0.0,10000.0
10118.0,03/04/2024 02AM,London,Islington,166.0,Dry,73.74,Low,0.0,10000.0
10119.0,03/04/2024 04AM,London,Southwark,390.0,Dry,65.26,Low,,
,2024-04-03 06:00,London,Westminster,30015.628737121733,Dry,11.95,High,0.0,10000.0
10121.0,2024-04-03 08:00,London,Camden,2318.0,,29.12,Medium,0.0,10000.0
10122.0,03/04/2024 10AM,London,Chelsea,1954.0,Dry,48.66,Medium,9.151175407075629,10000.0
,2024-04-03T12:00Z,London,Southwark,2240.0,Snowy,9.36,High,0.0,
10124.0,03/04/2024 02PM,,,,Dry,67.43,Low,0.0,10000.0
,2024-04-03T16:00Z,,Southwark,2635.0,,31.54,Medium,0.0,10000.0
10126.0,2024-04-03T18:00Z,London,Islington,2658.0,Dry,53.12,Medium,0.0,
10127.0,2024-04-03T20:00Z,London,Camden,1494.0,Dry,,Low,0.0,10000.0
10128.0,03/04/2024 10PM,London,Kensington,2489.0,Dry,,Low,-2.2886631209431725,10000.0
10129.0,2024-04-04 00:00,London,Islington,491.0,Snowy,76.99,Low,0.0,10000.0
10130.0,,London,Westminster,,Dry,67.0,Low,0.0,10000.0
10131.0,2024-04-04T04:00Z,London,Greenwich,97.0,Dry,62.49,Low,1.0,10000.0
10132.0,2024-04-04T06:00Z,London,Camden,804.0,Dry,67.37,Low,0.0,10000.0
10133.0,04/04/2024 08AM,London,Chelsea,4757.0,Wet,3.0,High,0.0,10000.0
10134.0,2024-04-04T10:00Z,London,Chelsea,1642.0,Dry,25.56,Medium,0.0,10000.0
10135.0,2024-04-04 12:00,London,Camden,1302.0,Dry,46.42,Low,0.0,10000.0
10136.0,,London,Islington,1443.0,Dry,84.34,Low,0.0,10000.0
10137.0,2024-04-04 16:00,London,Islington,30022.42126956046,,28.2,High,0.0,10000.0
10138.0,2024-04-04 18:00,London,Southwark,30005.960295972705,,14.87,,,120021.72937592822
10139.0,2024-04-04T20:00Z,London,Chelsea,1879.0,Dry,,,2.0,10000.0
10140.0,2024-04-04 22:00,London,Greenwich,1564.0,,32.26,,1.0,49993.78402809727
10141.0,05/04/2024 12AM,London,Westminster,,Dry,-1.3469540864028247,Low,0.0,
10142.0,2024-04-05T02:00Z,London,Kensington,106.0,Dry,92.17,Low,0.0,10000.0
,2024-04-05 04:00,London,Westminster,212.0,,54.67,Low,0.0,10000.0
,05/04/2024 06AM,London,Greenwich,2075.0,Dry,44.54,Medium,0.0,
10145.0,2024-04-05T08:00Z,London,Westminster,4490.0,Wet,3.0,High,-0.7935977422375906,10000.0
10146.0,2024-04-05T10:00Z,London,Chelsea,876.0,Dry,90.28,Low,0.0,10000.0
10147.0,2024-04-05T12:00Z,London,Camden,2290.0,Wet,34.19,,,10000.0
,05/04/2024 02PM,London,Kensington,,Wet,-21.408199672177563,Low,,
10149.0,2024-04-05T16:00Z,London,,4098.0,Wet,3.0,High,0.0,10000.0
,2024-04-05T18:00Z,London,Chelsea,2052.0,Wet,36.32,Medium,0.0,
10151.0,,London,Westminster,30017.181812163853,Dry,24.01,High,0.0,10000.0
10152.0,2024-04-05 22:00,London,Islington,30005.814894947645,Dry,16.75,High,0.0,10000.0
10153.0,06/04/2024 12AM,London,Camden,327.0,Dry,42.91,Low,0.0,
10154.0,2024-04-06T02:00Z,London,Chelsea,341.0,Dry,59.78,Low,60.41484322668947,49999.07742633529
10155.0,2024-04-06 04:00,London,Islington,243.0,Dry,57.15,Low,0.0,10000.0
10156.0,06/04/2024 06AM,London,Greenwich,2092.0,Dry,509.19481867967,Medium,0.0,10000.0
10157.0,06/04/2024 08AM,London,Camden,2016.0,Dry,22.96,Medium,3.0,10000.0
10158.0,06/04/2024 10AM,London,Camden,19992.885798138745,Dry,23.52,High,0.0,10000.0
10159.0,06/04/2024 12PM,London,Camden,,Dry,65.41,Low,0.0,10000.0
10160.0,2024-04-06T14:00Z,London,Southwark,,,53.27,Low,0.0,10000.0
10161.0,2024-04-06 16:00,London,Westminster,4523.0,Dry,,High,11.258783758747754,10000.0
10162.0,2024-04-06 18:00,London,,4539.0,Dry,4.21,,0.0,10000.0
10163.0,2024-04-06T20:00Z,London,Chelsea,1972.0,,26.74,Medium,0.0,10000.0
,,London,Chelsea,,Snowy,,Low,0.0,10000.0
10165.0,2024-04-07 00:00,London,Greenwich,30022.051596609002,Dry,23.44,High,62.985268628636064,10000.0
10166.0,2024-04-07 02:00,London,Southwark,,Dry,,Low,1.0,10000.0
10167.0,2024-04-07T04:00Z,London,Islington,161.0,Dry,90.84,Low,0.0,10000.0
10168.0,07/04/2024 06AM,London,,2309.0,Dry,54.76,,0.0,10000.0
10169.0,2024-04-07 08:00,London,Westminster,2690.0,Dry,,Low,0.0,10000.0
10170.0,2024-04-07T10:00Z,,Westminster,2048.0,,48.32,Medium,0.0,10000.0
10171.0,2024-04-07 12:00,London,Kensington,1451.0,Wet,62.76,Low,0.6025770541125199,10000.0
10172.0,2024-04-07 14:00,,Chelsea,2459.0,,33.77,Medium,0.0,10000.0
10173.0,2024-04-07T16:00Z,,Islington,2042.0,Dry,524.8114072235594,Medium,14.362112872474007,10000.0
10174.0,2024-04-07T18:00Z,London,Chelsea,3391.0,Wet,10.04,High,0.0,10000.0
10175.0,07/04/2024 08PM,London,Chelsea,,Dry,66.46,Low,0.0,10000.0
10176.0,07/04/2024 10PM,London,Camden,1891.0,,-15.612497667232754,High,0.0,10000.0
10177.0,2024-04-08 00:00,London,Camden,19983.18713866989,Dry,33.18,High,0.0,10000.0
10178.0,08/04/2024 02AM,London,Islington,157.0,Dry,-7.7596531229185395,High,0.0,10000.0
10179.0,,London,Greenwich,2604.0,,16.2,Medium,0.0,10000.0
10180.0,2024-04-08T06:00Z,London,Westminster,1084.0,Dry,59.19,Low,0.0,10000.0
10181.0,08/04/2024 08AM,,Kensington,4671.0,Dry,21.56,High,0.0,10000.0
,08/04/2024 10AM,London,Kensington,1295.0,Wet,57.73,Low,2.0,10000.0
10183.0,08/04/2024 12PM,London,Chelsea,1102.0,Dry,55.45,,,10000.0
,2024-04-08T14:00Z,,,1340.0,Wet,47.53,Low,0.0,10000.0
10185.0,,London,Islington,1654.0,Dry,43.49,Medium,0.0,10000.0
10186.0,2024-04-08T18:00Z,London,Chelsea,,Dry,63.24,Low,0.0,49983.64840656692
10187.0,2024-04-08 20:00,London,Camden,951.0,Dry,79.65,Low,0.0,10000.0
10188.0,08/04/2024 10PM,London,Greenwich,1980.0,Dry,29.29,Medium,,
10189.0,2024-04-09T00:00Z,London,Westminster,460.0,Dry,75.42,Low,0.0,
,09/04/2024 02AM,London,Kensington,266.0,,,Low,-0.32775317175168617,10000.0
10191.0,2024-04-09 04:00,London,Camden,302.0,Dry,81.93,Low,0.0,
10192.0,TBD,London,Camden,30011.09535981492,Dry,,,0.0,10000.0
10193.0,2024-04-09 08:00,London,Islington,2111.0,Damaged,21.01,Medium,0.0,10000.0
10194.0,09/04/2024 10AM,London,Chelsea,1787.0,Dry,40.07,Medium,0.0,49997.86276001747
10195.0,09/04/2024 12PM,London,Chelsea,921.0,Dry,83.25,Low,0.0,10000.0
10196.0,09/04/2024 02PM,London,Westminster,1072.0,Dry,73.2,Low,62.60069379647693,10000.0
10197.0,,London,Islington,19988.092003372083,Dry,33.23,High,56.13498423624778,
10198.0,09/04/2024 06PM,London,Chelsea,3391.0,Dry,518.2708625763801,Medium,0.0,10000.0
10199.0,2024-04-09T20:00Z,London,Greenwich,1099.0,Dry,71.6,Low,0.0,10000.0
10200.0,09/04/2024 10PM,London,Islington,,Wet,76.15,Low,1.0,10000.0
10201.0,2024-04-10 00:00,,Camden,186.0,Wet,45.31,Low,0.0,49975.97527686773
10202.0,2024-04-10T02:00Z,London,Southwark,430.0,Dry,76.43,Low,,10000.0
10203.0,TBD,London,Camden,1198.0,Dry,52.61,,0.0,10000.0
10204.0,2024-04-10 06:00,London,Greenwich,1101.0,Dry,66.82,Low,,10000.0
10205.0,2024-04-10 08:00,London,Islington,30014.0170990225,Dry,19.84,High,0.0,10000.0
10206.0,10/04/2024 10AM,London,Greenwich,2045.0,Wet,12.45,,0.0,10000.0
,,London,Chelsea,,Dry,72.57,Low,0.0,10000.0
10208.0,2024-04-10T14:00Z,London,Islington,,Dry,78.01,Low,57.32452620188283,10000.0
10209.0,2024-04-10T16:00Z,London,Southwark,2093.0,Dry,30.98,Medium,2.5375896566283016,10000.0
10210.0,10/04/2024 06PM,London,Camden,2712.0,Dry,32.92,Medium,0.0,
10211.0,2024-04-10T20:00Z,London,Westminster,1517.0,Dry,40.8,Medium,0.0,10000.0
10212.0,10/04/2024 10PM,London,Southwark,1929.0,Wet,28.98,Medium,0.0,49995.69604551669
10213.0,2024-04-11 00:00,London,Kensington,272.0,Dry,,Low,0.0,10000.0
10214.0,2024-04-11T02:00Z,London,Camden,67.0,Dry,59.59,Low,0.0,10000.0
10215.0,11/04/2024 04AM,London,Camden,218.0,,48.83,Low,0.0,10000.0
,2024-04-11T06:00Z,London,Greenwich,1512.0,,26.4,Medium,0.0,10000.0
10217.0,11/04/2024 08AM,London,Westminster,,Dry,78.58,Low,0.0,10000.0
10218.0,2024-04-11T10:00Z,,Islington,30006.168309810502,Dry,9.59,High,56.783821806263596,
,,London,Kensington,2755.0,Snowy,30.91,Medium,0.0,120004.0924531645
10220.0,,London,Greenwich,30000.643852919628,Dry,-2.47535686604823,High,,10000.0
,11/04/2024 04PM,London,Kensington,3702.0,Dry,13.72,High,1.0,
10222.0,2024-04-11 18:00,London,Kensington,,Dry,64.07,Low,0.0,
10223.0,2024-04-11T20:00Z,London,Camden,2320.0,Dry,35.66,Medium,1.0,49983.35262860902
10224.0,,London,Camden,599.0,Dry,76.18,Low,0.0,10000.0
,TBD,London,Kensington,,Dry,53.65,Low,,10000.0
10226.0,12/04/2024 02AM,London,Islington,128.0,,78.8,Low,0.0,10000.0
10227.0,12/04/2024 04AM,London,,135.0,Dry,75.54,Low,0.0,10000.0
10228.0,,London,Islington,222.0,Dry,85.05,Low,,10000.0
10229.0,2024-04-12T08:00Z,London,Islington,3886.0,Dry,21.19,High,,10000.0
10230.0,2024-04-12T10:00Z,London,Chelsea,994.0,Dry,,Low,0.0,10000.0
10231.0,2024-04-12 12:00,,Camden,,Dry,82.39,Low,0.0,10000.0
10232.0,12/04/2024 02PM,London,Westminster,,Dry,77.13,Low,0.0,10000.0
10233.0,2024-04-12 16:00,London,Southwark,,Dry,,Low,0.0,10000.0
10234.0,2024-04-12T18:00Z,London,Camden,3357.0,Damaged,507.57869237436586,Medium,0.0,10000.0
10235.0,2024-04-12 20:00,London,Chelsea,,Dry,74.08,Low,0.0,10000.0
10236.0,2024-04-12T22:00Z,London,Greenwich,2147.0,Dry,,Low,,
10237.0,2024-04-13 00:00,London,,422.0,Dry,-15.40175377212824,,0.0,10000.0
10238.0,2024-04-13T02:00Z,London,Camden,62.0,,70.75,,0.0,10000.0
10239.0,13/04/2024 04AM,London,Westminster,,,54.72,Low,0.0,10000.0
10240.0,2024-04-13 06:00,London,Southwark,2324.0,Dry,50.5,Medium,0.0,10000.0
10241.0,13/04/2024 08AM,London,Westminster,3969.0,Dry,524.594212686225,High,,10000.0
10242.0,13/04/2024 10AM,London,Westminster,1616.0,Dry,35.85,Medium,0.0,10000.0
10243.0,13/04/2024 12PM,,Islington,2461.0,Dry,42.27,Medium,0.0,10000.0
10244.0,2024-04-13 14:00,London,Greenwich,1494.0,Dry,86.57,,0.0,10000.0
10245.0,2024-04-13 16:00,London,Greenwich,3565.0,Dry,21.58,High,0.0,10000.0
10246.0,2024-04-13 18:00,London,Greenwich,2767.0,Wet,23.23,,0.0,10000.0
10247.0,13/04/2024 08PM,,Southwark,2222.0,Dry,38.97,,0.0,120019.47709912363
10248.0,2024-04-13 22:00,,Islington,2155.0,Dry,39.94,Medium,0.0,10000.0
10249.0,2024-04-14T00:00Z,London,Chelsea,99.0,Dry,55.65,Low,1.0,
10250.0,2024-04-14T02:00Z,London,Chelsea,39.0,Dry,63.04,Low,0.0,
,2024-04-14 04:00,London,Camden,89.0,Wet,-24.899244217257706,High,3.0,10000.0
10252.0,,London,Greenwich,774.0,Dry,92.03,,0.0,10000.0
,2024-04-14T08:00Z,,Greenwich,3079.0,Dry,33.96,Medium,0.0,10000.0
10254.0,14/04/2024 10AM,London,Chelsea,1633.0,Wet,24.21,Medium,0.0,10000.0
10255.0,14/04/2024 12PM,London,Greenwich,,Dry,,,0.0,
10256.0,2024-04-14 14:00,London,Westminster,1164.0,Dry,91.53,Low,55.964460617304695,10000.0
10257.0,,London,Camden,1565.0,Dry,48.86,,0.0,10000.0
10258.0,14/04/2024 06PM,London,Greenwich,4897.0,Dry,14.15,High,0.0,10000.0
10259.0,2024-04-14 20:00,London,Southwark,1833.0,Dry,50.42,Medium,0.0,10000.0
10260.0,2024-04-14T22:00Z,London,Camden,1605.0,,44.65,Medium,0.0,10000.0
10261.0,2024-04-15 00:00,London,Islington,462.0,Damaged,33.65,Medium,0.0,10000.0
10262.0,2024-04-15 02:00,,Westminster,30018.11987813759,Dry,28.35,High,0.0,10000.0
10263.0,2024-04-15T04:00Z,London,Southwark,19989.378709096076,Dry,4.38,High,0.0,49977.55996485618
10264.0,,London,Greenwich,19993.6881299606,Dry,24.53,,0.0,10000.0
10265.0,15/04/2024 08AM,London,Kensington,3941.0,Dry,19.73,High,0.0,10000.0
10266.0,15/04/2024 10AM,,Kensington,808.0,Dry,72.45,Low,0.0,10000.0
10267.0,2024-04-15T12:00Z,,Camden,19996.230328255595,,32.77,High,0.0,10000.0
10268.0,2024-04-15 14:00,London,,1443.0,,40.42,Low,4.5165144265922095,120009.93848659651
10269.0,2024-04-15 16:00,London,Chelsea,4046.0,Dry,27.97,High,,10000.0
10270.0,2024-04-15 18:00,,Islington,2915.0,,30.06,Medium,0.0,10000.0
10271.0,15/04/2024 08PM,London,Westminster,1512.0,Wet,32.95,Medium,0.0,10000.0
10272.0,2024-04-15 22:00,London,Camden,1742.0,Dry,39.66,Medium,,10000.0
10273.0,16/04/2024 12AM,London,,229.0,Dry,71.71,Low,0.0,10000.0
10274.0,16/04/2024 02AM,London,Westminster,82.0,Dry,88.79,Low,0.0,10000.0
10275.0,2024-04-16T04:00Z,London,Westminster,145.0,Damaged,36.96,Low,0.0,10000.0
10276.0,2024-04-16 06:00,London,,2378.0,Dry,-11.786320254438634,High,,10000.0
,2024-04-16T08:00Z,London,Southwark,3788.0,,21.68,High,0.0,10000.0
,16/04/2024 10AM,London,Islington,,Damaged,60.94,Low,0.0,10000.0
10279.0,Unknown,London,Kensington,1585.0,Dry,40.65,Medium,1.0,
,16/04/2024 02PM,London,Kensington,1703.0,Damaged,33.06,Medium,0.0,10000.0
10281.0,16/04/2024 04PM,London,,2554.0,Dry,45.61,Medium,0.0,10000.0
10282.0,,London,Islington,419.0,Dry,82.99,Low,0.0,10000.0
10283.0,16/04/2024 08PM,,Islington,1769.0,Dry,54.61,Medium,0.0,10000.0
10284.0,2024-04-16 22:00,London,Westminster,1696.0,,25.7,Medium,0.0,10000.0
10285.0,,London,Islington,,Dry,,Low,0.0,10000.0
10286.0,17/04/2024 02AM,London,Southwark,399.0,,79.38,Low,0.0,
10287.0,17/04/2024 04AM,London,Greenwich,387.0,Dry,55.56,Low,0.0,10000.0
10288.0,2024-04-17T06:00Z,London,Camden,1808.0,,55.1,Medium,0.0,10000.0
,17/04/2024 08AM,London,Kensington,4662.0,Damaged,3.0,High,0.0,10000.0
10290.0,2024-04-17 10:00,London,Islington,1547.0,,49.04,Medium,0.0,10000.0
10291.0,,,,2878.0,Wet,28.06,Medium,0.0,10000.0
10292.0,2024-04-17T14:00Z,London,Islington,1438.0,Dry,69.42,Low,0.0,10000.0
10293.0,17/04/2024 04PM,London,Southwark,3075.0,Dry,27.08,Medium,0.0,10000.0
10294.0,2024-04-17T18:00Z,London,Chelsea,3909.0,Dry,25.32,High,0.0,49975.30195954302
10295.0,2024-04-17 20:00,London,Southwark,1644.0,Dry,27.86,Medium,0.0,10000.0
10296.0,17/04/2024 10PM,London,Westminster,19977.416037184757,,21.34,High,0.0,10000.0
10297.0,2024-04-18T00:00Z,London,Camden,30019.518393154798,Dry,22.26,High,54.97849378377028,10000.0
,18/04/2024 02AM,,Westminster,403.0,Dry,58.49,Low,0.0,10000.0
10299.0,2024-04-18T04:00Z,London,Westminster,423.0,,68.81,,2.5306113718295267,10000.0
10300.0,2024-04-18T06:00Z,London,Camden,2328.0,Dry,38.07,Medium,0.0,
10301.0,18/04/2024 08AM,London,,3723.0,Dry,15.69,High,0.0,10000.0
,18/04/2024 10AM,London,Islington,1883.0,Dry,523.0419817280618,Medium,,10000.0
10303.0,2024-04-18 12:00,London,,1039.0,Dry,52.05,Low,1.0,10000.0
10304.0,2024-04-18 14:00,London,Camden,2174.0,Dry,31.31,Medium,0.0,10000.0
10305.0,2024-04-18 16:00,London,Camden,3607.0,Wet,4.67,High,0.0,10000.0
10306.0,18/04/2024 06PM,London,Westminster,19978.583247587034,Wet,3.0,High,,10000.0
10307.0,2024-04-18T20:00Z,London,Southwark,1475.0,Wet,57.51,Low,2.0,10000.0
10308.0,2024-04-18T22:00Z,London,Camden,2253.0,Dry,38.21,Medium,0.0,10000.0
10309.0,19/04/2024 12AM,London,Greenwich,30018.545226238035,Dry,20.3,High,0.0,10000.0
10310.0,19/04/2024 02AM,London,,365.0,Dry,60.93,Low,0.0,120001.97264883608
10311.0,2024-04-19 04:00,London,Chelsea,484.0,Wet,62.64,Low,0.0,10000.0
10312.0,2024-04-19T06:00Z,London,Camden,2289.0,Wet,,Low,55.27679863405565,10000.0
10313.0,2024-04-19 08:00,London,Islington,2184.0,Wet,13.7,High,0.0,
10314.0,19/04/2024 10AM,London,Greenwich,802.0,Dry,98.14,Low,,10000.0
10315.0,19/04/2024 12PM,London,Kensington,2474.0,Dry,39.53,Medium,0.0,120012.11488809994
10316.0,19/04/2024 02PM,London,Camden,,Dry,91.63,Low,,10000.0
10317.0,2024-04-19T16:00Z,,Chelsea,2945.0,Damaged,31.06,Medium,0.0,10000.0
,19/04/2024 06PM,London,Kensington,4135.0,Dry,514.5400022065115,High,0.0,10000.0
10319.0,,London,Islington,1164.0,Dry,57.56,Low,,10000.0
10320.0,2024-04-19 22:00,London,Greenwich,2154.0,Dry,51.16,Medium,,10000.0
10321.0,2024-04-20T00:00Z,London,Greenwich,468.0,Dry,70.02,Low,0.0,10000.0
,,London,Westminster,1792.0,Dry,38.46,Medium,0.0,10000.0
10323.0,20/04/2024 04AM,London,Greenwich,3.0,Dry,-10.099642447470952,,1.0,10000.0
10324.0,20/04/2024 06AM,London,Westminster,,Dry,72.09,Low,0.0,10000.0
10325.0,2024-04-20T08:00Z,London,Kensington,2969.0,Dry,45.8,Medium,0.0,10000.0
10326.0,2024-04-20T10:00Z,London,Camden,883.0,Wet,53.54,Low,,120010.89674865363
10327.0,2024-04-20T12:00Z,,Islington,1320.0,Dry,519.2489535196313,Low,,10000.0
10328.0,,,,,Dry,77.02,Low,,49997.470298447246
10329.0,,London,Chelsea,607.0,Dry,77.79,Low,0.0,10000.0
10330.0,2024-04-20 18:00,London,Greenwich,4578.0,Wet,3.0,,0.0,10000.0
,,London,Southwark,1137.0,Wet,60.01,Low,0.0,10000.0
10332.0,2024-04-20 22:00,London,Kensington,1414.0,Dry,,Low,0.0,10000.0
10333.0,,London,Southwark,,Dry,77.96,Low,0.0,10000.0
10334.0,21/04/2024 02AM,London,Greenwich,110.0,Damaged,56.86,Low,0.0,10000.0
10335.0,2024-04-21 04:00,London,Islington,208.0,Wet,60.12,Low,0.0,10000.0
10336.0,,London,,289.0,Dry,80.86,Low,0.0,10000.0
10337.0,21/04/2024 08AM,London,Westminster,30001.892383417686,Dry,26.31,High,0.0,10000.0
10338.0,2024-04-21 10:00,London,Greenwich,1469.0,Dry,53.52,,0.0,49986.04502056895
10339.0,,London,Southwark,2901.0,Dry,28.06,Medium,,10000.0
10340.0,2024-04-21T14:00Z,London,Islington,1295.0,Dry,517.704757284519,Low,0.0,10000.0
10341.0,2024-04-21T16:00Z,London,Westminster,4103.0,Dry,19.87,High,0.0,10000.0
,2024-04-21T18:00Z,London,Chelsea,30003.07396234745,Dry,3.0,High,0.0,10000.0
,2024-04-21 20:00,London,Chelsea,1092.0,Dry,79.33,Low,0.0,10000.0
10344.0,,London,Chelsea,2973.0,Dry,-8.58191889228754,High,1.0,10000.0
10345.0,,London,Chelsea,,Dry,501.89417205118457,Low,0.0,10000.0
,22/04/2024 02AM,London,Chelsea,367.0,Dry,95.53,Low,0.0,10000.0
10347.0,2024-04-22T04:00Z,London,Chelsea,358.0,Wet,77.83,Low,0.0,10000.0
,22/04/2024 06AM,London,Greenwich,1476.0,Dry,81.15,Low,0.0,10000.0
10349.0,2024-04-22 08:00,London,Southwark,3137.0,,25.64,Medium,0.0,10000.0
10350.0,,London,,2039.0,Wet,,Low,0.0,10000.0
,22/04/2024 12PM,London,Kensington,2298.0,Dry,37.26,,0.0,10000.0
,2024-04-22 14:00,London,Camden,1228.0,,67.2,Low,0.0,10000.0
10353.0,2024-04-22T16:00Z,London,Southwark,4106.0,Dry,,High,3.0,10000.0
10354.0,2024-04-22 18:00,London,Westminster,2278.0,Dry,40.6,Medium,,10000.0
10355.0,22/04/2024 08PM,London,Chelsea,936.0,Dry,64.06,Low,1.0,10000.0
10356.0,22/04/2024 10PM,London,Kensington,1280.0,,74.62,Low,0.0,10000.0
10357.0,2024-04-23T00:00Z,London,Islington,457.0,,54.09,Low,0.0,10000.0
10358.0,23/04/2024 02AM,London,Greenwich,162.0,Dry,507.5102421173816,Low,0.0,10000.0
10359.0,2024-04-23 04:00,London,Islington,91.0,Dry,69.21,Low,1.0,10000.0
10360.0,2024-04-23 06:00,London,Westminster,1825.0,Dry,41.77,Medium,0.0,10000.0
10361.0,2024-04-23T08:00Z,,Islington,3517.0,Snowy,3.13,High,0.0,10000.0
10362.0,23/04/2024 10AM,London,Chelsea,1521.0,Dry,41.03,Medium,0.0,
10363.0,23/04/2024 12PM,London,Kensington,1148.0,Dry,74.24,Low,2.0,10000.0
10364.0,2024-04-23T14:00Z,London,Kensington,2139.0,Dry,45.72,Medium,,120016.15936413479
,2024-04-23 16:00,,Kensington,2784.0,,55.53,Medium,0.0,10000.0
10366.0,23/04/2024 06PM,London,Kensington,4790.0,Dry,17.04,,0.0,10000.0
10367.0,2024-04-23T20:00Z,London,,19986.883079170726,Dry,19.53,High,0.0,10000.0
10368.0,2024-04-23T22:00Z,,Greenwich,1462.0,Dry,78.87,Low,1.0,10000.0
10369.0,2024-04-24T00:00Z,London,Chelsea,459.0,Dry,88.01,,0.0,10000.0
10370.0,2024-04-24 02:00,London,,339.0,Dry,86.5,Low,0.0,10000.0
10371.0,24/04/2024 04AM,London,Westminster,289.0,Snowy,60.48,Low,0.0,10000.0
10372.0,2099-13-40 25:61,London,,838.0,Dry,50.79,Low,0.0,10000.0
10373.0,2024-04-24 08:00,London,Chelsea,2975.0,Snowy,30.23,Medium,0.0,10000.0
10374.0,2024-04-24 10:00,London,Chelsea,831.0,,81.58,Low,,10000.0
10375.0,24/04/2024 12PM,London,Camden,30011.861000274566,Dry,3.47,High,0.0,10000.0
10376.0,24/04/2024 02PM,London,Greenwich,1884.0,Dry,,Low,,10000.0
10377.0,24/04/2024 04PM,London,Westminster,,Dry,78.22,Low,0.0,10000.0
