weather_id,date_time,city,season,temperature_c,humidity,rain_mm,weather_condition,wind_speed_kmh,visibility_m,air_pressure_hpa
5001.0,2024-01-01 00:00,London,Winter,-2.21,-34.255069514048245,,Snow,43.6,875,1010.73
5002.0,2024-01-01 02:00,London,Winter,14.46,80.0,,Clear,78.82,9857,1004.81
5003.0,2024-01-01 04:00,London,Winter,4.25,84.0,0.0,Snow,21.42,9620,996.09
5004.0,2024-01-01 06:00,London,,1.41,74.0,0.0,Clear,54.42,11148,1007.39
,2024-01-01 08:00,London,Winter,7.51,52.0,0.0,Clear,,11599,999.58
5006.0,2024-01-01T10:00Z,London,Winter,4.51,78.0,0.0,Snow,51.99,5819,883.2607122270125
5007.0,2024-01-01T12:00Z,London,Winter,4.45,158.85743916473885,,Clear,15.22,,
5008.0,2024-01-01 14:00,London,Winter,-1.67,65.0,6.47,Snow,58.44,1479,1004.37
5009.0,,London,Winter,-0.3,,1.64,Snow,53.58,,993.59
5010.0,2024-01-01 18:00,London,Winter,11.67,81.0,0.0,Clear,21.16,9154,998.14
5011.0,2024-01-01 20:00,London,Winter,-4.12,56.0,0.0,Snow,,1342,1047.06
5012.0,01/01/2024 10PM,London,Winter,13.52,,14.73,Clear,64.86,49979.98932075065,1003.99
5013.0,02/01/2024 12AM,London,Winter,0.58,,17.54,Rain,27.65,971,998.68
5014.0,2024-01-02 02:00,London,Winter,7.46,59.0,0.0,Clear,15.35,8712,885.7472037497458
5015.0,2024-01-02 04:00,London,Winter,14.2,58.0,0.0,Clear,53.82,N/A,1020.74
5016.0,02/01/2024 06AM,London,Winter,-4.89,46.0,0.0,Clear,73.4,10175,1038.0
5017.0,2024-01-02T08:00Z,London,Winter,12.23,80.0,0.0,Clear,18.76,8617,888.5652785125978
5018.0,2024-01-02T10:00Z,,,26.42,65.0,0.0,Clear,63.99,49991.978547125706,996.6
5019.0,2024-01-02T12:00Z,,,12.86,53.0,0.0,Clear,60.16,,
5020.0,2024-01-02 14:00,London,,4.57,92.0,35.82,Rain,13.1,9537,1007.6
5021.0,2024-01-02T16:00Z,London,Winter,3.57,-22.744957375239792,0.0,Clear,14.09,11766,1007.42
5022.0,02/01/2024 06PM,London,Winter,,60.0,0.0,Clear,352.1403240489505,11105,
5023.0,2024-01-02T20:00Z,London,Winter,5.62,61.0,0.0,Clear,59.43,11025,1029.06
5024.0,2024-01-02 22:00,,Winter,-47.69658388618056,80.0,0.0,Clear,4.11,9641,1027.46
5025.0,2024-01-03T00:00Z,London,Winter,10.81,68.0,0.0,,365.63787576016506,,990.11
5026.0,2024-01-03T02:00Z,London,,7.0,95.0,0.0,Clear,182.69029531535583,9182,1002.16
5027.0,03/01/2024 04AM,London,Spring,5.39,,15.3,Clear,41.52,9785,993.65
5028.0,2024-01-03T06:00Z,London,Winter,,45.0,0.0,Clear,79.05,8768,
5029.0,2024-01-03T08:00Z,London,,18.9,59.0,222.8232469621042,Storm,40.71,4142,966.17
5030.0,2024-01-03 10:00,London,Winter,6.74,49.0,0.0,Clear,74.63,9568,991.75
5031.0,2024-01-03T12:00Z,London,Winter,-4.26,46.0,0.0,Clear,52.38,9386,1003.21
5032.0,03/01/2024 02PM,London,,2.05,49.0,221.81448081517726,,63.69,10175,997.2
5033.0,2024-01-03T16:00Z,London,Winter,,69.0,7.18,Fog,36.55,440,1029.71
5034.0,2024-01-03T18:00Z,London,Winter,13.21,58.0,0.0,Clear,20.05,8560,1015.85
5035.0,03/01/2024 08PM,London,Spring,8.01,53.0,0.0,Clear,38.55,,1020.17
5036.0,2024-01-03T22:00Z,London,Winter,-4.72,83.0,0.0,Clear,49.56,120022.7346909607,1016.33
5037.0,2024-01-04T00:00Z,London,Winter,8.41,66.0,0.0,Clear,75.12,9821,993.97
5038.0,2024-01-04 02:00,London,Winter,-39.0126770367574,43.0,0.0,Snow,16.57,972,1031.86
5039.0,2024-01-04 04:00,London,,7.96,34.0,0.0,Clear,,11551,1121.182463579181
5040.0,2024-01-04 06:00,London,Winter,-2.48,85.0,0.0,Snow,68.22,2871,1002.13
5041.0,2024-01-04 08:00,London,,2.9,164.0420845392432,0.0,Clear,4.12,10078,998.97
5042.0,04/01/2024 10AM,London,Spring,17.28,31.0,,Fog,,2162,993.67
5043.0,04/01/2024 12PM,,Spring,-39.554045451849234,47.0,0.0,Snow,27.61,2806,981.81
,2024-01-04 14:00,London,Winter,-0.4,,18.42,Clear,195.0330538577613,11767,1004.23
5045.0,2024-01-04 16:00,London,Winter,5.21,89.0,0.0,Clear,15.78,8725,1008.56
5046.0,2024-01-04T18:00Z,London,Winter,1.32,80.0,45.51,Snow,6.14,5540,1009.38
5047.0,04/01/2024 08PM,London,,84.77465056617218,98.0,38.61,Rain,191.95948362100202,,990.36
5048.0,2024-01-04T22:00Z,London,Winter,11.26,87.0,,Fog,17.14,129,1010.31
5049.0,2024-01-05T00:00Z,London,Winter,-1.76,,7.29,Fog,19.13,10336,1011.27
,2024-01-05 02:00,London,,14.42,86.0,0.0,Clear,35.0,9431,1005.86
5051.0,2024-01-05 04:00,London,Winter,10.83,70.0,,,17.25,9733,894.847477715986
5052.0,2024-01-05 06:00,London,Winter,,62.0,201.69198307272114,Storm,64.1,49991.42761000027,966.11
5053.0,2024-01-05T08:00Z,London,Winter,-2.3,,212.88458973136247,Storm,117.85,426,982.47
5054.0,2024-01-05 10:00,London,,18.07,61.0,7.24,Fog,3.39,120010.15525578769,
5055.0,,London,Summer,-43.75193578213015,48.0,0.0,Clear,9.08,10300,1028.16
5056.0,2024-01-05 14:00,,Winter,,83.0,0.0,Clear,24.0,8713,994.85
5057.0,05/01/2024 04PM,London,Spring,,55.0,0.0,Clear,5.9,10785,1023.16
,2024-01-05 18:00,,Winter,1.08,54.0,0.0,Snow,44.07,5756,1022.6
5059.0,2024-01-05T20:00Z,London,Winter,,80.0,0.0,Clear,36.28,9902,1002.5
5060.0,05/01/2024 10PM,London,Spring,8.63,-25.396254162459847,0.0,Clear,26.19,10040,
5061.0,2024-01-06T00:00Z,,,14.85,,2.15,Fog,29.27,5130,1023.01
5062.0,06/01/2024 02AM,London,Summer,13.61,-26.67398236618082,0.0,Clear,26.24,11028,1010.29
,06/01/2024 04AM,London,Summer,24.59,64.0,10.18,,38.44,9557,991.26
5064.0,2024-01-06T06:00Z,London,Winter,7.23,-29.816457375718883,0.0,Clear,13.85,11162,1022.15
5065.0,06/01/2024 08AM,London,Summer,27.26,55.0,0.0,Clear,30.38,,1116.3993012637727
5066.0,2024-01-06T10:00Z,London,Winter,7.31,82.0,17.01,Clear,77.16,11607,997.98
5067.0,2024-01-06T12:00Z,London,Winter,70.44712455612513,42.0,0.0,Clear,,8439,998.17
5068.0,06/01/2024 02PM,London,Summer,14.06,-27.62439355854295,0.0,Clear,32.44,8390,1002.94
5069.0,06/01/2024 04PM,London,Summer,16.54,62.0,0.0,Clear,24.88,10517,1009.13
,2024-01-06T18:00Z,London,Winter,10.24,,212.6371764023149,Storm,,5204,875.0753867897772
5071.0,2024-01-06T20:00Z,London,Winter,,66.0,0.0,Clear,71.31,8328,1011.57
5072.0,2024-01-06T22:00Z,London,Winter,10.12,86.0,0.0,Clear,74.99,9717,
5073.0,2024-01-07 00:00,London,,13.17,27.0,0.0,Clear,46.2,11589,
,2024-01-07T02:00Z,London,Winter,-4.06,64.0,0.0,Clear,67.95,49985.41269666651,1015.54
5075.0,2024-01-07T04:00Z,London,Winter,0.37,44.0,0.0,Clear,,11940,1020.17
5076.0,07/01/2024 06AM,London,Summer,23.34,52.0,0.0,Clear,25.62,11539,1000.43
5077.0,07/01/2024 08AM,,Summer,23.77,68.0,0.0,Clear,13.54,10220,
5078.0,2099-13-40 25:61,London,,4.53,27.0,0.0,,356.8685184299458,???,879.7983014247903
5079.0,07/01/2024 12PM,London,Summer,16.08,25.0,,Fog,38.08,9356,
5080.0,07/01/2024 02PM,,Summer,27.11,157.86211733066628,0.0,Clear,6.15,9593,1005.35
5081.0,,London,Autumn,6.52,88.0,29.13,Rain,75.29,683,981.66
5082.0,07/01/2024 06PM,London,Summer,-41.075374194469305,-32.673393488503145,0.0,Snow,6.78,4118,984.61
5083.0,2024-01-07T20:00Z,London,Winter,-1.09,65.0,0.0,Clear,77.94,8822,1015.93
5084.0,07/01/2024 10PM,,Summer,19.82,57.0,,Fog,16.77,10756,999.68
5085.0,08/01/2024 12AM,London,Summer,33.09,22.0,0.0,Clear,6.8,10650,1005.8
5086.0,2024-01-08 02:00,London,Winter,5.38,68.0,0.0,Clear,38.62,11405,1002.48
5087.0,2024-01-08T04:00Z,London,,,63.0,14.77,Rain,76.68,1239,973.7
5088.0,2024-01-08T06:00Z,London,Winter,4.15,73.0,0.0,Snow,13.8,9282,1000.83
5089.0,2024-01-08T08:00Z,London,Winter,-1.54,51.0,75.23958598908203,Rain,39.6,1252,985.49
5090.0,2024-01-08T10:00Z,London,Winter,11.47,42.0,0.0,Clear,52.29,9076,1007.56
5091.0,08/01/2024 12PM,London,Summer,20.7,33.0,0.0,Clear,78.32,10107,993.81
5092.0,2024-01-08 14:00,,Winter,-2.08,83.0,0.0,Snow,61.51,,1032.26
5093.0,2024-01-08 16:00,London,Winter,4.89,75.0,0.0,,62.71,9807,1007.11
5094.0,,London,Summer,19.3,45.0,0.0,,,,1017.82
,,London,Winter,2.35,88.0,215.25798098184544,Snow,59.86,8573,995.62
5096.0,2024-01-08T22:00Z,London,Winter,-4.46,53.0,0.0,Snow,76.37,1098,1018.91
5097.0,2024-01-09 00:00,London,,6.47,70.0,0.0,,42.93,10094,996.22
5098.0,09/01/2024 02AM,London,Autumn,-44.137910284849525,166.45130901423437,83.66762819197129,Storm,58.63,3154,975.07
,2024-01-09T04:00Z,London,Winter,,63.0,0.0,Clear,59.25,10950,1012.86
5100.0,2024-01-09 06:00,London,,13.95,-25.77701602118627,0.0,Clear,29.46,11000,880.8249435464936
5101.0,2024-01-09 08:00,London,Winter,9.76,55.0,0.0,Clear,3.51,11668,
5102.0,2024-01-09 10:00,London,Winter,13.52,60.0,3.84,Clear,35.97,11155,1000.6
5103.0,2024-01-09 12:00,London,Winter,-2.03,65.0,86.30502923502657,Snow,,7747,
5104.0,,London,Summer,70.82890943096679,154.32018029576972,,Clear,39.91,9568,1015.39
5105.0,2024-01-09T16:00Z,London,Winter,4.69,,207.02331663269385,Storm,57.44,11882,983.7
5106.0,,London,Summer,24.09,51.0,,,73.43,11763,992.38
5107.0,09/01/2024 08PM,London,Autumn,23.84,69.0,0.0,Clear,25.38,10513,1013.56
5108.0,2024-01-09T22:00Z,,Winter,,78.0,0.0,Clear,182.987966978529,11365,1025.47
,2024-01-10 00:00,London,,13.15,72.0,0.0,Clear,52.08,49981.52819274956,1003.67
5110.0,10/01/2024 02AM,London,Autumn,64.12492986904785,-10.64003948308821,0.0,Clear,,10251,994.43
5111.0,2024-01-10 04:00,London,Winter,14.54,90.0,204.62203051355118,Storm,,3816,966.31
5112.0,2024-01-10T06:00Z,London,Winter,-3.42,72.0,0.0,Clear,75.92,8174,1017.42
5113.0,,London,Autumn,22.13,50.0,0.0,Clear,11.86,11788,1021.43
5114.0,2024-01-10T10:00Z,London,,8.26,158.28735189335677,0.0,,65.39,10851,999.12
5115.0,2024-01-10T12:00Z,London,Winter,-0.77,88.0,210.0846285253111,Storm,184.0093770445574,2014,997.77
5116.0,,London,Winter,-1.74,54.0,0.0,Snow,366.1842888543756,error,1006.28
5117.0,2024-01-10T16:00Z,London,Winter,-2.95,63.0,10.58,Snow,22.15,2968,1024.41
5118.0,10/01/2024 06PM,London,Autumn,16.66,71.0,0.0,Clear,40.59,8741,1019.64
5119.0,,London,Summer,31.79,43.0,0.0,Clear,,10049,1001.19
5120.0,2024-01-10T22:00Z,London,Winter,-2.14,45.0,0.0,Snow,60.9,6033,983.11
5121.0,2024-01-11T00:00Z,London,Winter,7.53,62.0,,Clear,23.27,11637,1029.85
5122.0,2024-01-11 02:00,London,Winter,-2.38,50.0,0.0,Clear,,120010.41938912949,1021.89
5123.0,2024-01-11T04:00Z,London,Winter,7.46,46.0,0.0,Clear,48.72,9466,991.58
5124.0,,London,Winter,,172.61948459891454,0.0,,65.05,10772,
5125.0,11/01/2024 08AM,London,Autumn,10.37,71.0,0.0,Clear,63.99,10851,1023.77
5126.0,2024-01-11T10:00Z,London,Winter,-4.42,48.0,0.0,Snow,0.99,6487,1012.4
,2024-01-11T12:00Z,,Winter,-4.77,70.0,7.88,Snow,51.47,5083,990.85
,2024-01-11T14:00Z,London,Winter,6.25,,4.46,Fog,,413,1001.68
5129.0,2024-01-11T16:00Z,London,Winter,0.09,65.0,,Clear,36.04,120013.8306582226,1013.4
5130.0,2024-01-11 18:00,London,Winter,7.12,66.0,0.0,Clear,36.23,11065,1011.91
5131.0,2024-01-11T20:00Z,London,Winter,8.45,51.0,0.0,Clear,38.43,11063,
5132.0,2024-01-11 22:00,London,Winter,-1.78,43.0,,Clear,54.04,9592,1031.95
,2024-01-12T00:00Z,London,Winter,-4.74,89.0,54.37,Rain,57.99,227,985.15
5134.0,2024-01-12 02:00,London,Winter,-3.98,82.0,213.134876679622,Rain,43.45,3404,
5135.0,2024-01-12T04:00Z,London,Winter,-4.2,90.0,0.0,Clear,,,1003.84
5136.0,2024-01-12T06:00Z,London,Winter,3.48,84.0,,Clear,194.85536967439725,8932,1008.05
5137.0,TBD,London,Winter,-3.55,90.0,74.87,Snow,17.59,9220,1013.48
5138.0,TBD,London,Winter,9.97,66.0,3.58,Clear,63.97,10248,893.1397314333535
5139.0,2024-01-12 12:00,London,,5.8,59.0,0.0,Clear,13.49,10624,995.37
5140.0,2024-01-12T14:00Z,London,Winter,-3.36,74.0,0.0,Clear,65.01,8150,1039.95
5141.0,2024-01-12T16:00Z,London,Winter,-54.735207918532474,79.0,3.23,Clear,38.68,8257,1026.74
5142.0,2024-01-12 18:00,London,Winter,9.07,87.0,55.76,Rain,30.11,,994.63
5143.0,2024-01-12 20:00,London,Winter,1.6,70.0,89.3371627838067,Storm,112.91,6894,978.28
5144.0,2024-01-12T22:00Z,London,Winter,8.19,61.0,,Fog,48.44,7163,995.21
5145.0,2024-01-13T00:00Z,London,Winter,8.95,70.0,0.0,Clear,7.82,120013.59327554864,
5146.0,2024-01-13 02:00,London,Winter,2.25,56.0,0.0,Clear,16.3,10290,1002.27
5147.0,2024-01-13T04:00Z,London,Winter,13.98,90.0,0.0,Clear,198.14654469494621,8908,1018.98
5148.0,2024-01-13 06:00,London,Winter,7.81,82.0,64.88,Rain,28.78,6485,895.7441200612325
5149.0,2024-01-13T08:00Z,London,Winter,-42.3440475936113,72.0,0.0,Clear,55.54,11102,1027.26
5150.0,2024-01-13 10:00,London,Winter,1.31,40.0,0.0,Clear,44.36,10349,1017.32
5151.0,2024-01-13 12:00,London,Winter,11.73,47.0,0.0,Clear,190.51668687079416,11674,997.31
5152.0,2024-01-13T14:00Z,London,Winter,5.82,83.0,,Clear,8.06,9076,1014.52
5153.0,13/01/2024 04PM,London,Winter,-2.38,46.0,0.0,Snow,,964,1008.91
5154.0,13/01/2024 06PM,London,Winter,4.0,75.0,0.0,Clear,46.15,9165,1009.5
5155.0,2024-01-13 20:00,,Winter,13.57,,3.24,Fog,48.43,10133,1116.550563695216
5156.0,,London,Autumn,5.53,55.0,209.7461552004089,Rain,10.11,11539,992.86
5157.0,2024-01-14T00:00Z,London,Winter,7.8,70.0,0.0,Clear,0.01,9921,1009.68
5158.0,2024-01-14 02:00,London,Winter,12.64,85.0,0.0,Clear,61.16,9166,
,14/01/2024 04AM,London,Winter,-41.62573117350584,46.0,,,17.38,9521,1013.21
5160.0,14/01/2024 06AM,London,Winter,,89.0,0.0,Clear,355.21117830142856,11834,991.69
5161.0,2024-01-14 08:00,,Winter,-2.74,50.0,0.0,Clear,55.26,,1024.75
5162.0,2024-01-14T10:00Z,London,Winter,4.76,81.0,0.0,Snow,71.89,2528,1015.56
5163.0,2024-01-14T12:00Z,,,19.14,22.0,0.0,,77.37,11136,1002.9
5164.0,2024-01-14 14:00,London,,,69.0,0.0,Clear,5.67,11644,1015.56
5165.0,2024-01-14 16:00,London,Winter,-31.38491294981911,46.0,0.0,Clear,75.8,11138,1018.35
,14/01/2024 06PM,London,Winter,7.0,75.0,0.0,Clear,48.67,11793,
5167.0,2024-01-14 20:00,London,Winter,1.01,41.0,0.0,Clear,178.90267765864883,9023,993.68
5168.0,2024-01-14 22:00,London,Winter,,81.0,94.27253759175346,Rain,69.43,,998.46
5169.0,15/01/2024 12AM,London,Winter,-3.2,,77.12697468670588,Storm,69.57,7363,980.09
5170.0,2024-01-15 02:00,,Winter,14.8,42.0,0.0,Clear,6.87,8604,990.55
5171.0,2024-01-15T04:00Z,London,Winter,10.01,49.0,0.0,Clear,192.41316721177935,49981.782759477006,
,15/01/2024 06AM,London,Winter,13.08,45.0,0.0,,19.79,120008.88445333116,1029.84
5173.0,2024-01-15 08:00,London,Winter,-0.49,-10.984857663885709,0.0,Snow,77.64,5434,1037.3
,2024-01-15T10:00Z,,Winter,6.15,60.0,5.46,Fog,74.7,120015.42366263771,1014.49
,2024-01-15 12:00,London,Winter,9.24,71.0,6.72,Fog,53.71,6054,1008.3
5176.0,15/01/2024 02PM,London,Winter,6.44,85.0,,Clear,31.65,10583,1007.58
5177.0,2024-01-15 16:00,London,Winter,,72.0,0.0,Clear,36.07,,1002.96
5178.0,2024-01-15T18:00Z,London,Winter,5.48,72.0,83.37982847643859,Rain,,9182,992.71
5179.0,Unknown,London,Autumn,,85.0,0.0,,,10471,991.96
5180.0,2024-01-15T22:00Z,London,Winter,14.33,-25.78576436312315,88.76177707033713,Storm,65.74,8359,977.59
5181.0,2024-01-16 00:00,London,Winter,9.58,79.0,2.65,Clear,79.92,10611,
5182.0,2024-01-16 02:00,London,Winter,,51.0,0.0,Clear,2.84,11543,1021.36
5183.0,16/01/2024 04AM,London,,17.32,-13.981521161054605,0.0,Clear,48.46,9262,991.27
5184.0,2024-01-16 06:00,,Winter,-52.68489702720677,70.0,0.0,Snow,362.90366550473817,446,
5185.0,2024-01-16T08:00Z,London,,22.75,45.0,0.0,Clear,,10105,1011.97
5186.0,16/01/2024 10AM,London,Winter,3.87,-32.84701048834888,0.0,Clear,35.67,11106,1028.95
5187.0,,London,Summer,27.76,34.0,0.0,Clear,73.38,49983.786020517095,996.83
,2024-01-16 14:00,London,Winter,10.85,66.0,92.3514965159763,Rain,27.38,11427,1018.17
5189.0,16/01/2024 04PM,,Winter,-3.77,77.0,3.05,Snow,15.65,4561,1023.82
5190.0,,London,Summer,-40.24590313541361,65.0,0.0,Snow,73.96,1587,1041.74
5191.0,2024-01-16T20:00Z,London,Winter,-1.4,68.0,93.27283450155518,Snow,187.0817033024286,6981,1102.2111587683169
5192.0,2024-01-16T22:00Z,London,Winter,7.26,40.0,0.0,Clear,76.85,11780,1021.4
5193.0,17/01/2024 12AM,,Winter,81.28613140131586,48.0,0.0,Clear,72.81,8718,999.4
5194.0,2024-01-17 02:00,London,Winter,3.26,86.0,0.0,Clear,13.41,11081,1017.34
5195.0,17/01/2024 04AM,,Winter,,74.0,0.0,Clear,359.77884409224777,11007,1010.8
5196.0,,London,Winter,8.71,,1.84,Clear,51.05,8532,1015.92
5197.0,2024-01-17T08:00Z,London,Winter,13.45,82.0,15.18,,76.45,11803,1015.82
5198.0,17/01/2024 10AM,London,Winter,-3.54,,0.76,Snow,0.3,11327,1041.76
5199.0,,London,Winter,12.07,88.0,12.75,Clear,,,991.01
5200.0,17/01/2024 02PM,London,Winter,,43.0,0.0,Clear,41.85,11035,991.48
5201.0,2024-01-17T16:00Z,London,,18.98,32.0,0.0,Clear,39.77,9745,1019.52
5202.0,2024-01-17 18:00,London,Winter,1.71,66.0,4.41,Fog,,717,1017.74
5203.0,17/01/2024 08PM,London,Winter,-42.50280912741091,80.0,0.0,Clear,49.51,9901,1011.06
5204.0,2024-01-17 22:00,London,Winter,-3.92,56.0,,Clear,,9821,1007.95
5205.0,2024-01-18T00:00Z,London,Winter,61.35848389761314,53.0,0.0,Clear,50.56,10835,984.44
,2024-01-18 02:00,London,Winter,7.23,162.23033496405913,0.0,Clear,58.89,11652,1026.55
5207.0,,London,Autumn,20.96,167.32899597506716,35.09,,53.52,49994.29587519516,1006.21
5208.0,2024-01-18 06:00,London,Winter,5.62,84.0,,Fog,4.38,,1004.66
5209.0,18/01/2024 08AM,London,Winter,4.57,84.0,34.69,,27.62,10907,1025.98
5210.0,2024-01-18 10:00,London,Winter,-3.25,44.0,0.0,Clear,50.18,8540,875.5509154632304
5211.0,2024-01-18T12:00Z,London,Winter,1.53,75.0,12.05,Clear,3.79,11785,997.29
5212.0,,London,Summer,21.02,-26.403824622194428,0.0,Clear,73.63,9876,1028.81
5213.0,2024-01-18T16:00Z,,Winter,9.57,47.0,0.0,Clear,32.13,8225,1011.06
5214.0,2024-01-18T18:00Z,London,,15.35,,13.34,Rain,0.98,4639,998.69
5215.0,2024-01-18 20:00,London,Winter,,,8.19,Fog,60.42,7768,1009.76
5216.0,2024-01-18T22:00Z,London,Winter,8.08,71.0,11.71,Rain,38.44,9528,986.69
5217.0,19/01/2024 12AM,London,Winter,-4.03,44.0,,Fog,66.15,5751,1005.48
5218.0,2024-01-19 02:00,London,Winter,-1.23,73.0,0.0,Clear,192.276267588617,10447,1006.89
5219.0,2024-01-19T04:00Z,London,Winter,,89.0,12.3,Rain,,666,970.27
5220.0,2024-01-19T06:00Z,London,Winter,79.08110082409983,85.0,0.0,,17.12,10414,984.29
5221.0,19/01/2024 08AM,London,Winter,-2.28,,9.87,Fog,32.58,11846,1039.95
5222.0,2024-01-19 10:00,London,Winter,14.55,158.4657911584272,0.0,Clear,22.28,11233,1004.24
5223.0,19/01/2024 12PM,London,Winter,4.95,46.0,,Snow,26.16,5032,991.55
5224.0,19/01/2024 02PM,London,Winter,4.0,171.5090175679666,0.0,Clear,8.75,10343,889.7761279662831
5225.0,,,Winter,2.33,88.0,34.16,Rain,51.85,,
5226.0,2024-01-19T18:00Z,London,Winter,11.17,61.0,0.0,Clear,16.14,11482,991.9
5227.0,,London,Summer,24.16,42.0,0.0,Clear,43.2,9856,1025.24
5228.0,2024-01-19T22:00Z,London,Winter,7.76,67.0,3.81,Fog,32.82,3351,1014.05
5229.0,20/01/2024 12AM,London,Winter,3.44,57.0,0.0,Snow,,,1026.39
5230.0,2024-01-20T02:00Z,London,Winter,5.44,73.0,2.71,Fog,59.52,4345,1009.61
5231.0,20/01/2024 04AM,London,Winter,2.26,41.0,,Clear,30.78,10806,1024.31
5232.0,2024-01-20 06:00,London,Winter,0.95,68.0,,Fog,33.04,,1006.83
5233.0,2024-01-20T08:00Z,London,Winter,10.82,80.0,27.47,Rain,10.41,8546,995.76
5234.0,,London,Winter,7.94,69.0,6.61,Clear,,11167,1016.94
5235.0,20/01/2024 12PM,,Winter,3.63,58.0,0.0,Snow,18.84,4841,1018.99
5236.0,20/01/2024 02PM,London,Winter,2.09,78.0,8.06,Clear,44.76,11810,993.59
5237.0,20/01/2024 04PM,London,Winter,9.96,56.0,0.0,Clear,25.24,11494,
,20/01/2024 06PM,London,Winter,-37.27427144332705,71.0,5.89,Fog,53.05,,1030.73
5239.0,20/01/2024 08PM,London,Winter,,69.0,0.0,,77.58,10996,1021.88
5240.0,,,,7.65,154.07351709688137,62.68,Storm,70.55,4179,988.2
5241.0,21/01/2024 12AM,London,Winter,9.27,81.0,0.0,Clear,10.22,9210,1026.69
5242.0,21/01/2024 02AM,,Winter,71.5719735956848,-17.390536126187534,0.0,Clear,64.63,8864,1004.16
5243.0,2024-01-21 04:00,London,Winter,3.1,86.0,0.0,Clear,,8065,991.07
5244.0,2024-01-21T06:00Z,London,Winter,,50.0,0.0,,35.96,49990.76024700843,1029.18
5245.0,21/01/2024 08AM,London,Winter,9.49,,0.38,Fog,33.37,8085,1008.77
5246.0,2024-01-21T10:00Z,London,Winter,0.87,83.0,0.0,Snow,6.9,11862,966.94
5247.0,2024-01-21 12:00,London,Winter,-2.72,71.0,206.68728088891464,Storm,35.03,675,981.93
5248.0,2024-01-21T14:00Z,London,Winter,68.3651881328152,52.0,0.0,Clear,,11091,989.82
5249.0,21/01/2024 04PM,London,Winter,5.32,,,Fog,61.79,120017.83423792553,1010.79
5250.0,2024-01-21T18:00Z,London,Winter,11.54,49.0,0.0,Clear,52.16,9656,993.37
5251.0,2024-01-21T20:00Z,London,,16.55,163.49831607053125,0.0,Clear,58.56,120003.11874513491,1019.47
5252.0,2024-01-21T22:00Z,London,Winter,-0.32,85.0,0.0,Clear,62.28,49997.21273242125,1017.85
5253.0,22/01/2024 12AM,London,Winter,14.93,86.0,18.9,Clear,9.44,11866,994.75
5254.0,2024-01-22 02:00,London,Winter,1.07,49.0,0.0,Snow,,3767,1018.7
5255.0,,,Autumn,,92.0,0.0,Clear,63.69,120013.54585822241,1028.29
5256.0,2024-01-22T06:00Z,London,,23.6,94.0,,Clear,,10219,885.181910857299
5257.0,2024-01-22 08:00,London,,4.27,-20.074884521583268,0.0,Clear,,,1012.16
5258.0,2024-01-22T10:00Z,,,19.07,67.0,14.34,Rain,76.89,993,997.07
5259.0,,London,Winter,-2.54,57.0,0.0,Clear,50.81,10712,
5260.0,,,Winter,3.26,,17.53,Clear,9.87,9584,898.4061962353048
5261.0,2024-01-22T16:00Z,London,,18.4,49.0,92.60119250174016,Storm,58.32,,960.03
5262.0,,London,Summer,-38.17250535952408,40.0,0.0,Clear,60.72,9720,1015.67
,2024-01-22T20:00Z,London,,7.5,,223.3765200403151,Storm,65.73,1783,952.69
5264.0,,London,,20.33,68.0,0.0,Clear,36.27,8414,1021.32
5265.0,2024-01-23 00:00,London,Winter,13.09,62.0,0.0,,24.93,9274,995.82
5266.0,2024-01-23T02:00Z,London,,15.21,74.0,,Clear,55.58,10369,1001.99
5267.0,2024-01-23 04:00,London,Winter,4.33,89.0,0.0,Clear,182.2644053847358,11135,997.96
5268.0,2024-01-23 06:00,London,,,37.0,0.0,Clear,19.21,11272,898.1038866808256
5269.0,2024-01-23T08:00Z,London,Winter,13.42,74.0,9.81,Fog,6.51,10642,1010.76
5270.0,23/01/2024 10AM,London,Winter,,54.0,0.0,Clear,30.17,,1007.78
5271.0,23/01/2024 12PM,London,Winter,,68.0,212.81977473695798,Rain,180.00766492146212,10799,1002.72
5272.0,23/01/2024 02PM,London,Winter,3.12,70.0,0.0,Clear,18.7,11335,1002.52
5273.0,,London,Spring,,72.0,0.0,Clear,,11777,1029.77
,23/01/2024 06PM,London,Winter,5.69,76.0,0.0,Clear,,11732,
5275.0,23/01/2024 08PM,London,Winter,-2.42,64.0,3.88,Fog,40.2,N/A,1024.19
5276.0,2024-01-23 22:00,London,Winter,12.62,85.0,0.0,Clear,49.42,10861,1027.83
5277.0,2024-01-24 00:00,London,Winter,-0.65,75.0,0.0,Clear,190.97166558624912,9407,897.92842439124
5278.0,2024-01-24T02:00Z,London,Winter,3.75,,2.01,,61.09,8887,
5279.0,2024-01-24T04:00Z,London,Winter,-35.68975761953824,55.0,99.73226562413572,Snow,17.65,4405,1018.2
5280.0,24/01/2024 06AM,London,Winter,1.32,44.0,,Fog,47.91,,1002.97
5281.0,2024-01-24 08:00,,Winter,1.36,161.22278913527194,0.0,,60.72,,1004.98
5282.0,2024-01-24T10:00Z,London,Winter,12.55,90.0,0.0,,67.75,11713,1022.06
5283.0,,London,,5.77,46.0,0.0,Clear,40.59,8809,999.96
5284.0,2024-01-24 14:00,,Winter,2.55,79.0,,Snow,60.71,4798,992.59
5285.0,2024-01-24T16:00Z,London,Winter,13.51,63.0,224.81181173056424,Rain,61.04,10600,
5286.0,2024-01-24T18:00Z,London,Winter,7.11,55.0,,Clear,73.35,10123,996.63
5287.0,2024-01-24T20:00Z,London,Winter,,80.0,0.0,Clear,,9711,1019.32
5288.0,2024-01-24 22:00,London,Winter,-36.020882876238815,66.0,,Snow,,,1000.56
5289.0,25/01/2024 12AM,,Winter,1.86,63.0,5.98,Fog,71.04,11338,1017.45
5290.0,,London,Summer,34.24,34.0,,Fog,75.32,444,985.73
5291.0,2024-01-25 04:00,London,Winter,5.97,68.0,0.0,Clear,55.99,error,998.82
5292.0,2024-01-25T06:00Z,London,Winter,10.91,76.0,0.0,Clear,30.53,11311,1001.64
5293.0,2024-01-25T08:00Z,London,Winter,,43.0,0.0,Clear,63.8,10419,1011.53
5294.0,25/01/2024 10AM,London,Winter,9.94,42.0,0.0,Clear,56.52,,1022.41
,,London,Spring,15.91,40.0,0.0,Clear,60.62,10852,894.7819366269529
5296.0,2024-01-25T14:00Z,London,Winter,8.92,53.0,0.0,Clear,8.16,9749,992.25
5297.0,25/01/2024 04PM,,Winter,,55.0,0.0,Clear,62.07,9899,1001.01
5298.0,2024-01-25T18:00Z,London,Winter,6.74,84.0,43.89,Rain,369.8806206765605,619,998.75
5299.0,2024-01-25T20:00Z,London,Winter,6.98,60.0,3.26,,9.98,11871,991.85
5300.0,25/01/2024 10PM,London,Winter,14.72,53.0,78.54168327519842,Storm,58.32,,
5301.0,2024-01-26 00:00,,Winter,7.96,49.0,0.0,Clear,21.61,9349,1003.34
5302.0,2024-01-26 02:00,London,Winter,13.51,59.0,89.30395187165557,,3.84,11301,1011.27
5303.0,TBD,,Spring,13.51,70.0,9.52,Fog,40.18,,1002.23
5304.0,2024-01-26 06:00,London,,22.3,21.0,0.0,Clear,41.2,,1007.0
5305.0,2024-01-26T08:00Z,London,,13.46,87.0,0.0,,39.64,10781,1020.66
5306.0,2024-01-26T10:00Z,London,Winter,13.58,42.0,,Clear,,,1007.23
5307.0,2024-01-26 12:00,London,Winter,-0.48,67.0,14.85,Snow,0.46,4449,996.44
5308.0,2024-01-26T14:00Z,London,Winter,10.61,87.0,87.50002328560667,Storm,58.99,2249,962.65
5309.0,2024-01-26 16:00,London,Winter,-1.38,80.0,0.0,,15.97,10867,1013.45
5310.0,26/01/2024 06PM,London,Winter,-0.06,155.29943877557608,0.0,Clear,188.79420566753737,11036,1023.56
5311.0,2024-01-26 20:00,London,Winter,-2.59,81.0,215.47525922635532,Rain,12.29,11465,
5312.0,2024-01-26 22:00,London,Winter,14.35,43.0,0.0,Clear,69.62,9573,
5313.0,TBD,London,Summer,15.51,30.0,0.0,Clear,22.22,9019,994.65
5314.0,2024-01-27T02:00Z,London,Winter,12.97,80.0,77.57,Storm,8.52,10256,973.86
5315.0,2024-01-27 04:00,London,,5.45,44.0,0.0,Clear,70.82,49997.72827637291,994.01
5316.0,2024-01-27 06:00,London,,24.92,30.0,0.0,,63.33,8348,1012.51
5317.0,2024-01-27T08:00Z,London,Winter,62.56415223917782,66.0,6.98,Clear,54.75,10014,984.07
5318.0,2024-01-27 10:00,London,Winter,-1.44,83.0,0.0,Clear,39.94,49998.327373709166,1026.23
5319.0,2024-01-27 12:00,London,Winter,9.53,48.0,0.0,Clear,33.12,10678,1011.97
5320.0,2024-01-27T14:00Z,London,Winter,8.87,55.0,0.0,Clear,10.69,11478,1001.79
5321.0,,London,Spring,15.44,74.0,,,189.22957886589094,8747,1011.1
5322.0,2024-01-27 18:00,London,Winter,,67.0,0.0,Clear,56.75,10136,
,2024-01-27T20:00Z,London,Winter,4.37,64.0,0.0,Snow,,5519,
5324.0,27/01/2024 10PM,London,Winter,1.29,,8.15,,63.69,8660,1122.1100517018972
,2024-01-28T00:00Z,,Winter,8.03,90.0,,Fog,79.76,1122,1011.89
5326.0,28/01/2024 02AM,London,Winter,-35.70148723931217,70.0,0.0,Clear,29.08,10787,1033.79
5327.0,,London,Winter,,46.0,,Fog,53.53,2476,1026.9
5328.0,28/01/2024 06AM,London,Winter,-2.71,70.0,0.0,Snow,63.16,826,990.81
5329.0,2024-01-28T08:00Z,London,Winter,-3.93,88.0,0.0,Clear,34.94,10297,1003.11
5330.0,2024-01-28T10:00Z,London,Winter,-4.72,71.0,0.0,Snow,66.6,273,1025.64
5331.0,28/01/2024 12PM,London,,26.9,83.0,0.0,Clear,61.21,8724,1007.44
5332.0,2024-01-28 14:00,London,Winter,-2.92,66.0,0.0,Clear,53.42,10259,1018.78
5333.0,2024-01-28T16:00Z,London,Winter,13.79,57.0,0.0,Clear,19.32,N/A,1010.76
5334.0,2024-01-28T18:00Z,London,Winter,7.89,76.0,0.0,Clear,12.68,8484,1023.72
5335.0,,London,Winter,,174.5853547851939,0.0,Clear,15.51,9548,1001.0
5336.0,28/01/2024 10PM,London,Winter,-2.16,44.0,0.0,,,9537,1018.04
,2024-01-29 00:00,London,Winter,1.94,40.0,0.0,,40.94,49977.08606901164,995.06
5338.0,29/01/2024 02AM,London,Winter,5.25,51.0,0.0,Clear,63.45,10957,1006.95
5339.0,2024-01-29T04:00Z,London,Winter,11.39,72.0,0.0,Clear,31.86,,1016.28
5340.0,29/01/2024 06AM,,Winter,,58.0,0.0,Clear,,9727,
5341.0,2024-01-29 08:00,London,Winter,1.54,,9.24,Snow,,3465,989.49
5342.0,2024-01-29 10:00,London,Winter,-2.95,48.0,0.0,Snow,72.18,,985.62
5343.0,2024-01-29T12:00Z,London,Winter,12.24,66.0,0.0,Clear,22.44,,1012.34
5344.0,,London,Winter,4.36,61.0,0.0,Snow,12.32,11554,985.3
5345.0,2024-01-29 16:00,London,Winter,,82.0,48.52,Rain,34.47,441,999.3
,2024-01-29 18:00,London,,,32.0,0.0,Clear,17.59,8700,1001.52
5347.0,29/01/2024 08PM,London,Winter,8.76,50.0,,Fog,1.67,3884,1009.53
5348.0,2024-01-29 22:00,London,Winter,-36.59533844596197,87.0,0.0,Clear,26.7,11455,
5349.0,2024-01-30 00:00,London,,17.33,46.0,0.0,Clear,70.17,11925,1026.41
5350.0,,London,Summer,13.07,70.0,0.0,Clear,12.02,,1001.79
5351.0,2024-01-30 04:00,London,Winter,-4.99,58.0,0.0,Clear,11.41,9191,1014.19
5352.0,30/01/2024 06AM,,Winter,-1.53,77.0,6.83,Snow,36.89,589,1020.33
,,London,Spring,9.54,38.0,,Fog,53.61,3213,887.0366975088776
5354.0,2024-01-30T10:00Z,London,Winter,5.33,48.0,0.0,Clear,192.19436742378397,unknown,1109.7678473322937
5355.0,2024-01-30 12:00,London,Winter,11.43,79.0,2.98,Clear,23.2,10734,1021.99
5356.0,,London,,19.51,65.0,0.0,Clear,68.47,9599,996.06
5357.0,2024-01-30T16:00Z,London,Winter,13.32,70.0,0.0,Clear,55.82,,
5358.0,2024-01-30 18:00,London,Winter,9.65,51.0,0.0,,361.03821131649465,8120,1017.95
5359.0,30/01/2024 08PM,London,Winter,9.84,90.0,0.0,Clear,71.46,8294,1028.31
,2024-01-30T22:00Z,London,Winter,,67.0,0.0,Clear,350.56356195807854,11392,992.72
5361.0,2024-01-31T00:00Z,,Winter,-3.87,70.0,80.01278142156848,Snow,65.34,120022.6080966387,1011.41
5362.0,2024-01-31 02:00,London,,1.07,75.0,0.0,Snow,15.69,120017.38601329275,987.73
5363.0,2024-01-31 04:00,London,,0.3,88.0,,Snow,3.5,9960,979.71
5364.0,31/01/2024 06AM,London,Winter,0.85,57.0,0.0,Clear,371.03563379048154,10264,1022.66
5365.0,,London,Winter,6.76,43.0,0.0,Clear,3.55,,1020.52
5366.0,31/01/2024 10AM,London,Winter,10.15,67.0,0.0,Clear,76.2,10190,1012.73
,2024-01-31 12:00,,Winter,8.65,89.0,0.0,Clear,62.59,10328,
5368.0,2024-01-31T14:00Z,London,Winter,-3.83,79.0,0.0,Snow,18.19,8754,1106.476368750498
5369.0,,London,Spring,6.16,45.0,0.0,,,9475,1016.08
5370.0,2024-01-31 18:00,London,,18.27,85.0,0.0,Clear,12.01,11926,1010.14
5371.0,2024-01-31T20:00Z,London,Winter,8.18,52.0,0.0,Clear,28.96,8987,1101.9110942100426
5372.0,2024-01-31 22:00,London,Winter,-2.49,66.0,0.0,Snow,40.4,49981.5844030614,892.2511641247078
5373.0,01/02/2024 12AM,London,Winter,6.14,61.0,208.87394080868344,Storm,64.31,,976.2
5374.0,2024-02-01 02:00,London,Winter,6.28,67.0,,Clear,22.26,8678,1007.56
5375.0,2024-02-01 04:00,London,Winter,-0.86,,17.81,Clear,22.55,8516,1004.38
5376.0,2024-02-01 06:00,London,Winter,,,3.13,Clear,25.18,11253,1012.33
5377.0,2024-02-01T08:00Z,London,Winter,8.47,51.0,0.0,Clear,,10284,991.55
5378.0,2024-02-01T10:00Z,London,Winter,1.0,71.0,0.0,Snow,71.75,2443,1013.76
5379.0,,London,Summer,,69.0,0.0,Clear,4.37,8186,1012.9
5380.0,01/02/2024 02PM,,Winter,-35.48916185186607,62.0,0.0,Snow,42.86,2766,1032.23
,2024-02-01 16:00,London,Winter,-0.05,90.0,0.0,Snow,,8391,995.95
,01/02/2024 06PM,London,Winter,2.53,66.0,0.0,Snow,31.49,9627,983.98
5383.0,01/02/2024 08PM,London,,12.1,,9.87,,55.12,8856,1011.82
5384.0,2024-02-01T22:00Z,London,,3.15,21.0,0.0,,33.93,11067,990.37
5385.0,02/02/2024 12AM,London,Winter,8.0,53.0,0.0,Clear,16.85,11800,
5386.0,,London,Autumn,6.22,72.0,82.10468940823421,Storm,74.74,2773,977.82
5387.0,2024-02-02T04:00Z,London,Winter,4.47,153.66229138212898,0.0,Snow,35.18,623,
5388.0,2024-02-02T06:00Z,,Winter,11.8,90.0,0.0,Clear,68.43,10527,1027.58
,2024-02-02T08:00Z,,Winter,1.57,72.0,,Fog,,9861,1025.0
,2024-02-02 10:00,London,Winter,62.98566912413537,-21.397912860386416,0.0,,66.98,11709,1110.409468195907
5391.0,2024-02-02 12:00,London,,13.3,84.0,0.0,Clear,9.42,11810,993.62
5392.0,2024-02-02 14:00,London,Winter,-3.37,83.0,,Clear,45.2,8816,1027.9
5393.0,02/02/2024 04PM,London,Winter,-1.59,49.0,0.0,Clear,16.6,11253,1008.43
5394.0,02/02/2024 06PM,London,Winter,2.45,42.0,0.0,Snow,26.93,120011.41114190102,1012.18
5395.0,2024-02-02 20:00,London,Winter,5.14,,10.24,Clear,15.88,,993.62
5396.0,2024-02-02T22:00Z,London,Winter,,55.0,,Clear,37.66,10737,999.71
5397.0,03/02/2024 12AM,,Spring,15.96,34.0,,Clear,29.53,,
5398.0,2024-02-03 02:00,London,Winter,,66.0,0.0,Clear,58.61,8658,1005.36
5399.0,03/02/2024 04AM,London,Spring,6.74,62.0,0.0,Clear,78.46,120017.6891178992,1010.6
5400.0,03/02/2024 06AM,London,,17.98,,5.34,Fog,50.88,1688,995.79
5401.0,2024-02-03T08:00Z,London,Winter,,78.0,0.0,,74.2,error,993.17
5402.0,2024-02-03T10:00Z,London,Winter,-0.12,70.0,10.64,Snow,,9125,876.5930614641655
5403.0,2024-02-03T12:00Z,London,Winter,4.51,60.0,0.0,Clear,374.19309021506615,120013.23979373448,1020.03
5404.0,2024-02-03T14:00Z,London,Winter,-4.53,71.0,0.0,Snow,16.9,9642,998.42
5405.0,2024-02-03T16:00Z,London,Winter,2.84,69.0,,Fog,360.4524975594594,279,1029.96
5406.0,2024-02-03T18:00Z,London,Winter,79.74699658418373,72.0,6.17,Clear,23.44,9003,989.68
5407.0,2024-02-03 20:00,London,Winter,-3.6,66.0,81.50073120060507,Snow,,4263,1025.7
5408.0,2024-02-03T22:00Z,London,Winter,-1.62,55.0,201.8517388884429,Storm,73.62,120014.08848583004,987.81
5409.0,2024-02-04 00:00,London,Winter,,53.0,87.71478901532613,Storm,51.51,10655,954.14
5410.0,2024-02-04T02:00Z,London,Winter,2.13,40.0,0.0,Snow,,616,998.35
5411.0,2024-02-04T04:00Z,,Winter,9.35,,,Clear,4.87,120001.2770699931,992.92
5412.0,2024-02-04T06:00Z,London,Winter,6.63,68.0,0.0,,60.36,10077,1015.81
5413.0,2024-02-04T08:00Z,London,Winter,13.91,72.0,7.05,Fog,54.96,3501,994.12
,04/02/2024 10AM,London,Spring,14.15,60.0,0.0,Clear,68.5,9449,1002.32
5415.0,04/02/2024 12PM,London,Spring,,75.0,84.56015835063255,Rain,49.4,11856,997.82
5416.0,,London,Winter,0.52,47.0,218.3112255136999,Storm,59.84,,974.67
5417.0,04/02/2024 04PM,London,Spring,7.98,,2.38,Fog,359.33685899082593,9339,1012.99
5418.0,2024-02-04T18:00Z,London,Winter,12.03,81.0,0.0,Clear,70.44,10653,1021.24
5419.0,2024-02-04T20:00Z,London,,6.76,48.0,0.0,Clear,65.72,10362,
,2024-02-04T22:00Z,London,,26.12,45.0,0.0,Clear,28.43,,1024.7
5421.0,05/02/2024 12AM,London,Spring,19.54,63.0,7.85,Fog,361.949473853276,439,1024.3
5422.0,05/02/2024 02AM,London,Spring,14.76,31.0,0.0,Clear,19.92,,1013.85
5423.0,05/02/2024 04AM,London,Spring,19.48,41.0,,Clear,50.02,49986.76255811643,995.77
5424.0,,London,,29.65,73.0,9.45,Fog,20.55,5037,997.85
5425.0,2024-02-05 08:00,London,Winter,7.3,86.0,0.0,Clear,70.69,10708,1024.03
5426.0,2024-02-05 10:00,,,23.84,93.0,70.87,Rain,21.02,2526,1009.66
5427.0,,London,,29.25,57.0,0.0,Clear,77.3,11627,
5428.0,2024-02-05 14:00,London,Winter,-4.06,84.0,0.0,Clear,67.46,10497,1001.96
5429.0,05/02/2024 04PM,London,Spring,-41.10606553626803,76.0,6.75,Clear,12.76,120006.90544678652,1004.94
5430.0,,London,Winter,5.48,54.0,0.0,Clear,5.63,,1023.52
5431.0,05/02/2024 08PM,,Spring,6.55,68.0,0.0,Clear,4.53,11000,1010.31
5432.0,05/02/2024 10PM,London,Spring,13.87,79.0,0.0,Clear,195.95514122277498,8388,1004.43
5433.0,06/02/2024 12AM,London,Summer,,45.0,0.0,,352.4701050095776,10986,1004.34
5434.0,06/02/2024 02AM,London,Summer,16.58,69.0,0.0,Clear,188.45586920899513,9296,1018.88
5435.0,06/02/2024 04AM,London,Summer,18.43,30.0,0.0,Clear,56.02,,993.73
5436.0,06/02/2024 06AM,,Summer,33.03,38.0,0.0,Clear,19.67,N/A,989.81
,2024-02-06 08:00,London,Winter,3.78,52.0,0.0,Clear,59.74,9079,1027.02
5438.0,2024-02-06T10:00Z,,Winter,-2.42,72.0,12.57,Clear,17.92,9793,1038.13
5439.0,2024-02-06T12:00Z,London,Winter,-3.69,160.7707507357407,37.74,Rain,18.61,,1008.83
,2024-02-06T14:00Z,London,Winter,10.47,41.0,,Fog,75.92,401,997.1
5441.0,06/02/2024 04PM,London,Summer,18.49,,,Clear,175.69133896381373,49990.91204397769,
5442.0,2024-02-06 18:00,London,Winter,12.59,-21.560253819779767,0.0,Clear,23.31,49978.88131551395,1003.5
5443.0,2024-02-06T20:00Z,London,Winter,2.31,,1.17,Clear,7.28,10876,1011.86
,06/02/2024 10PM,,Summer,22.26,50.0,0.0,Clear,,9257,1012.85
5445.0,07/02/2024 12AM,London,Summer,11.31,67.0,,,76.0,8833,897.5080174746718
5446.0,07/02/2024 02AM,London,Summer,30.66,22.0,0.0,Clear,54.43,11851,990.9
5447.0,07/02/2024 04AM,London,,63.22220617215392,29.0,0.0,Clear,26.19,11811,991.46
5448.0,2024-02-07 06:00,London,Winter,4.96,70.0,201.68500938299147,Snow,35.36,10969,1015.65
5449.0,2024-02-07 08:00,London,Winter,-0.5,86.0,27.2,Snow,4.54,3635,991.63
5450.0,,London,,24.72,69.0,0.0,Clear,27.61,8627,998.95
5451.0,2024-02-07 12:00,London,,24.16,89.0,53.85,Rain,36.18,5341,1004.17
5452.0,07/02/2024 02PM,London,Summer,19.82,48.0,0.0,,17.37,10119,990.95
5453.0,2024-02-07 16:00,London,Winter,11.02,55.0,0.0,Clear,48.99,49998.00429471997,1108.9174088468787
5454.0,2024-02-07T18:00Z,London,Winter,11.57,58.0,0.0,Clear,9.48,10575,1017.6
5455.0,2024-02-07 20:00,London,Winter,,84.0,0.0,,39.34,,995.4
5456.0,2024-02-07T22:00Z,London,Winter,0.85,62.0,13.47,Rain,41.63,294,997.25
5457.0,,London,Winter,-1.01,84.0,0.0,Clear,27.37,,1017.99
5458.0,2024-02-08 02:00,London,Winter,-51.149846804904044,-16.922322136639206,0.0,Snow,77.25,8230,
5459.0,2024-02-08 04:00,London,Winter,-1.15,71.0,,,14.07,11984,1030.47
5460.0,2024-02-08T06:00Z,London,Winter,7.81,62.0,0.0,Clear,193.3228545003392,8327,1007.84
5461.0,2024-02-08T08:00Z,London,Winter,-3.68,68.0,0.0,Clear,18.25,11604,1033.86
5462.0,08/02/2024 10AM,,,4.18,100.0,0.0,Snow,181.77225204879701,11497,1001.26
5463.0,2024-02-08 12:00,London,Winter,7.16,71.0,5.31,Fog,47.93,,1007.88
5464.0,08/02/2024 02PM,London,Summer,21.9,70.0,5.51,Clear,48.75,120002.38956648561,890.0649944134858
5465.0,2024-02-08 16:00,London,Winter,,,7.12,Fog,38.78,5895,992.42
,2024-02-08T18:00Z,London,,,-12.254834399934904,0.0,Clear,60.68,10892,
5467.0,2024-02-08 20:00,London,Winter,6.0,65.0,0.0,Clear,3.15,49978.789248150264,1027.6
5468.0,2024-02-08 22:00,London,Winter,5.49,,4.15,Fog,,1345,996.11
5469.0,2024-02-09 00:00,London,Winter,-4.53,155.22091523362434,59.13,Storm,59.54,5977,990.9
5470.0,2024-02-09 02:00,London,,24.14,45.0,0.0,Clear,47.46,8941,1000.09
5471.0,09/02/2024 04AM,London,Autumn,11.55,60.0,0.0,Clear,,8204,1027.21
5472.0,2024-02-09 06:00,London,Winter,9.84,172.46304249764913,75.11,Storm,2.43,unknown,1101.5820960945327
5473.0,2024-02-09 08:00,London,Winter,3.25,42.0,0.0,Clear,21.38,,1016.01
5474.0,2024-02-09 10:00,London,Winter,-34.482144960672564,63.0,0.0,Snow,32.14,10025,1002.76
5475.0,2024-02-09T12:00Z,London,,15.19,96.0,0.0,Clear,63.38,11607,
5476.0,2024-02-09 14:00,London,Winter,4.78,63.0,0.0,Clear,79.04,10842,990.02
5477.0,09/02/2024 04PM,London,Autumn,,-31.973111628165952,,Fog,9.52,error,1002.15
5478.0,2024-02-09 18:00,London,Winter,0.12,,13.77,,3.09,49995.7657515473,993.76
5479.0,2024-02-09T20:00Z,,Winter,,48.0,201.72749022060495,Storm,71.73,7992,960.59
5480.0,2024-02-09T22:00Z,London,Winter,-4.12,83.0,0.0,Snow,10.56,???,1016.16
,,London,Winter,13.97,55.0,0.0,Clear,53.17,9077,1016.25
5482.0,2024-02-10T02:00Z,London,,1.8,,17.61,Clear,,10594,992.84
5483.0,2024-02-10 04:00,London,Winter,10.07,54.0,,Fog,2.21,11066,1027.98
5484.0,2024-02-10T06:00Z,London,Winter,-52.87893338045583,,5.55,Fog,42.82,7877,1036.94
5485.0,10/02/2024 08AM,London,Autumn,83.35402169660688,88.0,0.0,Clear,24.51,9080,987.53
5486.0,2024-02-10T10:00Z,London,Winter,1.42,51.0,0.0,Clear,26.99,9604,1012.73
,2024-02-10T12:00Z,London,,5.67,78.0,0.0,Clear,78.53,9790,997.24
5488.0,2024-02-10T14:00Z,London,Winter,-3.08,42.0,90.60900057099238,Storm,66.58,7600,973.96
5489.0,2024-02-10 16:00,London,Winter,4.19,,13.42,Rain,67.78,11074,1005.48
5490.0,10/02/2024 06PM,London,Autumn,19.07,74.0,5.95,Clear,70.22,10643,1022.0
5491.0,,London,Summer,16.73,30.0,0.0,Clear,67.67,8368,1014.62
5492.0,2024-02-10 22:00,London,Winter,13.32,165.5236162342404,0.0,Clear,23.06,8070,895.4322440145804
5493.0,2024-02-11T00:00Z,London,Winter,-1.26,50.0,201.42125178013103,Snow,10.58,2434,977.63
,11/02/2024 02AM,London,Autumn,22.78,83.0,0.0,Clear,32.61,120021.04865038738,1026.17
5495.0,2024-02-11 04:00,,Winter,-2.06,87.0,0.0,Clear,31.94,,1037.91
5496.0,11/02/2024 06AM,London,Autumn,6.56,85.0,0.0,Clear,73.76,,1010.38
5497.0,11/02/2024 08AM,,Autumn,6.02,78.0,0.0,Clear,40.48,9352,1018.9
5498.0,11/02/2024 10AM,London,,0.36,44.0,0.0,Snow,356.6376922144066,11788,1000.82
5499.0,2024-02-11T12:00Z,London,Winter,1.61,82.0,0.0,Clear,1.78,10043,992.05
5500.0,2024-02-11 14:00,London,Winter,13.1,72.0,,Clear,75.88,8233,
5501.0,11/02/2024 04PM,London,Autumn,9.28,65.0,,,58.99,11827,
5502.0,11/02/2024 06PM,London,Autumn,,60.0,9.16,Clear,71.76,9193,
5503.0,2024-02-11T20:00Z,London,Winter,-0.52,61.0,0.0,Snow,32.09,2971,1007.71
5504.0,11/02/2024 10PM,London,Autumn,19.37,91.0,0.0,Clear,52.49,120006.3045489396,1009.9
5505.0,12/02/2024 12AM,London,Winter,8.17,84.0,,Clear,48.31,49984.01818828869,1014.6
,2024-02-12 02:00,London,Winter,9.73,73.0,0.0,Clear,36.4,11095,990.72
5507.0,12/02/2024 04AM,London,Winter,-0.38,68.0,0.0,Clear,0.34,8978,1038.35
5508.0,2024-02-12T06:00Z,London,Winter,10.34,155.3353638451714,18.11,Rain,43.61,120018.27541445535,975.91
5509.0,2024-02-12T08:00Z,London,Winter,-3.48,,15.41,Snow,27.0,,1006.85
5510.0,2024-02-12 10:00,London,Winter,1.84,52.0,,Fog,40.99,11062,1019.79
5511.0,12/02/2024 12PM,London,Winter,,159.31343485577347,86.58703194655948,Storm,64.2,120007.92667274289,899.1019500416523
,12/02/2024 02PM,,Winter,14.5,,19.63,Clear,48.23,9082,994.95
5513.0,2024-02-12T16:00Z,London,Winter,-3.41,84.0,0.0,Clear,193.52735803500815,11869,1019.08
5514.0,2024-02-12T18:00Z,London,Winter,1.68,84.0,25.29,Rain,,11179,1000.47
5515.0,12/02/2024 08PM,London,Winter,-0.02,66.0,2.6,Clear,46.42,8945,1029.25
5516.0,2024-02-12T22:00Z,London,Winter,8.92,68.0,0.0,Clear,52.76,10601,997.52
5517.0,2024-02-13 00:00,London,Winter,-1.83,87.0,0.0,Snow,1.1,9840,1012.17
5518.0,13/02/2024 02AM,London,Winter,5.19,86.0,70.34,,76.57,9000,1012.24
5519.0,,London,Winter,8.79,40.0,0.0,Clear,55.68,11448,1004.28
,13/02/2024 06AM,,Winter,1.67,41.0,0.0,Clear,,11997,998.83
5521.0,2024-02-13 08:00,London,Winter,,,5.01,,55.12,8026,1029.69
5522.0,2024-02-13T10:00Z,London,Winter,1.98,84.0,0.0,Snow,195.6819365190474,510,980.29
5523.0,2024-02-13 12:00,London,Winter,,51.0,0.0,Clear,12.3,9090,1025.35
5524.0,13/02/2024 02PM,,Winter,14.94,68.0,0.0,Clear,,9538,993.64
5525.0,2024-02-13T16:00Z,London,Winter,4.59,,3.6,,,8342,1000.39
5526.0,2024-02-13 18:00,,Winter,-43.941308842704586,80.0,0.0,,61.24,,1012.9
,2024-02-13 20:00,London,Winter,,49.0,0.0,Clear,23.19,8605,1009.07
,2024-02-13T22:00Z,London,,-54.343716158690604,20.0,0.0,Snow,22.01,10095,1021.45
5529.0,2024-02-14 00:00,London,Winter,7.04,,12.49,Clear,,9604,1025.61
5530.0,2024-02-14T02:00Z,London,Winter,4.97,64.0,0.0,Clear,32.01,10642,1006.31
5531.0,2024-02-14T04:00Z,London,Winter,-2.92,69.0,14.75,Clear,3.39,9392,1007.67
5532.0,14/02/2024 06AM,London,Winter,14.2,41.0,0.0,Clear,14.28,9907,1016.95
5533.0,2024-02-14 08:00,London,Winter,10.3,56.0,0.0,Clear,361.3685977694041,8506,997.94
5534.0,14/02/2024 10AM,London,,-52.90336770599142,84.0,221.45946145191743,,,10400,1004.48
5535.0,14/02/2024 12PM,London,Winter,9.59,86.0,0.0,Clear,,11311,1020.87
5536.0,2024-02-14 14:00,London,Winter,3.15,53.0,83.37978168161487,Snow,55.63,,1010.07
5537.0,2024-02-14T16:00Z,London,Winter,-30.24354345064844,53.0,0.0,Clear,355.32133618368687,9040,1032.7
5538.0,14/02/2024 06PM,London,Winter,-2.15,56.0,0.0,Clear,78.81,11534,
5539.0,2024-02-14 20:00,London,Winter,72.68498680894129,77.0,224.79735245094523,Storm,50.08,5527,
5540.0,2024-02-14T22:00Z,London,Winter,-0.04,41.0,0.0,Clear,71.24,8913,1038.76
5541.0,2024-02-15T00:00Z,London,Winter,-2.65,41.0,0.0,Clear,48.54,10663,1005.54
5542.0,15/02/2024 02AM,London,Winter,-2.64,,16.09,Rain,364.32283192468736,5602,998.05
,15/02/2024 04AM,London,Winter,2.97,89.0,98.98056353707713,,68.18,8256,1029.19
5544.0,,London,Winter,,80.0,0.0,Clear,41.74,10568,
,,London,Autumn,19.52,58.0,,Fog,66.08,8273,1005.89
5546.0,,London,Spring,9.71,52.0,0.0,Clear,16.39,,994.5
5547.0,15/02/2024 12PM,London,Winter,2.52,82.0,0.0,,,9766,999.46
5548.0,2024-02-15 14:00,London,Winter,4.99,-32.69328648630875,0.0,Snow,20.89,11212,1011.87
5549.0,2024-02-15T16:00Z,London,Winter,1.77,164.7152897984904,0.0,Clear,32.21,11194,990.62
5550.0,2024-02-15 18:00,London,Winter,-1.82,82.0,0.0,Snow,58.6,5651,1002.09
5551.0,2024-02-15T20:00Z,London,Winter,-2.46,42.0,0.0,Clear,57.34,9221,1029.42
5552.0,2024-02-15T22:00Z,London,Winter,62.29164275469964,55.0,0.0,Clear,356.8725011088789,8260,998.46
5553.0,16/02/2024 12AM,London,Winter,-1.92,76.0,10.01,Snow,,966,
5554.0,2024-02-16 02:00,London,Winter,2.49,65.0,12.57,Snow,54.68,2593,988.51
5555.0,2024-02-16T04:00Z,London,Winter,13.28,76.0,10.72,Clear,68.84,9512,1009.59
5556.0,16/02/2024 06AM,London,Winter,-39.42049266398367,,16.65,Snow,66.64,422,997.05
5557.0,16/02/2024 08AM,,Winter,5.49,156.6438605920841,0.0,Clear,186.415824365417,8499,1012.46
5558.0,2024-02-16 10:00,London,Winter,12.13,48.0,0.0,Clear,76.44,11089,1001.95
,2024-02-16T12:00Z,London,Winter,9.66,60.0,8.03,Clear,64.99,49978.89857847274,1015.57
5560.0,2024-02-16 14:00,London,Winter,-54.155267417098045,80.0,0.0,Clear,30.87,11944,1008.88
5561.0,2024-02-16 16:00,London,Winter,11.92,63.0,4.06,Clear,178.58031520222573,,1019.53
5562.0,2024-02-16T18:00Z,London,,4.95,31.0,0.0,Clear,77.86,8633,1003.02
5563.0,2024-02-16T20:00Z,London,Winter,2.85,68.0,7.4,Clear,52.43,9334,1028.21
5564.0,16/02/2024 10PM,London,Winter,6.7,75.0,0.0,Clear,68.46,9092,1015.78
5565.0,2024-02-17 00:00,London,Winter,0.08,79.0,0.0,,45.68,10730,1011.08
5566.0,2024-02-17T02:00Z,London,Winter,,,15.86,Clear,13.86,10484,1008.62
5567.0,2024-02-17T04:00Z,London,Winter,5.29,65.0,0.0,,1.39,8335,
5568.0,2024-02-17T06:00Z,London,Winter,-3.13,50.0,0.0,Snow,38.24,1040,1008.4
5569.0,2024-02-17 08:00,London,Winter,8.74,69.0,11.8,Rain,350.7979339820316,4585,980.83
5570.0,17/02/2024 10AM,London,Winter,1.03,90.0,65.29,Snow,0.7,7881,1007.92
,2099-13-40 25:61,London,Summer,,26.0,0.0,Clear,43.98,,1027.66
5572.0,17/02/2024 02PM,London,Winter,4.59,,14.38,Rain,10.12,2299,1001.87
5573.0,17/02/2024 04PM,London,Winter,10.37,,8.86,Fog,67.48,879,994.42
5574.0,2024-02-17 18:00,London,Winter,3.25,,3.24,Fog,374.3550291923283,,1018.5
5575.0,17/02/2024 08PM,London,Winter,3.01,41.0,0.0,Snow,,253,990.68
5576.0,17/02/2024 10PM,,,17.55,-28.34989052210295,0.0,Clear,186.17328453595084,,1016.2
5577.0,2024-02-18T00:00Z,London,Winter,,90.0,216.1646015625691,Storm,,4396,
5578.0,2024-02-18 02:00,London,Winter,-0.78,77.0,0.0,Snow,72.89,49997.601911526275,1021.42
5579.0,2024-02-18T04:00Z,London,Winter,-0.3,76.0,0.0,,362.59123806393904,10709,1034.06
,2024-02-18 06:00,London,Winter,2.12,76.0,0.0,,43.21,11394,1102.2875926950219
5581.0,2024-02-18T08:00Z,London,Winter,-1.69,72.0,0.0,Clear,192.83454997798688,11236,1017.09
5582.0,2024-02-18T10:00Z,London,Winter,9.46,69.0,0.0,Clear,70.78,10497,1018.81
5583.0,,London,Summer,13.56,68.0,224.00385211954716,Storm,51.23,10159,960.65
5584.0,2024-02-18T14:00Z,London,Winter,14.74,53.0,0.0,Clear,,10278,1021.19
5585.0,18/02/2024 04PM,London,Winter,,52.0,0.0,Clear,37.6,8267,1000.35
5586.0,,London,Autumn,-48.22824805719788,56.0,0.0,Clear,43.67,9019,1027.86
5587.0,2024-02-18 20:00,London,Winter,,47.0,,Fog,19.71,120001.54667798933,1011.51
5588.0,2024-02-18T22:00Z,London,Winter,6.59,,11.88,Rain,46.43,11217,996.12
5589.0,19/02/2024 12AM,London,Winter,10.13,76.0,0.0,Clear,48.69,9057,1021.33
5590.0,19/02/2024 02AM,London,Winter,,83.0,20.65,Rain,38.27,1227,990.11
5591.0,19/02/2024 04AM,London,,27.13,95.0,0.0,Clear,13.83,11217,1000.93
5592.0,,London,Winter,-3.93,88.0,0.0,Clear,36.9,9084,1005.12
5593.0,,London,Autumn,18.06,97.0,0.0,Clear,57.03,11016,1027.6
5594.0,2024-02-19 10:00,London,Winter,7.83,41.0,0.0,Clear,,11281,
5595.0,2024-02-19T12:00Z,London,Winter,1.5,57.0,0.0,Snow,69.06,4884,1020.59
5596.0,2024-02-19 14:00,London,Winter,,78.0,0.0,Clear,72.83,8505,1010.09
5597.0,19/02/2024 04PM,London,Winter,10.53,157.86255197250114,43.55,Rain,193.22248473511928,3193,992.26
5598.0,2024-02-19T18:00Z,London,Winter,2.84,76.0,0.0,Clear,179.62785684131447,unknown,1007.36
,2024-02-19T20:00Z,London,Winter,9.3,58.0,93.11264850855466,Storm,47.17,10254,980.41
,2024-02-19 22:00,London,Winter,66.97369257797644,87.0,11.37,Clear,191.18262089658293,8354,1015.67
5601.0,20/02/2024 12AM,London,Winter,6.83,73.0,0.0,Clear,44.32,9659,1021.4
5602.0,2024-02-20 02:00,London,Winter,8.21,160.71885790314712,0.0,,47.58,11609,1008.18
5603.0,20/02/2024 04AM,London,Winter,-4.88,63.0,0.0,Clear,,9999,1120.8696420574524
5604.0,2024-02-20 06:00,,Winter,-2.18,-17.321676261417302,0.0,Snow,8.42,4564,1013.7
5605.0,2024-02-20 08:00,London,Winter,9.08,43.0,0.0,Clear,14.21,10953,992.34
,20/02/2024 10AM,London,Winter,-2.28,74.0,,Snow,,11456,1013.11
5607.0,,London,Spring,,60.0,219.63018967067046,Storm,67.02,2077,1118.0237590362635
5608.0,,London,,9.97,98.0,72.47,Rain,20.48,1495,987.35
5609.0,2024-02-20T16:00Z,London,Winter,14.35,80.0,0.0,,65.3,9839,1004.57
5610.0,2024-02-20T18:00Z,London,Winter,,78.0,0.0,Clear,31.03,11299,
5611.0,20/02/2024 08PM,London,,-51.61917087021454,60.0,,,8.88,11598,1027.46
5612.0,2024-02-20 22:00,London,Winter,10.3,,7.08,Clear,,9179,
5613.0,Unknown,London,Winter,3.57,,,Snow,70.44,11724,1114.2348620929886
5614.0,,London,Autumn,66.04089777844322,67.0,0.0,Clear,24.54,49984.42442375398,986.29
5615.0,2024-02-21 04:00,London,Winter,-2.4,69.0,3.61,Snow,,90,999.36
5616.0,2024-02-21 06:00,London,Winter,-3.23,,17.93,Rain,45.01,2400,984.36
5617.0,2024-02-21T08:00Z,London,Winter,,78.0,12.22,,15.12,10490,1004.1
5618.0,2024-02-21T10:00Z,London,,3.19,88.0,51.2,Storm,199.81038230902078,,973.07
5619.0,21/02/2024 12PM,London,Winter,14.91,,11.02,Clear,18.29,9136,1016.19
,21/02/2024 02PM,London,Winter,9.02,,18.74,Rain,39.84,8169,1015.69
5621.0,2024-02-21T16:00Z,London,Winter,11.56,,0.46,Fog,,2303,
,,London,Autumn,83.47214950593477,50.0,0.0,Clear,67.31,49984.850030565605,1002.81
5623.0,21/02/2024 08PM,London,,28.96,59.0,0.0,,51.78,8691,1106.3931605250466
5624.0,2024-02-21T22:00Z,London,Winter,8.47,72.0,0.0,Clear,49.42,8983,1018.45
5625.0,2024-02-22 00:00,London,Winter,14.25,51.0,0.0,Clear,,120021.20848720305,1006.23
5626.0,2024-02-22T02:00Z,London,Winter,1.62,86.0,0.0,Clear,19.19,9609,1021.08
5627.0,2024-02-22 04:00,London,Winter,5.71,79.0,5.78,Fog,29.7,994,1029.23
5628.0,22/02/2024 06AM,London,Winter,-3.95,74.0,0.0,Snow,,8925,1006.4
5629.0,,London,,27.98,66.0,0.0,Clear,36.85,49991.070395329014,
5630.0,2024-02-22 10:00,London,Winter,4.06,60.0,223.12500938087555,Snow,,120012.09612337059,985.87
5631.0,2024-02-22 12:00,London,Winter,-2.53,73.0,,Snow,27.67,6282,1014.09
5632.0,2024-02-22 14:00,London,Winter,-1.98,54.0,0.0,Snow,37.89,,992.9
5633.0,22/02/2024 04PM,London,Winter,5.11,-31.882967808103018,0.0,Clear,44.29,,1024.36
5634.0,22/02/2024 06PM,London,Winter,1.49,53.0,0.0,Snow,190.18570488170477,11033,1026.67
5635.0,2024-02-22T20:00Z,London,Winter,-34.17209679315074,86.0,55.34,Storm,59.46,,987.39
5636.0,2024-02-22T22:00Z,London,,,,,Clear,372.9577998953369,8069,1013.05
5637.0,,London,Winter,-4.64,,98.5200191292512,Storm,69.42,5018,982.21
,2024-02-23T02:00Z,London,Winter,4.5,80.0,0.0,Snow,7.34,11217,973.38
5639.0,23/02/2024 04AM,London,Winter,4.12,-10.7957606462273,0.0,Clear,23.82,120009.641423056,1100.8256562097097
5640.0,2024-02-23 06:00,London,Winter,0.45,69.0,0.0,Clear,16.47,8734,1011.16
5641.0,23/02/2024 08AM,London,Winter,7.42,61.0,10.2,Clear,75.37,120015.29966781313,1027.12
5642.0,23/02/2024 10AM,London,Winter,6.5,41.0,0.0,Clear,3.82,9953,1013.02
5643.0,2024-02-23 12:00,London,Winter,-4.84,-13.489468343791145,0.0,Clear,22.97,11278,
5644.0,2024-02-23 14:00,London,Winter,6.33,87.0,0.0,Clear,31.48,9354,1023.58
5645.0,2024-02-23T16:00Z,London,,21.17,61.0,,Clear,14.69,49982.750684294384,1000.6
5646.0,23/02/2024 06PM,,Winter,11.02,174.71441457970826,0.0,Clear,60.26,8367,1007.53
,,London,Spring,,40.0,0.0,Clear,60.13,8814,
5648.0,2024-02-23 22:00,London,Winter,-0.41,69.0,13.61,Rain,62.07,8710,986.46
5649.0,2024-02-24 00:00,London,Winter,14.02,58.0,0.0,Clear,179.07610665217263,49985.98366525291,1006.54
5650.0,24/02/2024 02AM,London,Winter,1.42,90.0,28.46,Snow,35.26,8736,1015.16
5651.0,2024-02-24T04:00Z,London,Winter,-0.02,,1.69,Clear,27.73,,1034.2
5652.0,2024-02-24T06:00Z,London,Winter,14.43,51.0,0.0,Clear,14.04,9023,996.54
5653.0,24/02/2024 08AM,London,Winter,12.58,,10.79,Rain,362.96412339417185,,
,24/02/2024 10AM,London,Winter,13.08,53.0,0.0,Clear,36.19,11735,1006.73
5655.0,2024-02-24T12:00Z,London,Winter,-1.85,60.0,0.0,Snow,56.09,4347,
5656.0,2024-02-24T14:00Z,London,,6.14,171.29169140960863,204.41950556831503,Rain,6.1,431,
5657.0,2024-02-24T16:00Z,London,Winter,14.78,154.44153408892774,0.0,Clear,66.55,10612,1005.97
5658.0,2024-02-24T18:00Z,,Winter,9.3,,81.32339111192105,Rain,38.85,4858,1006.43
5659.0,2024-02-24T20:00Z,London,Winter,-4.6,,0.11,Clear,176.1603313175286,11630,1028.39
5660.0,2024-02-24 22:00,London,Winter,-37.5623381077879,69.0,0.0,Clear,40.13,8834,877.8511179393665
5661.0,25/02/2024 12AM,,Winter,-0.04,-31.1236864954561,0.0,Clear,53.84,11677,892.7061768132999
5662.0,25/02/2024 02AM,London,,1.3,94.0,0.0,Clear,6.0,8478,994.43
5663.0,25/02/2024 04AM,London,Winter,78.29710829084279,64.0,0.0,Clear,180.10350043103992,11649,988.94
5664.0,2024-02-25 06:00,London,Winter,3.9,79.0,90.46839725158313,Storm,20.39,5170,970.75
,2024-02-25T08:00Z,London,Winter,-2.86,-34.75309189551785,0.0,,77.19,9632,1015.87
5666.0,2024-02-25T10:00Z,London,Winter,-2.91,74.0,91.66893229164248,Snow,37.9,120011.17695472916,972.2
5667.0,2024-02-25T12:00Z,London,Winter,13.22,46.0,0.0,Clear,67.57,10058,1026.49
5668.0,2024-02-25 14:00,London,Winter,3.55,54.0,0.0,Clear,31.47,11696,
5669.0,25/02/2024 04PM,London,Winter,4.55,51.0,,Snow,51.8,9243,
5670.0,2024-02-25 18:00,London,,4.12,33.0,,Fog,373.23239291405883,4795,1000.83
5671.0,25/02/2024 08PM,London,Winter,6.69,62.0,2.62,Clear,4.38,,1007.93
,2024-02-25 22:00,London,Winter,9.64,90.0,0.0,Clear,20.8,8947,998.89
5673.0,2024-02-26 00:00,London,Winter,7.02,72.0,211.99797551022937,Storm,51.88,11795,967.72
5674.0,26/02/2024 02AM,London,Winter,9.7,50.0,0.0,Clear,65.09,9540,1028.87
5675.0,,London,Summer,24.44,63.0,0.0,Clear,72.37,11841,1014.77
,2024-02-26 06:00,,Winter,11.48,85.0,46.28,Rain,5.72,10585,1006.09
5677.0,2024-02-26T08:00Z,London,Winter,,57.0,0.0,Clear,,120008.54297536462,1011.46
,2024-02-26 10:00,London,Winter,,90.0,0.0,Clear,,10294,1013.41
5679.0,2024-02-26T12:00Z,London,,,60.0,11.42,,76.68,9259,1003.98
5680.0,2024-02-26T14:00Z,London,Winter,-33.017009769449196,85.0,0.0,Clear,60.6,9428,1022.73
5681.0,2024-02-26T16:00Z,London,Winter,,80.0,55.55,Storm,117.34,8174,889.8625335510493
5682.0,2024-02-26 18:00,London,Winter,,,17.87,Clear,71.33,9227,
5683.0,,London,Spring,8.13,36.0,0.0,Clear,18.39,,1009.81
5684.0,2024-02-26T22:00Z,London,Winter,-1.54,79.0,0.0,Clear,66.51,11464,1120.1511024595789
5685.0,27/02/2024 12AM,London,Winter,-4.3,72.0,0.0,Clear,40.96,9945,1003.77
5686.0,2024-02-27 02:00,London,Winter,69.89745000996446,,5.24,Clear,48.9,8029,980.79
5687.0,2024-02-27 04:00,London,Winter,10.62,43.0,0.0,Clear,11.54,???,1000.23
,27/02/2024 06AM,London,Winter,-4.72,83.0,84.56429774422952,Storm,119.97,5870,885.2317539897629
5689.0,,London,Winter,-2.27,,79.00619266434092,,40.75,8760,1010.16
5690.0,27/02/2024 10AM,London,Winter,11.15,40.0,0.0,Clear,18.05,8539,880.366845784964
5691.0,2024-02-27T12:00Z,London,Winter,1.1,70.0,10.44,Snow,10.44,6547,
,2024-02-27T14:00Z,London,Winter,-1.59,88.0,0.0,Clear,72.66,9553,1020.01
5693.0,2024-02-27T16:00Z,London,,16.94,99.0,93.42442634070285,Rain,75.39,252,988.07
5694.0,2024-02-27T18:00Z,London,Winter,,44.0,0.0,Clear,69.3,,990.73
5695.0,2024-02-27 20:00,London,Winter,-4.93,76.0,221.25986816218966,Rain,11.11,7335,991.68
,2024-02-27T22:00Z,London,Winter,-40.08186902554042,77.0,,Snow,25.47,7219,997.65
5697.0,28/02/2024 12AM,London,,9.65,52.0,0.0,Clear,356.67491403990135,N/A,993.66
,28/02/2024 02AM,London,Winter,12.81,72.0,0.0,Clear,28.68,11811,990.7
5699.0,2024-02-28T04:00Z,London,Winter,,51.0,,Fog,2.54,1698,896.9744674387645
5700.0,2024-02-28T06:00Z,London,Winter,-2.5,,14.71,Clear,77.88,11585,1005.77
5701.0,2024-02-28 08:00,London,,7.1,100.0,0.0,Clear,363.36895137449295,8415,1008.35
5702.0,2024-02-28T10:00Z,London,Winter,13.64,,18.53,Rain,40.85,2307,1001.05
5703.0,2024-02-28 12:00,,Winter,,86.0,0.0,,63.25,9459,892.2739094638102
5704.0,2024-02-28T14:00Z,,Winter,-1.09,69.0,0.0,Clear,69.95,10116,1021.47
,2024-02-28 16:00,London,Winter,-1.78,,,Clear,,10034,
5706.0,2024-02-28 18:00,London,Winter,11.56,,5.96,Clear,55.19,,1019.97
5707.0,28/02/2024 08PM,London,Winter,62.4630543928285,80.0,0.0,,76.66,120013.95279272059,
5708.0,2024-02-28T22:00Z,London,Winter,3.31,72.0,0.0,Clear,47.05,8494,1113.991454963254
5709.0,2024-02-29 00:00,London,Winter,2.33,-28.577670926390276,0.0,Snow,14.9,6479,1117.056006506577
5710.0,29/02/2024 02AM,London,Winter,-52.11399807804645,59.0,205.43964043215382,Rain,61.35,10539,882.5356943370541
5711.0,2024-02-29 04:00,London,Winter,,70.0,0.0,Clear,63.54,9351,993.74
5712.0,29/02/2024 06AM,London,Winter,5.11,47.0,0.0,Clear,,,999.37
5713.0,29/02/2024 08AM,London,Winter,10.25,,5.91,Fog,33.83,120003.06257612289,1000.54
,2024-02-29 10:00,London,Winter,,51.0,96.16690395852879,Rain,12.96,2208,977.29
5715.0,2024-02-29 12:00,London,Winter,12.19,53.0,0.0,Clear,48.3,,1025.84
5716.0,2024-02-29T14:00Z,London,Winter,8.88,167.18260413498177,0.0,Clear,6.7,,997.67
5717.0,29/02/2024 04PM,London,Winter,,85.0,0.0,Clear,68.83,49998.59232355719,994.13
5718.0,2024-02-29T18:00Z,London,Winter,-39.58029778990133,47.0,0.0,Snow,8.29,1242,1122.2620860237892
5719.0,29/02/2024 08PM,London,Winter,4.01,,18.48,Clear,23.3,8751,1013.1
5720.0,29/02/2024 10PM,London,Winter,-4.89,87.0,20.94,Rain,48.29,,
5721.0,2024-03-01 00:00,,Spring,11.79,59.0,0.0,Clear,21.18,unknown,1124.8429327017418
5722.0,2024-03-01 02:00,London,Spring,13.48,32.0,0.0,Clear,,10344,996.93
5723.0,2024-03-01 04:00,,,24.29,,12.36,Rain,364.52238159334166,10555,1001.75
5724.0,01/03/2024 06AM,London,Winter,15.0,90.0,50.59,Storm,199.17452139713112,3276,987.35
5725.0,2024-03-01 08:00,,Spring,,53.0,0.0,Clear,25.48,9031,1103.0116381959187
5726.0,2024-03-01T10:00Z,London,Spring,9.03,42.0,0.0,Clear,194.29732619590573,9226,1010.7
5727.0,2024-03-01 12:00,London,Spring,,64.0,0.0,Clear,8.76,???,1015.36
5728.0,2024-03-01T14:00Z,London,Spring,6.43,40.0,0.0,Clear,70.67,11011,1019.55
5729.0,01/03/2024 04PM,London,,15.24,94.0,0.0,Clear,29.86,8707,1020.2
5730.0,01/03/2024 06PM,,Winter,-1.23,154.23817649351784,,Snow,33.4,7807,1000.61
,,London,Winter,-0.09,51.0,,Fog,,9312,1036.94
5732.0,01/03/2024 10PM,London,Winter,,60.0,2.26,Clear,16.45,8050,1000.36
,02/03/2024 12AM,London,Winter,0.75,51.0,0.0,Clear,60.16,10475,991.8
5734.0,2024-03-02T02:00Z,London,,2.6,92.0,71.75,Snow,6.22,10052,974.16
5735.0,2024-03-02 04:00,London,Spring,9.21,57.0,0.0,,27.11,9973,993.65
5736.0,2024-03-02 06:00,London,Spring,13.0,49.0,,Clear,76.49,,1020.1
5737.0,02/03/2024 08AM,London,Winter,10.1,,7.46,Clear,11.93,120008.36303756405,1015.99
5738.0,,London,Winter,-0.04,,9.66,Fog,71.01,4894,1031.04
5739.0,2024-03-02 12:00,London,Spring,13.97,78.0,0.0,Clear,69.48,11038,1015.51
5740.0,2024-03-02 14:00,London,,19.44,29.0,,Fog,67.11,49995.23961256821,1020.67
5741.0,2024-03-02 16:00,London,Spring,11.28,43.0,223.05137440675418,Rain,20.99,6627,997.73
5742.0,02/03/2024 06PM,London,Winter,-50.50919438460667,,5.17,Clear,41.01,8222,
5743.0,2024-03-02 20:00,London,Spring,14.61,51.0,0.0,Clear,8.24,11772,1024.0
5744.0,,London,Spring,,31.0,0.0,Clear,5.25,11874,1024.8
5745.0,2024-03-03 00:00,London,Spring,14.9,41.0,,Clear,47.39,11516,1006.25
5746.0,2024-03-03 02:00,London,Spring,17.07,73.0,5.56,Clear,26.72,49993.65946674631,1027.22
5747.0,,London,Spring,11.88,47.0,0.0,Clear,,9202,1023.78
5748.0,03/03/2024 06AM,London,,15.98,55.0,0.0,Clear,70.17,10936,999.95
5749.0,2024-03-03 08:00,London,,12.1,87.0,50.7,Rain,,2358,985.89
5750.0,03/03/2024 10AM,London,Spring,18.63,39.0,0.0,Clear,25.65,10277,1008.04
,2024-03-03T12:00Z,London,Spring,18.0,-21.80299506596557,,Clear,2.35,10696,995.87
5752.0,2024-03-03T14:00Z,London,,,58.0,0.0,Clear,50.85,10212,1016.85
5753.0,2024-03-03 16:00,,Spring,-46.579159566825105,66.0,0.0,Clear,49.64,11388,1109.2505392436494
5754.0,2024-03-03 18:00,London,,18.47,75.0,11.7,Clear,0.54,8493,1028.57
5755.0,2024-03-03 20:00,,Spring,68.74029641265233,35.0,,Fog,59.54,49979.596212284705,1019.85
5756.0,,London,Autumn,,50.0,0.0,Clear,62.91,11495,1009.33
5757.0,04/03/2024 12AM,,Spring,5.56,52.0,,Clear,66.81,10740,994.68
,2024-03-04T02:00Z,London,Spring,5.19,37.0,0.0,Clear,,10789,1020.76
,2024-03-04T04:00Z,London,Spring,9.18,72.0,5.5,Fog,34.99,49999.63634078734,1024.0
5760.0,2024-03-04 06:00,London,Spring,,152.93711174269862,68.74,Rain,6.31,3746,1009.1
5761.0,04/03/2024 08AM,London,Spring,-32.37540426284377,60.0,0.0,,42.55,11667,
5762.0,04/03/2024 10AM,London,Spring,17.06,56.0,0.0,,351.8418110422535,error,1007.94
5763.0,04/03/2024 12PM,London,Spring,8.58,38.0,,,179.12272011091974,8118,1014.33
5764.0,04/03/2024 02PM,London,Spring,17.86,,17.26,Clear,52.93,11898,1019.89
5765.0,2024-03-04 16:00,London,Spring,6.81,70.0,0.0,Clear,32.49,8611,992.09
,04/03/2024 06PM,London,Spring,11.35,70.0,,,,10782,1006.93
5767.0,04/03/2024 08PM,London,Spring,6.13,,7.51,,64.93,8222,1012.91
5768.0,04/03/2024 10PM,London,Spring,17.71,51.0,0.0,Clear,39.59,120001.22940070406,999.72
5769.0,2024-03-05 00:00,London,Spring,,53.0,0.0,Clear,48.3,10316,1000.36
,05/03/2024 02AM,London,Spring,11.9,41.0,0.0,Clear,17.91,8559,1013.01
5771.0,2024-03-05 04:00,London,Spring,8.19,68.0,0.0,Clear,68.96,11672,1007.7
,,London,Autumn,24.69,99.0,0.0,Clear,,,1005.94
5773.0,TBD,London,Spring,5.52,62.0,92.70148599473967,Storm,132.4,2128,970.32
5774.0,05/03/2024 10AM,London,Spring,19.16,56.0,0.0,Clear,46.9,10863,1019.94
5775.0,2024-03-05T12:00Z,London,Spring,5.52,-17.444993629970458,0.0,Clear,23.73,9053,994.03
5776.0,2024-03-05T14:00Z,London,Spring,14.24,154.56131243799925,0.0,Clear,15.45,11846,1025.58
5777.0,2024-03-05 16:00,London,Spring,12.9,58.0,0.0,Clear,,10858,1004.8
,05/03/2024 06PM,London,Spring,9.87,47.0,0.0,Clear,0.3,,1011.72
5779.0,Unknown,London,Summer,27.11,51.0,0.0,Clear,71.08,,992.09
5780.0,2024-03-05 22:00,London,,2.14,33.0,0.0,Clear,37.78,8826,1011.38
5781.0,2024-03-06 00:00,,Spring,,69.0,,Clear,,,1000.76
5782.0,2024-03-06T02:00Z,London,Spring,17.32,47.0,0.0,Clear,176.055933994062,9546,
5783.0,2024-03-06T04:00Z,London,,10.1,25.0,206.27436642912494,Rain,64.11,5264,893.602544523779
5784.0,2024-03-06T06:00Z,London,Spring,78.44535195591018,73.0,8.31,Fog,41.6,480,988.79
5785.0,2024-03-06T08:00Z,London,Spring,11.89,63.0,0.0,Clear,47.23,120023.08307343973,993.61
5786.0,06/03/2024 10AM,London,Summer,23.72,29.0,0.0,Clear,,8701,1119.0727565397497
5787.0,2024-03-06T12:00Z,London,,26.66,77.0,12.07,Rain,79.11,513,983.51
5788.0,2024-03-06T14:00Z,London,Spring,17.4,62.0,76.98183900694133,Storm,,7613,979.35
5789.0,2024-03-06 16:00,London,Spring,18.73,-23.632960135836825,0.0,Clear,31.01,10893,1007.47
5790.0,06/03/2024 06PM,London,Summer,25.35,34.0,0.0,Clear,35.38,10695,
5791.0,2024-03-06 20:00,London,Spring,12.87,77.0,0.0,Clear,,,1026.79
5792.0,2024-03-06 22:00,London,Spring,11.66,,0.75,Fog,43.02,9093,1000.54
5793.0,07/03/2024 12AM,London,Summer,-31.559206818283993,50.0,0.0,Snow,29.28,8956,1029.69
5794.0,07/03/2024 02AM,London,Summer,,67.0,0.0,Clear,31.12,11255,1000.18
5795.0,,London,Autumn,23.64,54.0,0.0,,53.15,11861,999.12
5796.0,2024-03-07T06:00Z,London,Spring,8.05,31.0,0.0,Clear,23.09,49999.04357993095,1028.77
5797.0,2024-03-07 08:00,,Spring,10.66,54.0,,Fog,73.22,919,1017.96
5798.0,2024-03-07T10:00Z,London,Spring,8.31,,2.99,Clear,2.15,8256,1026.32
5799.0,2024-03-07T12:00Z,London,Spring,6.92,80.0,0.0,Clear,60.63,11484,896.4578749553759
5800.0,2024-03-07T14:00Z,London,Spring,15.93,80.0,0.0,Clear,14.45,???,992.64
,07/03/2024 04PM,London,Summer,-35.458308087967296,53.0,0.0,Clear,46.65,49992.45912666029,1113.3978388235762
5802.0,2024-03-07 18:00,London,Spring,11.5,,76.13343291266625,Rain,24.1,8009,1007.44
5803.0,,London,Spring,7.78,71.0,0.0,Clear,178.8350634327733,8422,
5804.0,2024-03-07 22:00,London,Spring,6.93,32.0,0.0,Clear,3.78,10716,1024.01
5805.0,2024-03-08 00:00,London,Spring,7.72,80.0,0.0,Clear,26.66,11164,887.7999706994832
5806.0,2024-03-08T02:00Z,London,Spring,16.26,45.0,0.0,Clear,66.43,10819,1028.39
5807.0,08/03/2024 04AM,London,Summer,,46.0,0.0,Clear,32.35,9808,1026.95
5808.0,2024-03-08T06:00Z,London,Spring,6.91,65.0,3.84,Fog,47.39,10858,1019.8
5809.0,2024-03-08T08:00Z,London,Spring,8.7,36.0,0.0,Clear,49.27,8316,
5810.0,2024-03-08T10:00Z,London,,0.69,169.37538847887845,0.0,Clear,359.664937245085,8539,1005.93
5811.0,2024-03-08T12:00Z,London,Spring,13.67,74.0,12.42,Clear,64.52,11361,1016.6
5812.0,08/03/2024 02PM,London,,,90.0,202.68590434823338,,32.11,120004.86718550816,1028.88
,2024-03-08T16:00Z,London,Spring,9.22,74.0,0.0,Clear,5.91,8042,
5814.0,2024-03-08 18:00,London,,15.89,73.0,221.90427549571626,Storm,20.63,1490,978.53
5815.0,2024-03-08T20:00Z,London,,62.160260042308956,46.0,223.15557074688297,Rain,37.11,49988.34044252697,977.32
5816.0,2024-03-08T22:00Z,London,Spring,,,18.36,Rain,9.77,49998.002031508,991.14
5817.0,2024-03-09 00:00,London,Spring,14.84,30.0,0.0,Clear,37.32,10153,1005.62
,09/03/2024 02AM,London,Autumn,19.02,92.0,0.0,Clear,,9655,
5819.0,09/03/2024 04AM,London,Autumn,24.74,76.0,0.0,Clear,0.41,10217,1029.53
5820.0,2024-03-09 06:00,London,Spring,6.83,38.0,0.0,Clear,42.88,9466,893.1572472213412
5821.0,2024-03-09 08:00,London,Spring,79.35758317157972,79.0,10.0,Rain,23.14,10452,1102.5581666495762
5822.0,2024-03-09 10:00,London,Spring,6.89,36.0,0.0,Clear,58.62,10627,883.6088218721975
5823.0,2024-03-09 12:00,London,Spring,6.73,72.0,0.0,Clear,32.2,9323,1021.37
5824.0,2024-03-09T14:00Z,London,,12.57,26.0,0.0,Clear,183.28898650042314,11097,991.73
,,,Winter,-43.02723424082883,79.0,0.0,Clear,14.43,10766,1036.04
5826.0,2024-03-09T18:00Z,London,Spring,9.96,68.0,0.0,Clear,30.73,8664,992.46
5827.0,2024-03-09T20:00Z,London,Spring,83.0405646954533,54.0,0.0,Clear,14.71,49978.92435781662,985.24
5828.0,09/03/2024 10PM,,Autumn,23.0,50.0,0.0,Clear,9.69,10177,990.3
5829.0,2024-03-10T00:00Z,London,Spring,,154.59517812519022,96.04215870434642,Rain,39.38,10373,992.66
,10/03/2024 02AM,London,Autumn,,71.0,215.37346864039233,Storm,52.41,3822,970.48
5831.0,,London,Winter,7.5,83.0,,Fog,16.36,,995.52
5832.0,,London,Summer,,67.0,0.0,Clear,55.75,8586,1016.35
5833.0,2024-03-10T08:00Z,London,Spring,14.89,,19.71,,,9446,1001.71
5834.0,2024-03-10 10:00,London,Spring,9.74,45.0,0.0,Clear,49.09,9202,1001.15
5835.0,2024-03-10T12:00Z,London,,12.4,61.0,0.0,Clear,61.27,8734,894.4406541465802
5836.0,2024-03-10T14:00Z,London,Spring,,39.0,0.0,Clear,74.79,error,1008.55
5837.0,,London,Spring,-37.984142593876285,39.0,0.0,Clear,,9999,1000.47
5838.0,2024-03-10T18:00Z,London,,2.02,151.22525894853123,0.0,Snow,61.86,,1007.76
5839.0,,London,Summer,16.33,58.0,0.0,Clear,66.72,,
5840.0,2099-13-40 25:61,London,Summer,21.88,64.0,218.34370969041643,Rain,,4153,992.27
,11/03/2024 12AM,London,,1.26,71.0,2.54,,369.7577455848264,10483,1018.13
5842.0,11/03/2024 02AM,London,Autumn,80.66504356108689,72.0,3.79,Clear,69.19,8776,982.68
5843.0,2024-03-11 04:00,London,Spring,13.9,40.0,217.509977050494,Storm,62.76,8026,974.39
5844.0,,London,Summer,27.75,53.0,0.0,Clear,37.37,10311,895.7162846296579
5845.0,11/03/2024 08AM,London,Autumn,24.0,82.0,0.0,Clear,,120017.90819966375,997.74
5846.0,2024-03-11T10:00Z,London,Spring,,69.0,0.0,Clear,37.98,11161,1117.0315359491162
5847.0,2024-03-11 12:00,,Spring,7.42,38.0,0.0,Clear,16.02,8311,892.3319861822788
5848.0,11/03/2024 02PM,London,Autumn,,-17.279020393490036,,Clear,27.89,9919,1024.54
5849.0,11/03/2024 04PM,London,,5.61,-28.938350496757927,0.0,Clear,68.25,11590,1027.99
5850.0,2024-03-11 18:00,,Spring,8.96,76.0,12.35,,193.6570741938409,120006.99508398928,1009.82
5851.0,2024-03-11T20:00Z,London,Spring,18.48,54.0,0.0,,4.66,,
5852.0,2024-03-11 22:00,,Spring,19.23,34.0,0.0,Clear,49.73,10594,999.7
5853.0,2024-03-12 00:00,London,Spring,14.53,78.0,0.0,Clear,69.75,,1003.95
5854.0,12/03/2024 02AM,London,Winter,3.96,46.0,0.0,Clear,79.9,unknown,1009.16
5855.0,2024-03-12T04:00Z,,Spring,11.14,,14.57,Clear,32.12,9818,990.45
5856.0,12/03/2024 06AM,London,Winter,7.82,-20.406698986545674,0.0,Clear,49.8,10470,991.0
5857.0,2024-03-12 08:00,London,Spring,19.12,36.0,0.0,Clear,5.6,9443,
5858.0,,,Summer,10.11,58.0,0.0,Clear,,8068,990.72
5859.0,12/03/2024 12PM,London,,8.26,71.0,3.54,Clear,176.04619320736083,49981.54198076306,1005.4
5860.0,12/03/2024 02PM,London,Winter,72.37045356708198,45.0,0.0,Clear,29.4,8203,999.72
5861.0,,London,Autumn,22.93,76.0,11.47,Rain,18.29,4411,
5862.0,,,Summer,29.33,59.0,0.0,Clear,58.3,8129,
5863.0,12/03/2024 08PM,London,Winter,-50.69461663854011,78.0,0.0,Clear,77.77,10731,
,,London,Spring,14.54,72.0,0.0,Clear,37.12,8952,1014.82
5865.0,2024-03-13 00:00,London,Spring,13.64,55.0,0.0,Clear,54.05,49980.58611127148,1018.6
5866.0,2024-03-13 02:00,London,Spring,14.39,35.0,0.0,Clear,54.74,9711,1023.81
5867.0,2024-03-13 04:00,London,Spring,17.46,76.0,0.0,Clear,2.3,10682,1013.57
5868.0,2024-03-13 06:00,London,Spring,,,6.71,Clear,10.0,10771,1028.09
5869.0,2024-03-13 08:00,,Spring,19.04,33.0,0.0,,54.36,9008,1020.68
5870.0,13/03/2024 10AM,London,Spring,,75.0,0.0,Clear,70.93,10397,1015.7
5871.0,13/03/2024 12PM,London,Spring,,58.0,0.0,Clear,355.71470033751746,10431,1026.0
5872.0,2024-03-13 14:00,London,Spring,15.24,48.0,0.0,Clear,15.72,120009.43209319234,999.76
5873.0,13/03/2024 04PM,,Spring,9.74,33.0,0.0,Clear,16.46,9218,1018.94
5874.0,2024-03-13T18:00Z,London,Spring,6.08,45.0,0.0,Clear,7.88,8966,
5875.0,2024-03-13T20:00Z,London,Spring,5.14,161.97210289358296,214.81277415648677,Storm,101.16,49981.03610468451,976.01
5876.0,,London,Winter,-38.935446049285645,63.0,0.0,Snow,193.35903873375716,7144,993.25
5877.0,2024-03-14 00:00,,Spring,11.88,63.0,0.0,Clear,74.21,8281,1025.43
5878.0,,London,Autumn,6.94,56.0,0.0,Clear,58.97,8111,1005.08
5879.0,14/03/2024 04AM,London,Spring,72.16053379381287,71.0,99.38823956644627,Storm,69.84,,878.2070619079402
5880.0,2024-03-14T06:00Z,London,Spring,16.59,60.0,0.0,Clear,66.61,10557,1027.19
5881.0,14/03/2024 08AM,London,Spring,16.07,36.0,80.28148294088292,Rain,,4776,1022.95
5882.0,2024-03-14T10:00Z,London,,25.18,95.0,47.13,Rain,16.57,6597,982.7
5883.0,14/03/2024 12PM,London,,25.44,27.0,0.0,Clear,62.12,11963,1013.91
5884.0,2024-03-14T14:00Z,London,Spring,7.18,51.0,218.49416665439608,,59.12,10021,1026.18
5885.0,2024-03-14 16:00,London,Spring,13.57,43.0,,Fog,4.22,7036,991.85
,14/03/2024 06PM,London,Spring,15.94,68.0,0.0,Clear,75.66,8272,1014.87
,2024-03-14T20:00Z,London,Spring,5.17,71.0,0.0,Clear,63.35,10759,999.39
5888.0,14/03/2024 10PM,London,Spring,16.41,39.0,0.0,Clear,360.9804562127875,8372,
5889.0,15/03/2024 12AM,London,Spring,15.6,50.0,0.0,,354.4770854312076,,997.99
5890.0,2024-03-15 02:00,London,Spring,12.2,72.0,3.35,,20.0,11090,1023.43
5891.0,2024-03-15 04:00,London,Spring,15.1,56.0,0.0,Clear,19.05,11021,1014.49
5892.0,15/03/2024 06AM,London,Spring,10.76,51.0,0.0,,68.96,11700,1029.55
5893.0,2024-03-15 08:00,London,Spring,14.08,,,Fog,,5509,1027.38
,15/03/2024 10AM,London,Spring,,74.0,221.37787592284946,Storm,50.79,11872,971.52
5895.0,2024-03-15 12:00,London,Spring,14.93,73.0,14.52,Rain,1.49,11201,1011.27
5896.0,2024-03-15T14:00Z,London,Spring,15.55,58.0,0.0,Clear,54.6,10009,1005.06
,2024-03-15 16:00,London,Spring,8.67,33.0,0.0,Clear,6.77,10249,993.36
5898.0,15/03/2024 06PM,,Spring,15.62,78.0,,Clear,17.25,9057,1005.1
5899.0,2024-03-15 20:00,London,Spring,11.33,33.0,0.0,Clear,28.59,11646,1005.7
5900.0,2024-03-15T22:00Z,London,Spring,16.75,69.0,4.99,Fog,35.69,821,1008.63
5901.0,16/03/2024 12AM,London,Spring,9.62,169.16326828444323,92.94067938747095,,32.72,11050,999.77
5902.0,2024-03-16 02:00,London,Spring,6.95,70.0,,,,11337,
5903.0,2024-03-16T04:00Z,London,Spring,-32.83171342345298,77.0,6.97,Clear,61.13,???,1026.85
5904.0,2024-03-16T06:00Z,London,Spring,11.06,31.0,0.0,Clear,18.52,9731,1002.62
5905.0,2024-03-16 08:00,London,Spring,-54.1942120141672,58.0,,Fog,36.42,error,1000.67
5906.0,16/03/2024 10AM,London,Spring,19.88,74.0,0.0,Clear,16.3,10761,1010.56
5907.0,2024-03-16 12:00,London,Spring,19.03,40.0,0.0,Clear,49.59,,996.83
5908.0,2024-03-16 14:00,London,Spring,14.31,36.0,0.0,Clear,179.90195005396703,11547,1018.14
,16/03/2024 04PM,,Spring,,67.0,5.4,Clear,23.66,11615,1023.96
5910.0,2024-03-16 18:00,London,Spring,-30.00458957850945,53.0,0.0,Clear,34.57,9243,
5911.0,16/03/2024 08PM,London,,78.34356427261446,73.0,0.0,Clear,1.38,10976,1006.57
5912.0,2024-03-16 22:00,London,,24.32,41.0,0.0,Clear,2.44,11819,990.44
5913.0,2024-03-17T00:00Z,London,Spring,,,19.2,Rain,39.47,49997.52418933757,
5914.0,,London,,16.57,43.0,0.0,Clear,36.09,,1010.11
5915.0,,London,Autumn,21.82,82.0,0.0,Clear,55.78,8303,992.1
5916.0,2024-03-17 06:00,London,Spring,-34.23230350220172,78.0,0.0,Snow,60.79,10989,993.97
5917.0,17/03/2024 08AM,London,Spring,13.41,77.0,8.9,Fog,64.63,7309,1005.2
,2024-03-17T10:00Z,London,Spring,7.38,30.0,0.0,Clear,34.94,9220,1009.4
5919.0,2024-03-17T12:00Z,London,Spring,16.01,,7.15,Fog,54.69,9124,
5920.0,2024-03-17 14:00,,Spring,6.8,69.0,0.0,Clear,5.76,8457,1013.95
,17/03/2024 04PM,,Spring,5.92,164.39017997596412,74.54,Rain,17.2,6148,981.54
5922.0,17/03/2024 06PM,London,,25.63,50.0,0.0,Clear,74.28,9413,1005.72
5923.0,17/03/2024 08PM,,Spring,7.04,55.0,0.0,Clear,55.27,9820,996.14
5924.0,17/03/2024 10PM,London,Spring,17.75,,9.94,,12.7,9518,
5925.0,18/03/2024 12AM,London,,23.44,,9.67,Fog,63.48,989,1010.8
5926.0,18/03/2024 02AM,London,Spring,10.69,-16.86789516121949,0.0,Clear,17.81,8417,1012.55
5927.0,2024-03-18 04:00,London,Spring,15.41,43.0,,Clear,75.98,11139,1106.5603736218502
5928.0,2024-03-18T06:00Z,,Spring,8.35,,10.68,Rain,12.13,7350,1010.07
5929.0,2024-03-18 08:00,London,Spring,12.96,37.0,0.0,Clear,,unknown,1029.88
5930.0,18/03/2024 10AM,London,Spring,15.4,52.0,0.0,Clear,75.11,,
5931.0,2024-03-18 12:00,London,Spring,,64.0,0.0,Clear,56.29,11197,1021.66
5932.0,18/03/2024 02PM,London,Spring,18.19,68.0,0.0,Clear,6.83,,896.4317586850166
5933.0,18/03/2024 04PM,London,Spring,9.7,56.0,,Clear,73.13,10575,
5934.0,2024-03-18T18:00Z,,Spring,12.06,79.0,0.0,Clear,8.29,,1015.06
5935.0,18/03/2024 08PM,London,Spring,17.09,69.0,0.0,Clear,21.83,10811,
,2024-03-18T22:00Z,London,Spring,18.82,,11.05,Clear,67.0,10199,
5937.0,2024-03-19 00:00,London,Spring,18.49,64.0,8.11,Fog,,5452,
,2024-03-19T02:00Z,,Spring,81.13888664471834,33.0,0.0,,70.88,9345,997.18
5939.0,2024-03-19T04:00Z,London,Spring,5.31,167.74137835031166,30.89,Rain,,49988.62072939839,981.31
5940.0,19/03/2024 06AM,London,Spring,10.11,38.0,0.0,Clear,40.8,N/A,1011.81
5941.0,2024-03-19 08:00,London,Spring,,49.0,0.0,Clear,9.77,,
5942.0,2024-03-19T10:00Z,London,Spring,18.98,68.0,0.0,Clear,27.63,49998.32148155172,1003.2
5943.0,2024-03-19T12:00Z,London,Spring,10.78,59.0,0.0,Clear,0.75,10687,1021.96
5944.0,19/03/2024 02PM,,,6.77,77.0,0.0,Clear,62.36,8176,1029.33
5945.0,2024-03-19 16:00,London,Spring,81.21775049412179,53.0,0.0,Clear,364.40325853836845,9482,996.73
,2024-03-19T18:00Z,London,Spring,,43.0,0.0,Clear,27.91,10417,1024.62
5947.0,2024-03-19T20:00Z,London,Spring,17.93,58.0,0.0,Clear,66.03,8752,1101.379353170535
5948.0,2024-03-19T22:00Z,London,Spring,16.89,71.0,3.7,Clear,47.15,???,1023.38
5949.0,2024-03-20 00:00,London,Spring,6.96,55.0,0.0,Clear,,11851,1023.12
5950.0,2024-03-20T02:00Z,London,Spring,-46.24841970147834,,4.95,Snow,374.2731938047701,,
5951.0,2024-03-20T04:00Z,London,Spring,19.47,79.0,0.0,Clear,70.84,9030,1012.7
5952.0,20/03/2024 06AM,London,Spring,5.13,65.0,207.80548645900103,,54.49,???,1000.86
,2024-03-20 08:00,London,Spring,11.23,-30.722067839325632,0.0,Clear,4.06,11721,1011.71
5954.0,20/03/2024 10AM,London,Spring,13.33,30.0,0.0,Clear,12.28,10718,
5955.0,20/03/2024 12PM,London,Spring,12.25,-32.021048358010916,0.0,Clear,18.15,11405,997.91
5956.0,2024-03-20T14:00Z,London,Spring,80.0518070914518,35.0,208.35617144228704,Storm,73.18,,959.65
5957.0,20/03/2024 04PM,London,Spring,11.51,78.0,0.0,Clear,71.74,9541,1026.16
5958.0,2024-03-20 18:00,London,Spring,13.57,64.0,7.59,Clear,192.47504293068064,8522,1005.28
5959.0,2024-03-20 20:00,London,Spring,,47.0,83.30219372144127,Storm,,49976.64438328179,974.36
5960.0,2024-03-20 22:00,London,Spring,17.51,50.0,0.0,Clear,74.74,11234,1026.51
5961.0,2024-03-21T00:00Z,London,Spring,61.39005303984954,59.0,0.0,Clear,39.11,10697,991.37
5962.0,,London,Autumn,12.27,64.0,9.04,Clear,53.75,8714,998.9
,,London,Autumn,11.81,160.5775148254309,30.52,Rain,43.1,3655,989.02
5964.0,,London,Summer,27.46,61.0,,Clear,187.76729401215619,11156,1023.78
5965.0,2024-03-21T08:00Z,,Spring,14.17,34.0,0.0,Clear,25.12,9770,1010.6
5966.0,2024-03-21 10:00,London,Spring,17.78,72.0,,Clear,75.16,10486,1022.35
5967.0,2024-03-21T12:00Z,London,Spring,,78.0,4.98,Clear,47.99,8402,1001.24
5968.0,2024-03-21 14:00,London,Spring,,73.0,0.0,Clear,30.54,8656,991.37
5969.0,2024-03-21T16:00Z,London,Spring,17.97,59.0,218.17879355036283,Storm,120.02,9520,
5970.0,21/03/2024 06PM,London,Spring,11.27,51.0,85.77768300574903,Rain,32.17,10686,974.04
,21/03/2024 08PM,,Spring,,61.0,0.0,Clear,,9075,1005.0
5972.0,2024-03-21T22:00Z,London,Spring,82.96006671163467,66.0,0.0,Clear,7.79,9155,1107.2762424542386
5973.0,2024-03-22 00:00,London,Spring,9.17,71.0,0.0,Clear,359.43980275779256,11186,
5974.0,22/03/2024 02AM,London,Spring,17.72,35.0,0.0,Clear,41.33,,1011.69
5975.0,22/03/2024 04AM,London,Spring,13.76,35.0,0.0,Clear,68.44,N/A,1012.21
5976.0,22/03/2024 06AM,London,,,,3.05,Clear,63.04,,
5977.0,2024-03-22 08:00,London,Spring,14.23,54.0,0.0,Clear,44.82,,993.73
5978.0,2024-03-22T10:00Z,,,29.5,49.0,0.0,,175.03408912057515,11304,994.0
5979.0,22/03/2024 12PM,London,Spring,18.66,78.0,0.0,Clear,21.42,9087,1014.54
5980.0,2024-03-22T14:00Z,London,Spring,19.98,70.0,6.39,Fog,75.22,,991.07
5981.0,22/03/2024 04PM,London,,-47.735173003639424,79.0,0.0,Clear,191.2407853168354,8219,1018.74
5982.0,22/03/2024 06PM,London,Spring,13.93,32.0,,Clear,60.71,,1108.916808354517
5983.0,2024-03-22T20:00Z,London,Spring,13.47,51.0,0.0,Clear,2.12,8005,1002.44
5984.0,2024-03-22 22:00,London,Spring,19.36,59.0,0.0,Clear,34.21,10960,1021.71
5985.0,2024-03-23T00:00Z,London,Spring,17.99,59.0,206.03565057245635,Rain,38.53,422,1011.65
5986.0,2024-03-23T02:00Z,London,Spring,7.82,55.0,0.0,Clear,8.13,9477,999.23
5987.0,2024-03-23T04:00Z,,Spring,19.31,50.0,0.0,Clear,,11210,
5988.0,2024-03-23T06:00Z,London,Spring,16.82,70.0,212.79984473063269,Storm,373.75279495299924,2610,973.5
5989.0,23/03/2024 08AM,London,Spring,,,19.83,Rain,6.53,6158,994.33
5990.0,23/03/2024 10AM,London,Spring,5.99,30.0,0.0,Clear,58.73,11685,1015.4
5991.0,23/03/2024 12PM,,Spring,14.37,41.0,0.0,Clear,41.62,10579,1011.69
,2024-03-23 14:00,London,Spring,,,6.68,Clear,72.79,,1026.89
5993.0,2024-03-23 16:00,,Spring,7.68,-26.89997790218891,,Fog,49.54,11263,1004.36
5994.0,2024-03-23 18:00,London,Spring,-49.58571393273044,160.64241307758124,0.0,Snow,75.85,64,1010.93
5995.0,2024-03-23 20:00,,Spring,18.64,32.0,0.0,Clear,35.31,9190,
5996.0,2024-03-23T22:00Z,London,Spring,6.04,69.0,218.26655703172793,Storm,365.4610857932967,,965.95
5997.0,2024-03-24T00:00Z,London,Spring,15.24,42.0,0.0,Clear,45.85,8458,998.84
5998.0,2024-03-24T02:00Z,London,,,22.0,0.0,,43.73,8408,1009.59
5999.0,2024-03-24T04:00Z,London,,,98.0,,Clear,66.92,10852,1029.18
6000.0,24/03/2024 06AM,London,Spring,18.82,75.0,5.76,,8.52,9329,1023.39
6001.0,2024-03-24 08:00,London,Spring,,52.0,,Fog,371.0848663578738,9507,1017.69
6002.0,24/03/2024 10AM,London,Spring,11.67,35.0,0.0,Clear,1.47,8584,
,24/03/2024 12PM,London,Spring,81.95486339714947,40.0,0.0,Clear,356.8073649813433,8532,1015.52
6004.0,24/03/2024 02PM,London,Spring,16.22,78.0,0.0,Clear,74.32,11507,1017.07
6005.0,24/03/2024 04PM,London,Spring,13.41,71.0,4.29,,72.75,10033,1029.21
6006.0,24/03/2024 06PM,London,Spring,8.79,32.0,0.0,Clear,51.22,11148,
6007.0,2024-03-24T20:00Z,London,Spring,14.17,75.0,0.0,Clear,29.11,11776,
6008.0,24/03/2024 10PM,London,Spring,19.33,71.0,0.0,Clear,54.89,unknown,1005.52
6009.0,2024-03-25 00:00,London,Spring,13.82,,203.45611552329672,Rain,12.69,4690,967.41
6010.0,2024-03-25 02:00,London,Spring,9.71,32.0,81.2869113075813,Rain,74.67,8441,995.61
,25/03/2024 04AM,London,Spring,7.31,64.0,0.0,Clear,,9514,1105.306149591821
6012.0,2024-03-25T06:00Z,,Spring,16.9,56.0,,,41.56,9544,1023.41
6013.0,2024-03-25 08:00,London,Spring,,36.0,0.0,Clear,,11474,991.33
6014.0,2024-03-25 10:00,London,Spring,8.57,77.0,0.0,Clear,48.75,49985.44757534603,1025.91
6015.0,2024-03-25 12:00,London,,8.58,89.0,48.33,Rain,55.44,8685,983.62
6016.0,,London,Autumn,21.44,66.0,12.43,Rain,55.59,53,
6017.0,2024-03-25T16:00Z,London,Spring,7.3,33.0,0.0,Clear,57.56,,1010.64
6018.0,,London,Autumn,24.99,73.0,0.0,Clear,60.94,9528,
6019.0,25/03/2024 08PM,London,Spring,5.04,74.0,0.0,Clear,38.36,11387,999.0
6020.0,2024-03-25 22:00,,Spring,62.289769059976145,,9.38,,14.13,10315,1017.21
6021.0,2024-03-26 00:00,London,Spring,10.47,47.0,0.0,Clear,18.41,9848,1020.4
6022.0,2024-03-26T02:00Z,London,,2.5,,15.87,Clear,74.99,11233,1019.66
,26/03/2024 04AM,London,,15.91,78.0,0.0,Clear,40.73,8238,1003.5
6024.0,,London,Autumn,10.17,78.0,222.77610128766568,Rain,76.97,10977,1003.97
6025.0,2024-03-26T08:00Z,London,Spring,19.05,32.0,0.0,Clear,77.42,error,1022.91
6026.0,2024-03-26T10:00Z,London,Spring,17.81,73.0,81.19766524722341,Storm,,49995.01524290891,985.69
6027.0,2024-03-26T12:00Z,London,Spring,9.96,58.0,,Clear,46.5,49990.05167306121,
6028.0,2024-03-26 14:00,London,,4.6,56.0,0.0,Clear,188.85961022289794,10872,992.48
6029.0,2024-03-26 16:00,,Spring,71.23776708462566,45.0,0.0,Clear,73.09,9695,991.93
6030.0,2024-03-26 18:00,London,Spring,15.48,65.0,0.0,Clear,70.56,9643,
6031.0,2024-03-26T20:00Z,London,Spring,6.14,75.0,13.95,Rain,48.46,10181,972.39
6032.0,,London,Spring,83.61613053486408,48.0,0.0,Clear,34.2,9930,875.157304202359
6033.0,27/03/2024 12AM,London,Spring,5.11,44.0,0.0,Clear,50.93,8710,1024.35
6034.0,27/03/2024 02AM,London,Spring,,38.0,0.0,Clear,27.55,9278,991.67
6035.0,2024-03-27T04:00Z,,Spring,8.34,59.0,0.0,Clear,360.53314463005063,11561,1005.64
6036.0,27/03/2024 06AM,London,Spring,8.97,44.0,,Clear,48.18,120022.27919123354,1014.6
6037.0,27/03/2024 08AM,London,Spring,5.36,151.17996190216186,45.82,Rain,39.9,120013.70286061896,1029.81
6038.0,27/03/2024 10AM,London,Spring,14.84,-25.475709854473486,0.0,Clear,46.51,10327,897.413773210447
6039.0,2024-03-27 12:00,London,Spring,10.47,34.0,0.0,Clear,68.26,11860,1011.18
6040.0,2024-03-27 14:00,,Spring,6.39,48.0,94.73729968198259,Storm,56.07,6970,989.04
,2024-03-27T16:00Z,London,Spring,8.5,,200.96962998839047,Rain,,???,983.37
6042.0,2024-03-27 18:00,London,Spring,19.45,62.0,9.41,Clear,34.2,11356,996.03
6043.0,,London,Summer,,54.0,0.0,Clear,28.84,,996.16
6044.0,,London,Spring,11.47,33.0,0.0,,367.2695421702891,8471,1100.754312074187
6045.0,2024-03-28 00:00,,Spring,13.89,34.0,0.0,Clear,39.67,11521,993.01
6046.0,28/03/2024 02AM,London,Spring,6.15,,15.41,,15.04,,1013.75
6047.0,2024-03-28T04:00Z,London,Spring,19.8,-17.970318883978656,87.38693536569323,,33.67,8125,1025.58
6048.0,2024-03-28 06:00,,Spring,8.65,66.0,0.0,Clear,54.87,9295,1014.81
6049.0,28/03/2024 08AM,London,Spring,16.26,43.0,0.0,Clear,,8964,1010.76
6050.0,2024-03-28T10:00Z,London,Spring,-49.300376231661225,52.0,,Snow,0.39,2460,1102.956568654995
6051.0,,London,Spring,16.23,75.0,0.0,Clear,19.74,11190,875.6825641167172
6052.0,28/03/2024 02PM,London,Spring,10.31,,1.72,Clear,62.03,10404,1124.147633233285
6053.0,2024-03-28 16:00,London,Spring,18.12,,,Clear,73.5,9686,1024.25
,2024-03-28T18:00Z,London,Spring,,74.0,0.0,Clear,56.79,9044,1007.11
6055.0,2024-03-28T20:00Z,London,Spring,11.53,30.0,0.0,Clear,74.47,9109,1021.33
6056.0,28/03/2024 10PM,London,Spring,17.35,62.0,,Clear,37.21,10551,1007.94
6057.0,2024-03-29T00:00Z,London,Spring,15.48,75.0,0.0,Clear,79.72,9979,1008.87
6058.0,,London,Spring,9.89,75.0,0.0,Clear,5.18,8153,1100.0507266237664
6059.0,29/03/2024 04AM,London,Spring,10.73,67.0,0.0,Clear,61.4,11331,1011.86
6060.0,2024-03-29T06:00Z,London,Spring,15.12,172.1839025842025,0.0,Clear,60.08,11968,
6061.0,2024-03-29 08:00,London,Spring,15.78,66.0,5.3,Clear,192.0716399313927,unknown,1009.5
6062.0,2024-03-29T10:00Z,London,Spring,,,19.28,Rain,53.79,6604,979.52
6063.0,29/03/2024 12PM,London,Spring,16.6,58.0,0.0,Clear,64.52,49979.488780796004,893.579792676296
6064.0,29/03/2024 02PM,,Spring,5.15,59.0,,Fog,6.92,9507,1012.32
6065.0,29/03/2024 04PM,London,Spring,10.99,43.0,0.0,Clear,42.62,11157,1025.81
6066.0,2024-03-29T18:00Z,London,,24.3,157.8048518193094,72.73,Storm,53.71,,975.01
6067.0,2024-03-29T20:00Z,London,Spring,19.03,56.0,215.6958398197149,Rain,24.2,2822,978.92
6068.0,29/03/2024 10PM,London,Spring,8.06,65.0,9.45,Clear,6.42,10088,1016.97
,2024-03-30 00:00,London,Spring,11.52,55.0,0.0,Clear,39.54,10363,995.69
6070.0,30/03/2024 02AM,London,Spring,12.05,52.0,0.0,Clear,54.13,9379,998.04
6071.0,2024-03-30T04:00Z,,Spring,12.05,33.0,95.16662786619887,Storm,13.42,8696,
6072.0,,London,Winter,5.39,41.0,0.0,Clear,73.92,10572,1010.56
6073.0,2024-03-30 08:00,London,Spring,,56.0,0.0,Clear,187.27106020126672,9783,1000.2
6074.0,2024-03-30T10:00Z,London,Spring,16.8,,6.64,Clear,35.4,8370,1011.59
6075.0,30/03/2024 12PM,London,Spring,12.55,,17.21,Rain,48.66,3057,998.36
6076.0,2024-03-30T14:00Z,London,Spring,18.02,-14.94047569882158,0.0,Clear,58.77,,1020.18
,30/03/2024 04PM,London,Spring,15.53,153.06558018808363,25.17,Rain,362.8906230095393,unknown,998.09
6078.0,30/03/2024 06PM,London,,16.26,69.0,5.13,Clear,,8494,1019.59
6079.0,30/03/2024 08PM,London,Spring,12.25,69.0,3.28,,73.47,11943,995.62
6080.0,,London,Winter,11.54,70.0,0.0,Clear,31.09,8742,1019.63
6081.0,31/03/2024 12AM,London,Spring,,-31.964029843504463,0.0,Clear,69.98,8242,1024.99
6082.0,2024-03-31 02:00,,Spring,17.24,72.0,0.0,Clear,56.31,49975.77103829827,992.6
6083.0,31/03/2024 04AM,London,Spring,18.35,77.0,222.67591787543276,Rain,18.89,120021.24110529949,1002.91
6084.0,2024-03-31 06:00,London,Spring,18.72,61.0,5.27,Fog,36.34,10762,1008.17
6085.0,2024-03-31 08:00,London,Spring,9.29,55.0,0.0,Clear,374.04825011014594,,1020.34
6086.0,31/03/2024 10AM,,Spring,17.12,70.0,84.46197289180034,Rain,23.63,1710,973.48
6087.0,2024-03-31T12:00Z,London,Spring,,41.0,200.2063674155506,Rain,362.8758879885441,10554,995.32
6088.0,31/03/2024 02PM,London,Spring,6.64,71.0,13.65,Rain,64.03,5456,1004.11
6089.0,2024-03-31T16:00Z,London,Spring,12.76,32.0,0.0,Clear,27.5,9782,1004.46
6090.0,31/03/2024 06PM,London,Spring,12.53,77.0,0.0,Clear,51.15,11973,881.2381998173455
6091.0,31/03/2024 08PM,London,Spring,11.62,54.0,0.0,Clear,56.54,49980.19017988299,1022.86
6092.0,2024-03-31T22:00Z,London,Spring,77.79680864857099,46.0,200.38063149997393,Storm,139.42,2677,974.4
,2024-04-01T00:00Z,London,Spring,,31.0,0.0,Clear,47.98,9457,1015.08
6094.0,2024-04-01 02:00,London,Spring,17.13,67.0,7.12,Fog,355.359657689468,120000.34450186227,1017.43
6095.0,01/04/2024 04AM,London,Winter,4.43,-24.721747327665184,0.0,Snow,30.21,2482,1024.35
6096.0,01/04/2024 06AM,London,Winter,0.23,52.0,0.0,Clear,,,1000.93
6097.0,2024-04-01 08:00,London,Spring,15.91,35.0,0.0,Clear,7.85,???,1017.29
6098.0,01/04/2024 10AM,London,Winter,-3.1,77.0,0.0,Snow,13.35,7989,991.92
6099.0,01/04/2024 12PM,London,Winter,,,6.92,Clear,52.19,11501,1014.28
6100.0,,London,Spring,,48.0,0.0,Clear,5.97,11538,993.89
6101.0,,London,Winter,13.11,41.0,0.0,Clear,36.17,8184,1008.32
6102.0,2024-04-01T18:00Z,London,Spring,18.44,60.0,0.0,Clear,12.56,10790,993.83
6103.0,,London,Autumn,13.13,91.0,74.95,Storm,38.31,11751,957.63
6104.0,01/04/2024 10PM,London,Winter,10.97,81.0,50.84,Storm,22.01,,962.65
6105.0,02/04/2024 12AM,London,Winter,,68.0,0.0,Clear,0.58,9523,997.46
6106.0,2024-04-02 02:00,London,Spring,16.71,33.0,96.9977802385248,Rain,,419,984.99
6107.0,02/04/2024 04AM,London,Winter,-0.05,71.0,0.0,,76.39,,1032.17
6108.0,02/04/2024 06AM,London,Winter,6.32,,1.74,Fog,29.7,7623,1020.74
6109.0,2024-04-02T08:00Z,London,Spring,12.06,74.0,0.0,Clear,73.8,10015,1015.78
6110.0,2024-04-02 10:00,London,Spring,11.69,79.0,1.63,Fog,,5406,1011.24
6111.0,02/04/2024 12PM,,Winter,12.32,40.0,0.0,Clear,49.15,11355,1021.44
6112.0,2024-04-02T14:00Z,London,Spring,17.43,32.0,0.0,Clear,1.92,10565,1023.79
6113.0,02/04/2024 04PM,London,Winter,7.98,78.0,1.3,Clear,77.15,8120,994.69
6114.0,2024-04-02 18:00,London,,4.38,,,Fog,10.11,,1028.43
,02/04/2024 08PM,London,Winter,6.74,57.0,0.0,Clear,178.63349129623973,11564,1024.08
6116.0,02/04/2024 10PM,London,Winter,10.48,45.0,87.8325503550346,Rain,49.65,120007.354279703,
6117.0,2024-04-03T00:00Z,London,Spring,9.99,68.0,0.0,Clear,,11099,1007.87
6118.0,03/04/2024 02AM,London,Spring,7.7,38.0,0.0,Clear,19.87,unknown,1025.71
6119.0,03/04/2024 04AM,London,Spring,17.68,42.0,0.0,Clear,26.39,N/A,
6120.0,2024-04-03 06:00,London,Spring,,48.0,0.0,Clear,,11933,1021.61
6121.0,2024-04-03 08:00,London,Spring,13.37,53.0,0.0,Clear,365.3190363861846,,
6122.0,03/04/2024 10AM,,Spring,71.41979071927648,55.0,0.0,Clear,69.63,11914,1000.25
6123.0,2024-04-03T12:00Z,London,,3.24,,12.22,Snow,45.65,735,
,03/04/2024 02PM,London,Spring,11.18,77.0,0.0,Clear,55.95,9781,1019.12
6125.0,2024-04-03T16:00Z,London,Spring,13.99,68.0,10.7,Rain,13.5,7680,991.55
6126.0,2024-04-03T18:00Z,London,Spring,14.4,30.0,0.0,Clear,31.09,11926,1011.51
6127.0,2024-04-03T20:00Z,London,Spring,8.99,33.0,0.0,Clear,,10014,1029.57
6128.0,03/04/2024 10PM,London,Spring,18.7,72.0,0.0,Clear,,8274,1005.82
6129.0,2024-04-04 00:00,London,Spring,-48.61599870731518,42.0,,Snow,40.81,120014.29122909364,1032.56
6130.0,,London,Winter,14.78,85.0,0.0,Clear,68.34,9143,993.83
6131.0,2024-04-04T04:00Z,London,,,54.0,0.0,Clear,66.55,N/A,
6132.0,2024-04-04T06:00Z,,,-36.710668486198436,,1.54,Clear,43.98,11371,1017.88
6133.0,04/04/2024 08AM,London,,12.41,25.0,83.89507110039752,Storm,54.49,9937,964.62
6134.0,2024-04-04T10:00Z,London,Spring,,,10.45,Clear,14.42,11290,999.25
6135.0,2024-04-04 12:00,London,Spring,-47.58000027605417,36.0,0.0,Clear,42.27,8452,1122.6479677604127
6136.0,,London,Spring,10.87,56.0,0.0,Clear,24.21,error,1000.54
6137.0,2024-04-04 16:00,London,Spring,11.61,75.0,0.0,Clear,73.63,9839,1004.96
,2024-04-04 18:00,London,Spring,19.52,78.0,0.0,Clear,61.96,120024.87563824083,1120.4155350583978
6139.0,2024-04-04T20:00Z,London,Spring,10.32,66.0,0.0,Clear,,10654,1027.67
6140.0,2024-04-04 22:00,London,Spring,14.86,34.0,,,48.51,10406,
6141.0,05/04/2024 12AM,London,Spring,10.17,74.0,,Fog,37.13,626,1020.92
6142.0,2024-04-05T02:00Z,,Spring,10.86,67.0,0.0,Clear,29.47,11824,1001.29
6143.0,2024-04-05 04:00,London,Spring,18.19,60.0,0.0,Clear,40.77,8977,1027.14
6144.0,05/04/2024 06AM,London,Spring,12.05,-29.996326964053885,0.0,Clear,11.9,9721,
6145.0,2024-04-05T08:00Z,London,Spring,10.9,76.0,12.8,Rain,22.14,240,998.36
6146.0,2024-04-05T10:00Z,London,Spring,11.9,30.0,0.0,Clear,29.88,11954,1018.99
6147.0,2024-04-05T12:00Z,,Spring,9.79,,11.75,Rain,2.77,9710,991.52
6148.0,05/04/2024 02PM,London,Spring,16.39,71.0,96.45268646754037,Storm,113.92,587,982.68
6149.0,2024-04-05T16:00Z,London,Spring,19.57,80.0,32.75,Rain,199.44199730402158,2534,878.0860157367828
6150.0,2024-04-05T18:00Z,London,Spring,62.084000734751896,72.0,215.6055627252754,Rain,3.97,,973.99
6151.0,,London,Spring,14.5,54.0,0.0,Clear,42.3,8894,1004.39
6152.0,2024-04-05 22:00,London,Spring,16.39,71.0,0.0,Clear,14.21,11335,1017.42
6153.0,06/04/2024 12AM,London,,2.52,70.0,0.0,,9.66,9236,1014.77
6154.0,2024-04-06T02:00Z,London,Spring,71.5837779243696,68.0,0.0,Clear,73.05,8506,987.66
,2024-04-06 04:00,London,Spring,8.27,64.0,3.56,Clear,11.8,8713,993.27
6156.0,06/04/2024 06AM,London,Summer,-45.378371061824666,28.0,0.0,Clear,42.82,9618,1038.85
6157.0,06/04/2024 08AM,London,Summer,,33.0,,Fog,11.57,3370,1022.43
,06/04/2024 10AM,London,Summer,27.74,64.0,8.72,Clear,51.85,9881,990.85
6159.0,06/04/2024 12PM,London,Summer,69.1803931777949,25.0,0.0,Clear,25.5,8028,875.1532488918331
6160.0,2024-04-06T14:00Z,London,Spring,18.69,54.0,0.0,Clear,74.75,10502,1001.18
6161.0,2024-04-06 16:00,London,Spring,-53.31697766650119,67.0,0.0,,32.86,11524,1016.08
6162.0,2024-04-06 18:00,London,Spring,18.82,38.0,0.0,Clear,372.0879925332673,10594,1010.64
6163.0,2024-04-06T20:00Z,London,Spring,17.91,77.0,93.73011222429085,Storm,5.63,1132,979.02
6164.0,,London,Winter,-4.63,63.0,0.0,Snow,187.94489619541739,4650,996.92
6165.0,2024-04-07 00:00,,Spring,14.96,49.0,,Clear,,8452,1004.66
6166.0,2024-04-07 02:00,London,Spring,8.48,74.0,,Fog,72.5,1520,1016.25
6167.0,2024-04-07T04:00Z,London,Spring,7.41,32.0,0.0,Clear,,9868,994.54
6168.0,07/04/2024 06AM,London,,18.79,82.0,0.0,Clear,51.0,9481,1014.04
,2024-04-07 08:00,London,Spring,9.71,38.0,,Fog,,10944,1002.78
6170.0,2024-04-07T10:00Z,London,Spring,12.02,64.0,0.0,Clear,77.87,9865,990.37
,2024-04-07 12:00,London,Spring,6.58,64.0,207.7656288728028,Storm,78.8,3119,995.2
6172.0,2024-04-07 14:00,London,Spring,8.36,38.0,0.0,Clear,69.99,49994.39496864696,1028.42
6173.0,2024-04-07T16:00Z,London,Spring,8.92,153.03029941493313,219.1950950729841,,21.14,10089,1101.4217374886523
6174.0,2024-04-07T18:00Z,London,Spring,10.72,80.0,203.8708953569652,Rain,50.96,1094,1104.4134052610746
6175.0,07/04/2024 08PM,London,Summer,28.71,36.0,0.0,Clear,77.07,10503,1006.52
6176.0,07/04/2024 10PM,London,Summer,23.25,23.0,0.0,Clear,77.4,10273,891.7415776731092
6177.0,2024-04-08 00:00,London,Spring,,73.0,0.0,Clear,23.58,9938,1001.41
6178.0,08/04/2024 02AM,,,13.04,85.0,0.0,Clear,64.5,11216,1004.07
6179.0,,London,,4.71,65.0,215.36240742624446,Snow,59.45,7504,1018.85
6180.0,2024-04-08T06:00Z,London,Spring,15.11,46.0,0.0,Clear,73.97,11728,1000.5
6181.0,08/04/2024 08AM,London,Summer,31.9,66.0,11.19,Clear,10.62,8661,995.77
6182.0,08/04/2024 10AM,London,Summer,69.73596728152715,,78.39643204721612,Storm,123.84,11817,981.3
6183.0,08/04/2024 12PM,London,Summer,30.5,66.0,0.0,Clear,14.97,8565,890.7008004610689
6184.0,2024-04-08T14:00Z,,Spring,16.85,161.91006661367163,22.71,Rain,2.43,9913,1017.22
6185.0,,London,Spring,11.81,70.0,0.0,,,49993.82935932302,1023.81
,2024-04-08T18:00Z,London,,-39.482965635707046,99.0,0.0,Clear,15.73,,1024.2
6187.0,2024-04-08 20:00,London,Spring,5.71,61.0,0.0,Clear,79.27,120022.71829479146,999.92
6188.0,08/04/2024 10PM,London,Summer,,70.0,0.0,,76.35,11591,1027.16
6189.0,2024-04-09T00:00Z,London,Spring,76.96961010987762,74.0,0.0,Clear,42.63,120023.43100541024,986.05
6190.0,09/04/2024 02AM,London,Autumn,,60.0,0.0,Clear,47.81,9011,990.58
,2024-04-09 04:00,London,Spring,10.6,57.0,,Clear,75.88,11179,1005.58
6192.0,TBD,London,Autumn,22.25,73.0,,Clear,26.69,120000.77065382194,1000.75
6193.0,2024-04-09 08:00,,Spring,15.98,73.0,0.0,,187.4679917976923,9138,1007.81
6194.0,09/04/2024 10AM,London,Autumn,10.67,92.0,0.0,Clear,186.9502342693271,8025,1004.99
6195.0,09/04/2024 12PM,London,Autumn,14.78,54.0,0.0,Clear,16.58,8659,1013.05
6196.0,09/04/2024 02PM,London,,13.83,,14.37,Clear,73.89,9089,
6197.0,,London,Winter,11.38,65.0,0.0,Clear,65.31,,1123.2081400867594
6198.0,09/04/2024 06PM,London,,10.91,86.0,0.0,Clear,,10866,1006.57
6199.0,2024-04-09T20:00Z,London,Spring,5.52,49.0,,Clear,7.02,8777,999.56
6200.0,09/04/2024 10PM,London,Autumn,10.03,81.0,20.74,Rain,36.6,4711,883.7274376244991
6201.0,2024-04-10 00:00,London,Spring,17.61,75.0,223.08559140951678,Rain,55.4,9770,1000.87
6202.0,2024-04-10T02:00Z,London,Spring,17.9,67.0,0.0,,373.26369971348805,10485,1029.87
6203.0,TBD,London,Autumn,23.3,73.0,0.0,Clear,66.1,,1003.46
6204.0,2024-04-10 06:00,London,Spring,15.98,73.0,1.75,,21.89,9218,
6205.0,2024-04-10 08:00,London,Spring,17.82,,,Clear,7.7,10824,1020.26
6206.0,10/04/2024 10AM,London,Autumn,13.88,70.0,14.13,Rain,54.67,,966.48
6207.0,,London,Spring,17.82,51.0,0.0,Clear,70.77,10472,1026.76
6208.0,2024-04-10T14:00Z,London,Spring,-50.481006971695315,35.0,,Fog,,error,1010.05
,2024-04-10T16:00Z,London,Spring,6.39,-19.268716508476793,0.0,Clear,19.12,10077,1026.87
,10/04/2024 06PM,London,,17.64,47.0,0.0,Clear,38.07,10259,1012.11
6211.0,2024-04-10T20:00Z,London,Spring,9.31,78.0,0.0,Clear,59.89,10027,1020.25
6212.0,10/04/2024 10PM,London,Autumn,19.07,76.0,14.0,Rain,59.52,120004.60028964482,992.41
6213.0,2024-04-11 00:00,London,Spring,-44.258907119392425,41.0,0.0,Clear,44.77,10614,1039.16
,2024-04-11T02:00Z,London,Spring,13.52,31.0,0.0,Clear,48.28,10700,1009.95
6215.0,11/04/2024 04AM,London,Autumn,12.84,64.0,14.55,Rain,54.58,7448,987.58
6216.0,2024-04-11T06:00Z,London,Spring,14.48,56.0,0.0,Clear,58.21,10785,1025.01
6217.0,11/04/2024 08AM,London,Autumn,-42.16995187180944,85.0,0.0,Clear,21.75,8077,1031.85
6218.0,2024-04-11T10:00Z,London,Spring,,65.0,0.0,Clear,9.7,49995.8144712802,1009.76
,,London,Spring,-42.470644570070846,-20.501494985184415,0.0,Snow,50.97,616,999.3
6220.0,,London,,23.2,,13.98,Clear,6.33,11619,1027.56
,11/04/2024 04PM,London,Autumn,11.25,89.0,0.0,Clear,10.67,,999.5
6222.0,2024-04-11 18:00,London,Spring,14.62,37.0,221.76086561944126,,18.67,9846,
,2024-04-11T20:00Z,London,Spring,7.51,,8.92,Fog,59.36,2546,1020.16
6224.0,,,Summer,31.43,,,,25.79,8670,1112.6051906962884
6225.0,TBD,,Winter,2.85,61.0,,Fog,51.3,1965,
,12/04/2024 02AM,London,,-47.42877847674165,-17.168571309759976,0.0,Clear,53.46,9801,1022.25
6227.0,12/04/2024 04AM,London,Winter,,55.0,,,60.25,9666,
,,London,,-46.72234571071316,81.0,0.0,,56.32,11579,1005.44
6229.0,2024-04-12T08:00Z,London,Spring,12.86,53.0,0.0,Clear,70.11,9935,
6230.0,2024-04-12T10:00Z,London,Spring,17.0,64.0,0.0,Clear,31.43,8317,1016.46
6231.0,2024-04-12 12:00,London,Spring,18.42,33.0,0.0,,,8803,1003.73
,12/04/2024 02PM,London,Winter,-45.90484280827087,47.0,0.0,Clear,6.72,9085,1019.12
6233.0,2024-04-12 16:00,London,Spring,10.68,34.0,0.0,Clear,51.33,8729,1029.63
6234.0,2024-04-12T18:00Z,London,Spring,16.47,,6.32,Clear,17.62,,1028.31
6235.0,2024-04-12 20:00,,,7.53,50.0,0.0,Clear,24.68,11772,1007.03
6236.0,2024-04-12T22:00Z,London,Spring,11.69,39.0,0.0,Clear,,,1013.25
6237.0,2024-04-13 00:00,London,,72.01494450961378,99.0,0.0,Clear,176.99870900516837,,998.48
6238.0,2024-04-13T02:00Z,London,Spring,18.97,47.0,0.0,Clear,39.07,8277,1004.73
6239.0,13/04/2024 04AM,London,Spring,12.06,61.0,4.21,Fog,48.07,,1013.47
6240.0,2024-04-13 06:00,London,Spring,10.12,38.0,0.0,Clear,355.28697601654125,11757,876.4235114843776
6241.0,13/04/2024 08AM,London,Spring,81.36513446968478,-15.345549693974906,0.0,Clear,64.09,10989,1012.92
6242.0,13/04/2024 10AM,London,Spring,17.9,76.0,2.06,Fog,,11490,1020.06
6243.0,13/04/2024 12PM,London,Spring,14.36,67.0,1.84,,0.07,49978.58755409994,1002.8
6244.0,2024-04-13 14:00,London,Spring,12.23,,2.62,,355.11232787062625,10159,997.55
6245.0,2024-04-13 16:00,,Spring,5.62,34.0,,Clear,66.26,,1016.0
6246.0,2024-04-13 18:00,London,Spring,6.31,33.0,223.2449925347239,Rain,39.89,9868,972.57
6247.0,13/04/2024 08PM,London,Spring,,54.0,0.0,,49.46,,
6248.0,2024-04-13 22:00,London,Spring,8.76,-17.067466134927493,0.0,Clear,65.2,11704,1012.5
6249.0,2024-04-14T00:00Z,London,,80.62632282785808,,4.58,Clear,61.47,10173,1015.76
6250.0,2024-04-14T02:00Z,London,,20.36,94.0,0.0,Clear,61.4,49982.57897531111,1025.04
6251.0,2024-04-14 04:00,London,Spring,12.05,157.53152898992423,75.33,Storm,59.43,9890,
6252.0,,London,Autumn,,67.0,5.83,Clear,60.82,9386,1017.2
6253.0,2024-04-14T08:00Z,London,Spring,10.47,56.0,0.0,Clear,33.65,8057,1002.54
,14/04/2024 10AM,London,Spring,,39.0,98.71988299215666,Storm,44.64,5678,967.29
6255.0,14/04/2024 12PM,London,Spring,18.13,52.0,0.0,,9.64,49980.09498752151,1014.24
,2024-04-14 14:00,London,Spring,,80.0,0.0,Clear,28.22,8680,875.2099953290253
6257.0,,London,Spring,12.86,74.0,0.0,Clear,367.2625470446042,,1023.72
6258.0,14/04/2024 06PM,London,Spring,13.43,72.0,,Fog,2.4,6898,885.3536449282723
6259.0,2024-04-14 20:00,London,Spring,5.74,,4.5,Clear,8.61,8516,1017.55
6260.0,2024-04-14T22:00Z,London,Spring,12.52,34.0,0.0,Clear,49.81,8655,1010.21
6261.0,2024-04-15 00:00,London,Spring,,55.0,0.0,Clear,40.65,11297,1012.7
,2024-04-15 02:00,London,Spring,8.95,77.0,0.0,Clear,31.61,11458,990.66
6263.0,2024-04-15T04:00Z,London,Spring,11.0,43.0,0.0,Clear,60.54,unknown,996.17
6264.0,,London,Autumn,,155.58736658215827,,Clear,46.23,8900,997.97
6265.0,15/04/2024 08AM,London,,19.22,64.0,0.0,Clear,32.64,9845,
6266.0,15/04/2024 10AM,London,Spring,12.43,33.0,0.0,,,11280,1006.78
6267.0,2024-04-15T12:00Z,London,,-51.94624527693115,,0.51,Clear,41.52,11105,1029.14
6268.0,2024-04-15 14:00,London,Spring,8.16,,4.38,Fog,74.6,120016.40538834815,1004.13
6269.0,2024-04-15 16:00,London,Spring,11.73,32.0,0.0,Clear,35.81,8148,996.61
6270.0,2024-04-15 18:00,London,Spring,5.25,60.0,,Clear,32.6,10595,884.5469808657385
6271.0,15/04/2024 08PM,London,Spring,6.76,34.0,86.22690931074166,Storm,65.02,2278,968.91
6272.0,2024-04-15 22:00,London,Spring,12.33,71.0,0.0,Clear,357.0450977564208,,1019.8
6273.0,16/04/2024 12AM,London,Spring,12.77,38.0,0.0,,9.0,8421,1007.31
6274.0,16/04/2024 02AM,London,Spring,,56.0,0.0,Clear,,9061,997.1
6275.0,2024-04-16T04:00Z,,Spring,8.04,64.0,0.0,Clear,36.17,9381,1027.54
6276.0,2024-04-16 06:00,London,Spring,16.08,54.0,0.0,Clear,55.04,11926,1018.93
6277.0,2024-04-16T08:00Z,London,Spring,12.04,74.0,0.0,Clear,12.4,11252,1028.5
6278.0,16/04/2024 10AM,London,Spring,,62.0,12.81,Clear,351.27914899783957,8114,1010.2
6279.0,Unknown,London,Autumn,7.01,95.0,,Fog,43.19,120020.60013858102,884.0375152499182
6280.0,16/04/2024 02PM,London,Spring,8.2,159.68612265621877,37.59,,75.57,10111,1025.45
6281.0,16/04/2024 04PM,,Spring,17.88,152.4480330549533,0.0,Clear,41.93,120011.34287018614,1024.14
6282.0,,London,Summer,11.99,46.0,0.0,Clear,,9072,1010.44
6283.0,16/04/2024 08PM,London,Spring,11.25,48.0,0.0,Clear,6.09,9121,1010.99
6284.0,2024-04-16 22:00,London,,13.92,23.0,,Fog,7.54,49994.00891015619,1119.9910174806353
6285.0,,London,Spring,15.07,71.0,0.0,Clear,69.84,9708,1028.59
6286.0,17/04/2024 02AM,London,Spring,8.48,45.0,,Clear,48.03,8943,991.89
6287.0,17/04/2024 04AM,,Spring,13.76,65.0,,Fog,,108,1016.84
6288.0,2024-04-17T06:00Z,London,Spring,12.32,60.0,0.0,,9.99,N/A,1011.11
6289.0,17/04/2024 08AM,London,Spring,16.71,30.0,,Fog,63.59,5233,996.15
6290.0,2024-04-17 10:00,London,Spring,,55.0,0.0,Clear,73.44,8210,1007.09
6291.0,,London,Summer,19.64,52.0,219.071823913246,Storm,3.34,4833,971.0
6292.0,2024-04-17T14:00Z,London,Spring,,78.0,0.0,Clear,29.17,9963,
6293.0,17/04/2024 04PM,London,Spring,13.12,33.0,0.0,Clear,77.31,120022.7976894307,1025.91
